#CODE;ENGLISH;FRENCH;GERMAN;;SPANISH;;;;;;;;;x
EVTOPTCFREECITIES202;I have no say in the matter;Je n'ai rien à opposer à cette décision;;;No tengo nada que decir;;;;;;;;;x
EVTOPTBFREECITIES202;No, what would that achieve?;Je m'y oppose. A quoi cela servirait-il ?;;;No, qué lograría eso?;;;;;;;;;x
EVTDESCFREECITIES203;A great famine has struck [From.PrimaryTitle.GetName], many are dying and the people are on the verge of riot. [From.GetTitledFirstName] has decided that this crisis demands that the high nobles of the city offer up their own children to placate the Black Goat, that he might relieve the city.;Une grande famine a frappé [Root.PrimaryTitle.GetName], beaucoup de gens agonisent et le peuple est proche de la révolte. [From.GetTitledFirstName] a décidé que cette crise exige que les hauts nobles de la ville donnent leurs propres enfants en offrande à la Chèvre Noire pour qu'elle épargne la ville. ;;;Una terrible hambruna ha afectado a [From.PrimaryTitle.GetName], muchos de sus habitantes se están muriendo de hambre y están al borde de una revuelta. [From.GetTitledFirstName] ha decidido que esta crisis exige que los nobles de la ciudad ofrezcan sus propios hijos a la Cabra Negra para que alivie la situación de la ciudad.;;;;;;;;;x
EVTDESCFREECITIES203B;[From.PrimaryTitle.GetName] is under attack, are enemies have the upper hand. [From.GetTitledFirstName] has decided that this crisis demands that the high nobles of the city offer up their own children to placate the Black Goat, that he might defend the city.;[Root.PrimaryTitle.GetName] est attaqué(e) et les ennemis sont en train de l'emporter. [From.GetTitledFirstName] a décidé que cette crise exige que les hauts nobles de la ville donnent leurs propres enfants en offrande à la Chèvre Noire pour qu'elle défende la ville.;;;[From.PrimaryTitle.GetName] está bajo ataque, y los enemigos nos están superando. [From.GetTitledFirstName] ha decidido que esta crisis exige que los nobles de la ciudad ofrezcan sus propios hijos a la Cabra Negra para que defienda la ciudad.;;;;;;;;;x
EVTDESCFREECITIES203C;Who shall be your sacrifice to the Black Goat?;Qui sera sacrifié(e) pour la Chèvre Noire ?;;;Cuál será tu sacrificio para la Cabra Negra?;;;;;;;;;x
EVTOPTAFREECITIES203;[black_goat_sacrifice_1.GetTitledFirstName] shall be my sacrifice;[black_goat_sacrifice_1.GetTitledFirstName] sera mon sacrifice;;;[black_goat_sacrifice_1.GetTitledFirstName] será mi sacrificio;;;;;;;;;x
EVTOPTBFREECITIES203;I offer [black_goat_sacrifice_2.GetTitledFirstName];J'offre [black_goat_sacrifice_2.GetTitledFirstName];;;Ofrezco a [black_goat_sacrifice_2.GetTitledFirstName];;;;;;;;;x
EVTOPTCFREECITIES203;[black_goat_sacrifice_3.GetTitledFirstName];[black_goat_sacrifice_3.GetTitledFirstName];;;[black_goat_sacrifice_3.GetTitledFirstName];;;;;;;;;x
EVTOPTDFREECITIES203;[black_goat_sacrifice_4.GetTitledFirstName]'s blood shall placate the Black Goat;Le sang de [black_goat_sacrifice_4.GetTitledFirstName] sera offert à la Chèvre Noire;;;La sangre de [black_goat_sacrifice_4.GetTitledFirstName] aplacará a la Cabra Negra;;;;;;;;;x
EVTDESCFREECITIES204;All the nobles of [Root.PrimaryTitle.GetName] have chosen their sacrifices, all are bound and placed upon a the altars in the temple of the Black Goat. The priests perform elaborate rites and prayers, asking for the Black Goat's mercy in relieving the famine. All the sacrifices throats are then slit in turn, a river blood forming upon the altars.;Tous les nobles de [Root.PrimaryTitle.GetName] ont choisi leurs victimes sacrificielles. Ces dernières sont ligotées et placées sur les autels du temple de la Chèvre Noire. Les prêtres exécutent leurs rituels sacrés et leurs prières, demandant la miséricorde de la Chèvre Noire en épargnant la ville de ce fléau. Les victimes sont égorgées et une rivière de sang afflue sur les autels. ;;;Todos los nobles de [Root.PrimaryTitle.GetName] han elegido sus sacrificios, que están situados sobre el altar en el templo de la Cabra Negra. Los sacerdotes realizan sus rituales y oraciones, rogando a la Cabra Negra misericordia para aliviar la hambruna. Todas las gargantes se cortaron a la vez, formando un río de sangre sobre el altar.;;;;;;;;;x
EVTDESCFREECITIES204B;All the nobles of [Root.PrimaryTitle.GetName] have chosen their sacrifices, all are bound and placed upon a the altars in the temple of the Black Goat. The priests perform elaborate rites and prayers, asking the Black Goat to defend the city aginst its enemies. All the sacrifices throats are then slit in turn, a river blood forming upon the altars.;Tous les nobles de [Root.PrimaryTitle.GetName] ont choisi leurs victimes sacrificielles. Ces dernières sont ligotées et placées sur les autels du temple de la Chèvre Noire. Les prêtres exécutent leurs rituels sacrés et leurs prières, demandant la miséricorde de la Chèvre Noire en défendant la ville de ses ennemis. Les victimes sont égorgées et une rivière de sang afflue sur les autels. ;;;Todos los nobles de [Root.PrimaryTitle.GetName] han elegido sus sacrificios, que están situados sobre el altar en el templo de la Cabra Negra. Los sacerdotes realizan sus rituales y oraciones, rogando a la Cabra Negra que defienda la ciudad contra los enemigos. Todas las gargantes se cortaron a la vez, formando un río de sangre sobre el altar.;;;;;;;;;x
EVTOPTAFREECITIES204;Our zeal will surely please the dark god;Notre ferveur fera sûrement plaisir au dieu sombre;;;Nuestro celo complacerá al Dios oscuro;;;;;;;;;x
EVTDESCfeast.33;The Black Goat demands daily blood sacrifice. Calves, bullocks, and horses are the animals most often brought before the Black Goat’s altars, but on holy days condemned criminals may go beneath the knives of the cowled priests. Your feast should therefore perform such a sacrifice at dawn before the feast.;La Chèvre Noire exige un sacrifice sanglant quotidien. La plupart du temps, des veaux, des taureaux et des chevaux sont amenés aux autels de la Chèvre Noire mais lors des jours sacrés, on fait venir des criminels condamnés pour finir sous les lames des prêtres encapuchonnés. Votre fête nécessite qu'un tel sacrifice soit fait à l'aube, avant les festivités. ;;;La Cabra Negra exige sacrificios de sangre diarios. Terneros, bueyes y caballos son los animales más a menudo sacrificados en los altares de la Cabra Negra, pero en los días santos los criminales condenados pueden ser pasados por debajo de los cuchillos de los sacerdotes encapuchados. Por ello debe celebrarse un sacrificio al alba del día anterior del festejo.;;;;;;;;;x
EVTOPTAfeast.33;Some criminals from the dungeons;Quelques criminels en provenance des cachots;;;Algunos criminales de las mazmorras;;;;;;;;;x
EVTOPTBfeast.33;I will offer some animals;Je vais offrir quelques animaux;;;Ofreceré algunos animales;;;;;;;;;x
EVTOPTCfeast.33;No, that is an archaic practice;Non, c'est une pratique archaïque;;;No, es una práctica arcaica;;;;;;;;;x
EVTDESCfeast.34;The Black Goat demands daily blood sacrifice. Calves, bullocks, and horses are the animals most often brought before the Black Goat’s altars, but on holy days condemned criminals may go beneath the knives of the cowled priests. As it is a holy day, [From.GetTitledFirstName] has chosen to offer criminals from [From.GetHerHis] dungeon,. Their throats are slit upon the altars at dawn before the feast.;La Chèvre Noire exige un sacrifice sanglant quotidien. La plupart du temps, des veaux, des taureaux et des chevaux sont amenés aux autels de la Chèvre Noire mais lors des jours sacrés, on fait venir des criminels condamnés pour finir sous les lames des prêtres encapuchonnés. Comme c'est un jour sacré, [From.GetTitledFirstName] a choisi d'offrir des criminels en provenance de ses cachots. A l'aube, ils sont égorgés sur les autels avant les festivités.;;;La Cabra Negra exige sacrificios de sangre diarios. Terneros, bueyes y caballos son los animales más a menudo sacrificados en los altares de la Cabra Negra, pero en los días santos los criminales condenados pueden ser pasados por debajo de los cuchillos de los sacerdotes encapuchados. Como es un día santo, [From.GetTitledFirstName] ha elegido ofrecer criminales de sus mazmorras. Sus gargantas serán cortadas en el altar al alba del día anterior al festejo.;;;;;;;;;x
EVTOPTAfeast.34;The dark god shall be pleased;Le dieu sombre sera content;;;El dios oscuro estará complacido;;;;;;;;;x
EVTOPTAfeast.34B;What a grisly practice;Quelle tradition macabre;;;Que práctica tan espantosa;;;;;;;;;x
EVTDESCfeast.35;The Black Goat demands daily blood sacrifice. Calves, bullocks, and horses are the animals most often brought before the Black Goat’s altars, but on holy days condemned criminals may go beneath the knives of the cowled priests. [From.GetTitledFirstName] has chosen to bring many animals to the altars, where the priests slit their throats.;La Chèvre Noire exige un sacrifice sanglant quotidien. La plupart du temps, des veaux, des taureaux et des chevaux sont amenés aux autels de la Chèvre Noire mais lors des jours sacrés, on fait venir des criminels condamnés pour finir sous les lames des prêtres encapuchonnés. Comme c'est un jour sacré, [From.GetTitledFirstName] a choisi d'offrir des animaux. Les prêtres les égorgent sur les autels.;;;La Cabra Negra exige sacrificios de sangre diarios. Terneros, bueyes y caballos son los animales más a menudo sacrificados en los altares de la Cabra Negra, pero en los días santos los criminales condenados pueden ser pasados por debajo de los cuchillos de los sacerdotes encapuchados. [From.GetTitledFirstName] ha elegido llevar algunos animales a los altares, donde los sacerdotes cortan sus gargantas.;;;;;;;;;x
TOOLTIPFREECITIES203;[This.GetTitledFirstName] will be sacrificed;[This.GetTitledFirstName] sera offert(e) en sacrifice;;;[This.GetTitledFirstName] será sacrificado;;;;;;;;;x
EVTDESCfeast.36;Each year, to celebrate the founding of the city of Volantis, chariots race side by side along the battlements of the Black Walls. My guests would surely be impressed if I sponsored a this years race as entertainment for my feast?;Tous les ans, pour célébrer la fondation de la cité de Volantis, une course de chars a lieu sous les remparts du Mur Noir. Mes invités seraient sûrement impressionnés si, dans le cadre de ma fête, j'avais un attelage à la course de cette année ?;;;Cada año, para celebrar la fundación de la ciudad de Volantis, se celebra una carrera de carros en las almenas del Muro Negro. Mis invitados quedarán impresionados si patrocino la carrera de este año como entretenimiento para mi fiesta?;;;;;;;;;x
EVTOPTAfeast.36;Bring me the finest charioteers in Volantis!;Amenez moi les meilleurs auriges de Volantis !;;;Traedme a los mejores aurigas de Volantis!;;;;;;;;;x
EVTOPTBfeast.36;That would be too much for my feast;Dans le cadre de ma fête, ce serait sans doute exagéré;;;Eso sería demasiado para mi fiesta;;;;;;;;;x
EVTDESCfeast.37;The chariot race upon the Black Walls is about to begin. You and the guests watch as six four-horse chariots charge side by side around the great oval of fused black dragonstone. By the end everyone is most enthused, and as the feasting resumes you are thanked for this years sponsorship.;Sous les remparts du Mur Noir, la course de chars est sur le point de débuter. Vos invités et vous regardez les six quadriges foncer côte à côte sur le grand ovale de pierre fondue. A la fin, tout le monde est ravi du spectacle et votre fête reprend son cours normal, alors qu'on vous félicite d'avoir permis cet événement. ;;;La carrera de carros sobre el Muro Negro está a punto de comenzar. Tu y tus invitados veis como seis carruajes de cuatro caballos cargan de lado a lado alrededor del gran muro oval de piedra negra. Al final todo el mundo quedó entusiasmado, y al reanudar el baquete te agradecen el patrocinio de este año.;;;;;;;;;x
EVTOPTAfeast.37;I trust it was a fine spectacle;Je suis persuadé que c'était un spectacle de qualité;;;Confío en que sea un buen espectáculo;;;;;;;;;x
EVTDESCfeast.38;Each year, to celebrate the founding of the city of Volantis, chariots race along the Black Walls. [From.GetTitledFirstName] sponsored this years race, which was held before [From.GetHerHis] feast. Everyone watches as six four-horse chariots charge side by side around the great oval of fused black dragonstone. By the end everyone is most enthused!;Tous les ans, pour célébrer la fondation de la cité de Volantis, une course de chars a lieu sous les remparts du Mur Noir. [From.GetTitledFirstName] a permis que cet événement ait lieu, juste avant sa fête. Tout le monde regarde les six quadriges foncer côte à côte sur le grand ovale de pierre fondue. A la fin, tout le monde est ravi du spectacle !;;;Cada año, para celebrar la fundación de la ciudad de Volantis, se celebra una carrera de carros en las almenas del Muro Negro. [From.GetTitledFirstName] patrocina la carrera de este año, celebrada antes que su banquete. Todos ven como seis carruajes de cuatro caballos cargan de lado a lado alrededor del gran muro oval de piedra negra. Al final todo el mundo quedó entusiasmado;;;;;;;;;x
EVTOPTAfeast.38;What a race!;Quelle course !;;;Qué carrera!;;;;;;;;;x
TOOLTIPfree_cities.18;The Kingdom of the Three Daughters will be established as a Triarchy led by a King only in name comprised of Myr, Lys and Tyrosh who make up the High Council.\n;Le Royaume des Trois Filles sera établi en tant que Triarchie menée par un Roi honorifique. Le Haut-Conseil est composé de personnes venant de Myr, Lys et Tyrosh.\n;;;El Reino de las Tres Hijas  the Three Daughters se establecerá como una Triarquía dirigida por un rey decorativo controlado por un Alto Consejo compuesto por magísteres de Myr, Lys y Tyrosh.\n;;;;;;;;;x
EVTDESCAfree_cities.18;After winning the war against Volantis myself and my two allies have finally agreed that to protect our lands and trade from the other Free Cities we should establish a Triarchy of our own, made up of a High Council and one King in name only to lead our Kingdom of Three Daughters. The Three Daughters of Old Valyria!;Après avoir vaincu Volantis, mes deux alliés et moi-même ont décidé que, pour protéger nos terres et notre commerce des autres Cités libres, nous devons établir une Triarchie, rassemblant les Trois Filles de l'Ancienne Valyria. Le Royaume des Trois Filles sera composé d'un Haut-Conseil et sera dirigé par un roi honorifique. ;;;Tras la victoria en la guerra contra Volantis yo y mis dos aliados hemos acordado que para proteger nuestras tierras y el comercio de otras Ciudades Libres debemos establecer una Triarquía, compuesta por un Alto Consejo y un rey decorativo para dirigir nuestro Reino de las Tres Hijas. Las Tres Hijas de la Antigua Valyria!;;;;;;;;;x
EVTDESCBfree_cities.18;After winning the war against Volantis my liege and his two allies have finally agreed that to protect their lands and trade from the other Free Cities they should establish a Triarchy of their own, made up of a High Council and one King in name only to lead the Kingdom of Three Daughters. The Three Daughters of Old Valyria!;Après avoir vaincu Volantis, mon suzerain et ses deux alliés ont décidé que, pour protéger leurs terres et leur commerce des autres Cités libres, ils devaient établir une Triarchie, rassemblant les Trois Filles de l'Ancienne Valyria. Le Royaume des Trois Filles sera composé d'un Haut-Conseil et sera dirigé par un roi honorifique. ;;;Tras la victoria en la guerra contra Volantis mi Señor y sus dos aliados han acordado que para proteger sus tierras y el comercio de otras Ciudades Libres deben establecer una Triarquía, compuesta por un Alto Consejo y un rey decorativo para dirigir el Reino de las Tres Hijas. Las Tres Hijas de la Antigua Valyria!;;;;;;;;;x
EVTOPTAfree_cities.18;Our trade will be forever protected;Notre commerce sera protégé pour toujours;;;Nuestro comercio estará siempre protegido;;;;;;;;;x
nominate_prince;Nominate as Prince of the City;Nommer en tant que prince de la ville;;;Nominar como Príncipe de la Ciudad;;;;;;;;;x
nominate_prince_desc;The position of Prince of the city is vacant, a position which could be filled by [Root.GetTitledFirstName] [Root.GetOnlyDynastyName];Il n'y a plus de prince de la ville en ce moment. [Root.GetTitledFirstName] [Root.GetOnlyDynastyName] serait un(e) bon(ne) candidat(e) à ce poste;;;El cargo de Príncipe de la ciudad está vacante, un cargo que podría ocupar [Root.GetTitledFirstName] [Root.GetOnlyDynastyName];;;;;;;;;x
title_fisher_prince;Fisher Prince;Prince des Pèches;;;;;;;;;;;;x
title_fisher_prince_desc;A council of three princes nominally rule the Free City of Lorath. The princes are elected by the people and serve for life. Each holds a different title and is elected by a specific segment of the population. The Fisher Prince is elected from the vote of all Lorathi who own ships.;Un conseil de trois princes règne nominalement sur la cité libre de Lorath. Les princes sont élus à vie par le peuple. Chacun porte un titre différent et est élu par une partie spécifique de la population. Le Prince des Pèches est élu par tous les habitants de Lorath qui possèdent un bateau.;;;;;;;;;;;;x
title_prince_of_the_streets;Prince of the Streets;Prince des Rues;;;;;;;;;;;;x
title_prince_of_the_streets_desc;A council of three princes nominally rule the Free City of Lorath. The princes are elected by the people and serve for life. Each holds a different title and is elected by a specific segment of the population. The Prince of the Streets is elected from the vote of all the free men of the city.;Un conseil de trois princes règne nominalement sur la cité libre de Lorath. Les princes sont élus à vie par le peuple. Chacun porte un titre différent et est élu par une partie spécifique de la population. Le Prince des Rues est élu par tous les hommes libres de la cité.;;;;;;;;;;;;x
EVTDESCFREECITIES11026;After the death of Prince [FromFrom.GetFirstName] a new Harvest Prince has been elected by all the land owners of Lorath. This great honour has been bestowed upon [From.GetFirstName] [From.GetOnlyDynastyName] who shall now assume the style of [From.GetTitledFirstName], and will preside over the council of three princes.;Après la mort du prince [FromFrom.GetFirstName] un nouveau Prince des Moissons a été élu par tous les propriétaires terriens de Lorath. Ce grand honneur a été accordé à [From.GetFirstName] [From.GetOnlyDynastyName] qui devra assumer maintenant l'apparat de [From.GetTitledFirstName], et présider le conseil des trois princes.;;;;;;;;;;;;x
VTDESCFREECITIES11026B;The position of Harvest Prince of the city has for a while been vacant, and so the land owners of Lorath has elected to bestow this great honour upon [From.GetFirstName] [From.GetOnlyDynastyName], who shall now assume the style of [From.GetTitledFirstName]. He will preside over the council of three princes henceforth.;La dignité de Prince des Moissons de la cité a été vacante quelques temps et les propriétaires terriens de Lorath ont décerné ce grand honneur à [From.GetFirstName] [From.GetOnlyDynastyName], qui doit assumer maintenant l'apparat de [From.GetTitledFirstName]. Il doit désormais présider le conseil des trois princes.;;;;;;;;;;;;x
EVTOPTAFREECITIES11026;This is an important ceremonial title;C'est un titre cérémoniel important;;;;;;;;;;;;x
EVTDESCFREECITIES11028;A new Fisher Prince has been elected by all the ship owners of Lorath. This great honour has been bestowed upon [title_fisher_prince.GetFirstName] [title_fisher_prince.GetOnlyDynastyName] who shall now assume the style of [title_fisher_prince.GetTitledFirstName], and will sit on the council of three princes.;Un nouveau Prince des Pêches a été élu par tous les propriétaires de bateaux de Lorath. Ce grand honneur a été décerné à [title_fisher_prince.GetFirstName] [title_fisher_prince.GetOnlyDynastyName] qui devra maintenant assumer l'apparat de [title_fisher_prince.GetTitledFirstName], et sièger au conseil des trois princes.;;;;;;;;;;;;x
EVTDESCFREECITIES11029;A new Prince of the Streets has been elected by all the free men of Lorath. This great honour has been bestowed upon [title_prince_of_the_streets.GetFirstName] [title_prince_of_the_streets.GetOnlyDynastyName] who shall now assume the style of [title_prince_of_the_streets.GetTitledFirstName], and will sit on the council of three princes.;Un nouveau Prince des Rues a été élu par tous les hommes libres de Lorath. Ce grand honneur a été décerné à [title_prince_of_the_streets.GetFirstName] [title_prince_of_the_streets.GetOnlyDynastyName]  qui devra maintenant assumer l'apparat de [title_prince_of_the_streets.GetTitledFirstName], et sièger au conseil des trois princes.;;;;;;;;;;;;x
