#CODE;ENGLISH;FRENCH;GERMAN;;SPANISH;;;;;;;;;x
EVTOPTAraid_events.26;That is a bit craven;Voilà qui est un peu couard;;;Eso es un poco cobarde;;;;;;;;;x
EVTDESCraid_events.27;During the attack the leader of our reaving party, [From.GetFirstName] [From.GetOnlyDynastyName], was wounded by an enemy fighter. He has chosen to go lead the group back home as a consequence, which the men do not approve of at all.;Durant l'attaque, le chef de notre raid, [From.GetFirstName] [From.GetOnlyDynastyName], a été blessé par un combattant ennemi. Il a décidé de mettre fin au raid et de ramener la flotte à la maison, ce que les hommes désapprouvent complètement.;;;Durante el ataque, [From.GetFirstName] [From.GetOnlyDynastyName] fue herido por un combatiente enemigo. Ha decidido poner fin a la expedición de saqueo y  regresar con la flota a casa, lo que los hombres desaprueban completamente.;;;;;;;;;x
EVTOPTAraid_events.27;Craven!;Lâche!;;;Cobarde!;;;;;;;;;x
EVTDESCraid_events.28;During the attack by our reavers I was grievously injured, but not before I hacked many a man to pieces!;Durant l'attaque, j'ai été gravement blessé, mais pas avant d'avoir taillé de nombreux ennemis en pièce!;;;Durante el ataque, fui gravemente herido, pero antes corté a muchos enemigos en pedazos!;;;;;;;;;x
EVTOPTAraid_events.28;I'm still fit to pillage!;J'ai toujours assez de force pour piller!;;;Todavía tengo fuerzas para saquear!;;;;;;;;;x
EVTOPTBraid_events.24;I should go home;Je crois que je vais rentrer chez moi;;;Debería regresar a casa;;;;;;;;;x
EVTDESCraid_events.29;This assault has ended badly for me, I have been struck down by our foe, never to rise again. But at least I died a true Ironborn, following the Old Way!;Cet assaut s'est très mal terminé pour moi, je suis tombé sous les coups de nos adversaires. Au moins je suis mort comme un vrai Fer-né, en suivant l'Antique Voie!;;;Este asalto ha acabado muy mal para mi, he muerto a manos de mis enemigos. Al menos he muerto como un verdadero Hijo del Hierro, siguiendo las Antiguas Costumbres!;;;;;;;;;x
EVTOPTBraid_events.29;What is dead may never die;Ce qui est mort ne saurait mourir;;;Lo que está muerto no puede morir.;;;;;;;;;x
EVTDESCraid_events.30;Like a true son of the Iron islands, [From.GetFirstName] [From.GetOnlyDynastyName] has been slain during the assault. We shall honour him by reaving boldly on!;Comme un vrai fils des Îles de Fer, [From.GetFirstName] [From.GetOnlyDynastyName] a trouvé la mort durant l'assaut. Nous devons l'honorer pour avoir vécu et trouvé la mort comme un véritable Fer-né! ;;;Como un verdadero hijo de las Islas del Hierro, [From.GetFirstName] [From.GetOnlyDynastyName] ha encontrado la muerte durante el asalto. Debemos honrarlo por haber vencido y haber muerto como un verdadero Hijo del Hierro! ;;;;;;;;;x
EVTDESCraid_events.31;Like a true son of the Iron islands, our leader [From.GetFirstName] [From.GetOnlyDynastyName] has been slain during the assault. Our reaving ends for now, but we shall honour his death by abiding by the Old Way!;"Comme un vrai fils des Îles de Fer; notre chef [From.GetFirstName] [From.GetOnlyDynastyName] a trouvé la mort durant l'assaut. Notre raid s'achève mais nous honorerons sa mort en continuant de suivre l'Antique Voie! ";;;Como un verdadero hijo de las Islas del Hierro, nuestro líder [From.GetFirstName] [From.GetOnlyDynastyName] ha encontrado la muerte durante el asalto. La expedición de saqueo finaliza pero honraremos su muerte continuando las Antiguas Costumbres!;;;;;;;;;x
EVTDESCraid_events.32;Ironborn longships cut through the water swift and sure, hence we have have successfully pursued a small merchant fleet. If we were to attack and pay our Iron Price for their cargo, we could gain much and more.;Les boutres fer-nées ont fendues l'eau claire et sûre, poursuivant avec succès une petite flotte marchande. Si nous attaquions et payions le fer-prix pour leurs cargaisons, nous pourrions remporter beaucoup de butin.;;;Los barcolunegos herreños hienden las aguas velozmente, persiguiendo con éxito una pequeña flota mercante. Si atacamos y pagamos el precio del hierro por sus cargamentos, podríamos ganar un gran botín.;;;;;;;;;x
EVTOPTAraid_events.32;Attack!;À l'attaque!;;;Al ataque!;;;;;;;;;x
EVTOPTBraid_events.32;Too risky;Trop risqué;;;Demasiado arriesgado;;;;;;;;;x
opinion_reaver_no_attack;Did not attack;N'a pas attaqué;;;No atacó;;;;;;;;;x
EVTDESCraid_events.33;The enemy crews were no match for the Ironborn. We sank their poorly manned escorts, siezed there cargo and slew or took captive many men. This is why we follow the Old Way!;L'équipage ennemi n'était que du menu fretin pour les Fer-nés. Nous avons coulé leur pitoyable escorte, pillé leur cargaison et capturé de nombreux hommes. Voilà pourquoi nous suivons l'Antique Voie! ;;;La tripulación enemiga no fue rival para los Hijos del Hierro. Hundimos sus escoltas poco tripulados, saqueamos su cargamento y capturamos a numerosos hombres. Por esto seguimos las Antiguas Costumbres!;;;;;;;;;x
EVTOPTAraid_events.33;Victory!;Victoire!;;;Victoria!;;;;;;;;;x
EVTDESCraid_events.34;The fleet was fairly well defended. We lost a few men siezing their ships as well as taking some damge to our longships, but in the end no one can resist our Ironborn reavers and much cargo as well many captives were taken.;La flotte était bien défendue. Nous avons perdu quelques hommes lorsque nous avons abordé leurs bateaux et certaines de nos boutres ont été endommagées. Mais à la fin, personne ne peut résister aux valeureux Fer-nés et nous nous sommes emparé de leur cargaison et avons fait de nombreux prisonniers. ;;;La flota estaba bien defendida. Perdimos algunos hombres cuando abordamos sus barcos y unos cuantos barcoluengos fueron dañados. Pero al final, nadie puede resistir a los valientes Hijos del Hierro y nos apoderamos de su cargamente y de numerosos prisioneros.;;;;;;;;;x
EVTOPTAraid_events.34;A price well paid;Un prix bien payé;;;Un precio bien pagado;;;;;;;;;x
EVTDESCraid_events.35;The enemy merchants were too well armed for us to take their gold. They utilised their warships to good effect, not allowing us to board their merhcant vessels. We lost a few men, but we shall be back to take our Iron price.;Les marchands ennemis étaient bien trop armés pour que nous puissions prendre leur or. Ils ont bien manœuvré leurs navires de guerre pour nous empêcher d'aborder leurs voiles marchandes. Nous avons perdu quelques hommes mais nous reviendrons pour prendre notre fer-prix. ;;;La flota mercante enemiga estaba muy bien armada para poder tomar su oro. Maniobraron sus navíos de guerra para impedirnos abordar los buques mercantes. Perdimos a unos cuantos hombres pero volveremos para tomar el precio del hierro.;;;;;;;;;x
EVTOPTAraid_events.35;There is always the next raid;Nous pourrons toujours nous rattraper au prochain raid;;;Los alcanzaremos en la siguiente expedición;;;;;;;;;x
EVTDESCraid_events.36;The attack on the enemy flotilla was a disaster. Their warships were too well armed and well manned and we lost many men and longships trying to board their vessels. This makes us look poor ironborn indeed.;L'attaque de la flottille ennemie fut un désastre. Leurs navires de guerres étaient bien trop armés et manœuvrés et nous avons perdu nombre d'hommes et de boutres en tentant d'aborder leurs bateaux. Nous sommes de bien piètres Fer-nés. ;;;El ataque a la flotilla enemiga fue un desastre. Sus navíos de guerra estaban muy bien armados y perdimos un gran número de hombres y barcoluengos intentando abordar sus barcos. No merecemos ser Hijos del Hierro. ;;;;;;;;;x
EVTOPTAraid_events.36;We will fight back!;Nous reviendrons nous battre!;;;Volveremos a luchar!;;;;;;;;;x
EVTDESCraid_events.37;[From.GetFirstName] [From.GetOnlyDynastyName] fearlessly decided to attack a merchant flotilla, and the enemy crews were no match for the Ironborn. We sank their poorly manned escorts, siezed there cargo and slew or took captive many men. This is why we follow the Old Way!;[From.GetFirstName] [From.GetOnlyDynastyName] a décidé sans crainte d'attaquer une flottille marchande. L'équipage ennemi n'était que du menu fretin pour les Fer-nés. Nous avons coulé leur pitoyable escorte, pillé leur cargaison et capturé de nombreux hommes. Voilà pourquoi nous suivons l'Antique Voie! ;;;[From.GetFirstName] [From.GetOnlyDynastyName] decidió sin temor atacar una flota mercante. La tripulación no fue más que un aperitivo a manos de los Hijos del Hierro. Hundimos a su escolta, saqueamos su cargamento y capturamos a numerosos prisioneros. Por esto seguimos las Antiguas Costumbres!;;;;;;;;;x
EVTDESCraid_events.38;[From.GetFirstName] [From.GetOnlyDynastyName]'s decision to attack a merhcant fleet was sound, the fleet was fairly well defended. We lost a few men siezing their ships as well as taking some damge to our longships, but in the end no one can resist our Ironborn reavers and much cargo as well many captives were taken.;La décision de [From.GetFirstName] [From.GetOnlyDynastyName] d'attaquer la flotte marchande était bonne. La flotte était bien défendue. Nous avons perdu quelques hommes lorsque nous avons abordé leurs bateaux et certaines de nos boutres ont été endommagées. Mais à la fin, personne ne peut résister aux valeureux Fer-nés et nous nous sommes emparé de leur cargaison et fait de nombreux prisonniers. ;;;La decisión de [From.GetFirstName] [From.GetOnlyDynastyName] de atacar la flota mercante fue acertada. La flota estaba bien defendida. Perdimos algunos hombres mientras abordábamos sus naves y unos cuantos barcoluengos fueron dañados. Pero al final, no pudieron resistir contra los valerosos Hijos del Hierro y nos hicimos con su cargamento y numerosos prisioneros.;;;;;;;;;x
EVTDESCraid_events.39;[From.GetFirstName] [From.GetOnlyDynastyName] 's attack on an enemy merhcant fleet seemed foolhardy, as the enemy merchants were too well armed for us to take their gold. They utilised their warships to good effect, not allowing us to board their merhcant vessels. We lost a few men, but we shall be back to take our Iron price.;La décision de [From.GetFirstName] [From.GetOnlyDynastyName] d'attaquer une flotte marchande semble avoir été imprudente. Les marchands ennemis étaient bien trop armés pour que nous puissions prendre leur or. Ils ont bien manoeuvré leurs navires de guerre pour nous empêcher d'aborder leurs voiles marchandes. Nous avons perdu quelques hommes mais nous reviendrons pour prendre notre fer-prix. ;;;La decisión de [From.GetFirstName] [From.GetOnlyDynastyName] de atacar una flota mercante parece haber sido imprudente. La flota enemiga estaba muy bien armada para poder tomar su oro. Maniobraron sus navíos de guerra para impedirnos abordar sus buques mercantes. Perdimos a unos cuantos hombres pero volveremos para tomar el precio del hierro.;;;;;;;;;x
EVTDESCraid_events.40;[From.GetFirstName] [From.GetOnlyDynastyName]'s attack on an merhcant flotilla was a disaster. Their warships were too well armed and well manned and we lost many men and longships trying to board their vessels. This makes us look poor ironborn indeed.;L'attaque de[From.GetFirstName] [From.GetOnlyDynastyName] sur une flottille marchande a tourné au désastre. Leurs navires de guerres étaient bien trop armés et manœuvrées et nous avons perdu nombre d'hommes et de boutres en tentant d'aborder leurs bateaux. Nous sommes de bien piètres Fer-nés. ;;;El ataque de [From.GetFirstName] [From.GetOnlyDynastyName] a una flotilla mercante fue un desastre. Sus navíos de guerra estaban muy bien armados y dirigidos y perdimos un gran número de hombres y barcoluengos intentando abordar sus barcos. No merecemos ser Hijos del Hierro. ;;;;;;;;;x
EVTDESCraid_events.41;During the course of the battle I came upon a foeman who wielded a fearsome sword made of Valyrian Steel. He was no match for an Ironborn warrior however and fell in battle against me. Now I wield this majestic weapon, for the glory of House [Root.GetOnlyDynastyName]!;Au cours de la bataille je me suis retrouvé face à un adversaire maniant une effrayante épée en acier valyrien. Il n'était cependant pas de taille à affronter un guerrier Fer-né et je l'ai facilement terrassé. Désormais je manie cette arme majestueuse pour la gloire de la Maison [Root.GetOnlyDynastyName]!;;;En el transcurso de la batalla me encontré a un adversario blandiendo una amenazante espada valyria. No fue rival para un guerrero Hijo del Hierro y lo derribé fácilmente. Ahora blando esta majestuosa espada para la gloria de la casa [Root.GetOnlyDynastyName]!;;;;;;;;;x
EVTOPTAraid_events.41;A fine blade!;Une fine lame;;;Una buena hoja!;;;;;;;;;x
EVTDESCraid_events.42;During the course of the battle [From.GetFirstName] [From.GetOnlyDynastyName] came upon a foeman who wielded a fearsome sword made of Valyrian Steel. He was no match for an Ironborn warrior however and fell in battle against him. Now [From.GetFirstName] wields this majestic weapon, for the glory of his house.;Au cours de la bataille [From.GetFirstName] [From.GetOnlyDynastyName] s'est retrouvé face à un adversaire maniant une effrayante épée en acier valyrien. Il n'était cependant pas de taille à affronter un guerrier Fer-né et s'est promptement fait tué. Désormais [From.GetFirstName] manie cette arme majestueuse pour la gloire de sa maison. ;;;En el transcurso de la batalla [From.GetFirstName] [From.GetOnlyDynastyName] se encontró un adversario blandiendo una amenazante espada valyria. No fue rival para un guerrero Hijo del Hierro y lo derribó fácilmente. Ahora [From.GetFirstName] blande esta majestuosa espada para la gloria de la casa [Root.GetOnlyDynastyName]!;;;;;;;;;x
EVTDESCraid_events.43;One of my fellow Reavers has come to be a great companion. We have raided and pillaged together, we have slain many a man in battle side by side and feasted together in celebration of a reaving well done, in the true spirit of the Drowned God.;L'un de mes camarades de raid est devenu un compagnon pour moi. Côte à côte nous avons tué de nombreux hommes, nous avons razzié et pillé ensemble, comme nous avons festoyé de concert après des raids couronnés de succès selon la volonté du Dieu-noyé.;;;Uno de mis compañeros de expedición se ha convertido en un gran camarada para mi. Juntos hemos matado a numerosos hombres, saqueado y robado juntos, y festejamos en un gran banquete la exitosa expedición de saqueo según el deseo del Dios Ahogado!;;;;;;;;;x
EVTOPTAraid_events.43;We shall remember this time;Nous nous souviendrons de ces moments;;;Recordaremos estos momentos;;;;;;;;;x
EVTTOOLTIPraid_events.44;will become your friend;vont devenir amis;;;se convertirá en tu amigo;;;;;;;;;x
EVTDESCraid_events.44;[From.GetFirstName] [From.GetOnlyDynastyName] has come to be a great companion. We have raided and pillaged together, we have slain many a man in battle side by side and feasted together in celebration of a reaving well done, in the true spirit of the Drowned God.;[From.GetFirstName] [From.GetOnlyDynastyName] est devenu un bon compagnon. Côte à côte nous avons tué de nombreux hommes, nous avons razzié et pillé ensemble, comme nous avons festoyé de concert après des raids couronnés de succès selon la volonté du Dieu-noyé.;;;[From.GetFirstName] [From.GetOnlyDynastyName] se ha convertido en un gran compañero para mi. Juntos hemos matado a numerosos hombres, saqueado y robado juntos, y festejamos en un gran banquete la exitosa expedición de saqueo según el deseo del Dios Ahogado!;;;;;;;;;x
EVTDESCraid_events.45;I have never been overly fond of one of my fellow reavers, and this voyage has done nought to help that. Our frantic race to rape and pillage more than the other, to slay more men and capture more salt wives, has fuelled a bitter rivalry that will endure well after the reaving is done.;Je n'ai jamais vraiment aimé l'un de mes camarades de raid et ce voyage n'a rien fait pour aider. Notre compétition frénétique pour violer et piller plus que l'autre, pour tuer et capturer plus de femme-sels, a nourrit une amère rivalité qui continuera bien après la fin du raid.;;;Nunca me gustó uno de mis compañeros de expedición y este viaje no ha ayudado nada. Nuestra frenética competición por violar y saquear más que el otro, para matar y capturar más esposas de sal, ha creado una fuerte rivalidad que continuará tras el fin de la expedición de saqueo.;;;;;;;;;x
EVTOPTAraid_events.45;He is insufferable!;Il est insupportable!;;;Es insoportable!;;;;;;;;;x
EVTTOOLTIPraid_events.46;will become your rival;va devenir votre rival;;;se convertirá en tu rival;;;;;;;;;x
EVTDESCraid_events.46;I have never been overly fond of [From.GetFirstName] [From.GetOnlyDynastyName], and this voyage has done nought to help that. Our frantic race to rape and pillage more than the other, to slay more men and capture more salt wives, has fuelled a bitter rivalry that will endure well after the reaving is done.;Je n'ai jamais vraiment aimé [From.GetFirstName] [From.GetOnlyDynastyName], et ce voyage n'a rien fait pour aider. Notre compétition frénétique pour violer et piller plus que l'autre, pour tuer et capturer plus de femme-sels, a nourrit une amère rivalité qui continuera bien après la fin du raid.;;;Nunca me gustó [From.GetFirstName] [From.GetOnlyDynastyName] y este viaje no ha ayudado nada. Nuestra frenética competición por violar y saquear más que el otro, para matar y capturar más esposas de sal, ha creado una fuerte rivalidad que continuará tras el fin de la expedición de saqueo.;;;;;;;;;x
EVTDESCraid_events.47;After a hard days reaving, the men are having many a strong drink whilst we rest at anchor. Another reaver is bragging of the many men he has killed this day and how he is the boldest of the Ironborn here. My companions think I should challenge him to a finger dance to proove otherwise...;Après de nombreuses journées passées à piller, nous avons jeter l'ancre pour nous reposer un peu. L'alcool coule à flot et un homme se vante des nombreux ennemis qu'il a tué et jure être le plus courageux des Fer-né présents. Mes compagnons pensent que je devrais le défier à une danse du doigts pour lui prouver qu'il se trompe... ;;;Tras numerosas jornadas de pillaje, echamos el ancla para descansar un poco. El alcohol fluye libremente y un hombre se jacta de los muchos hombres que ha matado y jura ser el más valiente de los Hijos del Hierro presentes. MIs compañeros creen que debería retarlo a una danza del dedo para probar que se equivoca...;;;;;;;;;x
EVTOPTAraid_events.47;I am the boldest! I challenge him!;Je suis le plus courageux! Je le défi!;;;Yo soy el más valiente! Lo desafió!;;;;;;;;;x
EVTOPTBraid_events.47;I have had a bit too much drink to dance;J'ai un peu trop bu pour une danse du doigt;;;He bebido demasiado para una danza del dedo;;;;;;;;;x
EVTDESCraid_events.48;We are at rest after a day of much pillage and raping, where I showed I clearly am the most daring of the Ironborn, who can kill, plunder and drink the most! [From.GetFirstName] [From.GetOnlyDynastyName] disagrees however, and challenges me to a finger dance to proove my manliness!;Nous nous reposons après de nombreux jours de pillages et de viols où j'ai prouvé que j'étais clairement le plus courageux des Fer-nés, celui qui tue, pille et bois le plus! Cependant [From.GetFirstName] [From.GetOnlyDynastyName] n'est pas d'accord et me défie à une danse du doigt pour prouver ce que j'avance! ;;;Descansamos tras muchos días de pillaje y violaciones donde demostré que soy claramente el más valeroso de los Hijos del Hierro, el que más mata, saquea y bebe! Sin embargo [From.GetFirstName] [From.GetOnlyDynastyName] no está de acuerdo y me ha desafiado a una danza del dedo para demostrar lo que he dicho!;;;;;;;;;x
EVTOPTAraid_events.48;I accept!;J'accepte!;;;Acepto!;;;;;;;;;x
EVTTOOLTIPraid_events.48;will be challenged to a finger dance;va être défié à une danse du doigt;;;será desafiado a una danza del dedo;;;;;;;;;x
TOOLTIPFINGERDANCEENSUES;A finger dance will ensue with [From.GetFirstName] [From.GetOnlyDynastyName]\n;Une danse du doigt va s'ensuivre avec [From.GetFirstName] [From.GetOnlyDynastyName]\n;;;Una danza del dedo tendrá lugar con [From.GetFirstName] [From.GetOnlyDynastyName]\n;;;;;;;;;x
EVTDESCraid_events.50;Despite all his bravado, [From.GetFirstName] [From.GetOnlyDynastyName] has proved himself a craven. He backed down from your challenge to a finger dance.;En dépit de ses bravades, [FromFrom.GetFirstName] [FromFrom.GetOnlyDynastyName] a prouvé qu'il était un lâche. Il n'a pas relevé votre défi à la danse du doigt.;;;A pesar de su bravuconería, [FromFrom.GetFirstName] [FromFrom.GetOnlyDynastyName] ha demostrado ser un cobarde. No ha aceptado tu desafío a la danza del dedo.;;;;;;;;;x
EVTOPTAraid_events.50;I am the true Ironborn!;Je suis un vrai Fer-né!;;;Soy un verdadero Hijo del Hierro!;;;;;;;;;x
EVTDESCraid_events.51;[FromFrom.GetFirstName] [FromFrom.GetOnlyDynastyName] accepted my challenge to a finger dance, and must surely regret it! The axes flew back and forth whilst I moved with grace and conviction, catching and dodging every blade that flew my way. It all got too much for [FromFrom.GetFirstName], he had a panicked look throughout and eventually submitted after losing a few fingers.;[FromFrom.GetFirstName] [FromFrom.GetOnlyDynastyName] a accepté mon défi à la danse du doigt et doit sûrement le regretter! Les haches voltigeaient d'un bout à l'autre et je les esquivais et les rattrappais à chaque fois. Il devint vite clair que s'en était trop pour [FromFrom.GetFirstName], ses yeux ne pouvaient cacher une certaine panique et il finit par abandonner après avoir perdu quelques doigts. ;;;[FromFrom.GetFirstName] [FromFrom.GetOnlyDynastyName] aceptó mi desafío de la danza del dedo y seguramente se arrepienta! Las hachas volaban de un lado a otro de la sala y yo las esquivaba y atrapaba cada vez. Quedó rápidamente claro que era demasiado para [FromFrom.GetFirstName], sus ojos no podían ocultar cierto pánico y finalmente se rindió tras perder unos cuantos dedos.;;;;;;;;;x
EVTOPTAraid_events.51;None can dance as well as I!;Personne ne peut aussi bien danser que moi!;;;Nadie baila tan bien como yo!;;;;;;;;;x
EVTDESCraid_events.52;Perhaps my decision to accept [From.GetFirstName] [From.GetOnlyDynastyName]'s challenge was not wise. As the axes flew to and fro he was clearly the more assured and quicker. I had to give in after losing some fingers, for fear of my life!;Peut-être que ma décision d'accepter le défi de [From.GetFirstName] [From.GetOnlyDynastyName] n'était pas très sage. Alors que les haches allaient et venaient, il devint clair qu'il était le plus assuré et le plus rapide. Je craignais pour ma vie et finis par abandonner après la perte de quelques doigts!;;;Tal vez mi decisión de aceptar el desafío de [From.GetFirstName] [From.GetOnlyDynastyName] no fue una sabia decisión. Mientras las hachas iban y venían, quedó claro que él era más rápido y certero. Temí por mi vida y me rendí tras perder varios dedos!;;;;;;;;;x
EVTOPTAraid_events.52;He was too good!;Il était trop bon!;;;Era demasiado bueno!;;;;;;;;;x
EVTDESCraid_events.53;After accepting my challenge, [FromFrom.GetFirstName] [FromFrom.GetOnlyDynastyName] and I had a fine finger dance. We both artfully dogged and bravely caught many an axe, and only suffered trifling injuries! All agreed it was a good lark!;Après avoir relevé mon défi, [From.GetFirstName] [From.GetOnlyDynastyName] et moi avons entamé une très belle danse du doigt. Nous avons tous les deux bien évité et attrappé les haches et n'avons souffert que de blessures superficielles. Tous étaient d'accord pour dire que se fut une bien belle bataille. ;;;Tras aceptar mi desafío, [From.GetFirstName] [From.GetOnlyDynastyName] y yo entablamos una hermosa danza del dedo. Los dos evitamos y atrapamos las hachas sufriendo únicamente heridas superficiales. Todos estaban de acuerdo en que fue una preciosa batalla.;;;;;;;;;x
EVTOPTAraid_events.53;We must do it again!;Nous devrions en refaire une à l'occasion!;;;Deberíamos hacerlo de nuevo!;;;;;;;;;x
EVTDESCraid_events.54;After I accepted his challenge, [From.GetFirstName] [From.GetOnlyDynastyName] and I had a fine finger dance. We both artfully dogged and bravely caught many an axe, and only suffered trifling injuries! All agreed it was a good lark!;Après avoir relevé son défi, [From.GetFirstName] [From.GetOnlyDynastyName] et moi avons entamé une très belle danse du doigt. Nous avons tous les deux bien évité et attrappé les haches et n'avons souffert que de blessures superficielles. Tous étaient d'accord pour dire que se fut une bien belle bataille. ;;;Tras aceptar su desafío, [From.GetFirstName] [From.GetOnlyDynastyName] y yo entablamos una hermosa danza del dedo. Los dos evitamos y atrapamos las hachas sufriendo únicamente heridas superficiales. Todos estaban de acuerdo en que fue una preciosa batalla.;;;;;;;;;x
