#CODE;ENGLISH;FRENCH;GERMAN;;SPANISH;;;;;;;;;x
EVTDESCraid_events.55;[FromFrom.GetFirstName] [FromFrom.GetOnlyDynastyName] was not all talk afterall. He accepted my challenge, and as the axes flew to and fro he was clearly the more assured and quicker. I had to give in after losing some fingers, for fear of my life!;[FromFrom.GetFirstName] [FromFrom.GetOnlyDynastyName] n'était pas qu'une grande gueule après tout. Il a accepté mon défi et lorsque les haches ont commencé à voler il était clairement le plus assuré et le plus rapide. Craignant pour ma vie, j'ai dé abandonner après avoir perdu quelques doigts! ;;;[FromFrom.GetFirstName] [FromFrom.GetOnlyDynastyName] no era un bocazas después de todo. Aceptó mi seafío y cuando las hachas empezaron a volar, claramente fue más rápido y certero que yo. Temiendo por mi vida, abandoné tras perder varios dedos!;;;;;;;;;x
EVTOPTAraid_events.55;The men respect me nonetheless;Les hommes me respectent tout de même;;;Los hombres me respetan de todas formas;;;;;;;;;x
EVTDESCraid_events.56;I took up [From.GetFirstName] [From.GetOnlyDynastyName]'s challenge, and he must surely regret it! The axes flew back and forth whilst I moved with grace and conviction, catching and dodging every blade that flew my way. It all got too much for [From.GetFirstName], he had a panicked look throughout and eventually submitted after losing a few fingers.;J'ai relevé le défi de [From.GetFirstName] [From.GetOnlyDynastyName] et il doit sûrement le regretter! Les haches voltigeaient d'un bout à l'autre et je les esquivais et les rattrappais à chaque fois. Il devint vite clair que s'en était trop pour [FromFrom.GetFirstName], ses yeux ne pouvaient cacher une certaine panique et il finit par abandonner après avoir perdu quelques doigts. ;;;Acepté el desafío de [From.GetFirstName] [From.GetOnlyDynastyName] y seguramente se arrepienta! Las hachas volaban de un lado a otro de la sala y yo las esquivaba y atrapaba cada vez. Quedó rápidamente claro que era demasiado para [FromFrom.GetFirstName], sus ojos no podían ocultar cierto pánico y finalmente se rindió tras perder unos cuantos dedos.;;;;;;;;;x
EVTDESCraid_events.57;The men were enjoying many a hard drink after a good days reaving, when [FromFrom.GetFirstName] [FromFrom.GetOnlyDynastyName] challenged [From.GetFirstName] [From.GetOnlyDynastyName], who was boasting of his reaving exploits, to a finger dance! [FromFrom.GetFirstName] was clearly the better of the two, he caught and dodged the axes most ably. [From.GetFirstName] eventually submitted after losing a few fingers.;Les hommes prenaient du bon temps en se saoulant après bien des jours de raids lorsque [FromFrom.GetFirstName] [FromFrom.GetOnlyDynastyName] défia [From.GetFirstName] [From.GetOnlyDynastyName], qui se vantait de ses exploits durant les raids, à une danse du doigt! [FromFrom.GetFirstName] était clairement le meilleur des deux, il esquivait et attrapait les haches avec bien plus d'habilité. [From.GetFirstName] finit par abandonner après avoir perdu quelques doigts. ;;;Los hombres disfrutaban emborrachándose tras muchos días de saqueos cuando [FromFrom.GetFirstName] [FromFrom.GetOnlyDynastyName] desafió a [From.GetFirstName] [From.GetOnlyDynastyName], que se vanagloriaba de sus hazañas a una danza del dedo! [FromFrom.GetFirstName] fue claramente el mejor de los dos, esquivó y atrapó las hachas con más habilidad. [From.GetFirstName] acabó por abandonar tras perder varios dedos.;;;;;;;;;x
EVTOPTAraid_events.57;That was a good contest;Ce fut une bonne partie;;;Fue una buena competición;;;;;;;;;x
EVTDESCraid_events.58;After a hards days reaving and much drink, the Ironborn were in high spirits, when [FromFrom.GetFirstName] [FromFrom.GetOnlyDynastyName] challenged [From.GetFirstName] [From.GetOnlyDynastyName] to a finger dance! It was fine spectacle, they both artfully dodged and caught many an axe, and only sustained trifling injuries! All agreed it was a fine lark.;Après de dures journées de pillage et de boissons, les Fer-nés étaient plutôt échauffés lorsque [FromFrom.GetFirstName] [FromFrom.GetOnlyDynastyName] défia [From.GetFirstName] [From.GetOnlyDynastyName] à une danse du doigt! Ce fut un très bon spectacle, ils esquivèrent et attrapèrent les haches avec dextérité, ne s'infligeant que quelques blessures superficielles! Tous furent d'accord pour dire que c'était une belle bataille. ;;;Tras duras jornadas de saqueos y bebidas, los Hijos del Hierro estaban de buen humor cuando [FromFrom.GetFirstName] [FromFrom.GetOnlyDynastyName] desafió a [From.GetFirstName] [From.GetOnlyDynastyName] a una danza del dedo! Fue un buen espectáculo, esquivaban y atrapaban las hachas con destreza y no se infligieron más que heridas superficiales! Todos estuvieron de acuerdo en que fue una bonita batalla. ;;;;;;;;;x
EVTOPTAraid_events.58;Like true Ironborn!;Comme de vrais Fer-nés!;;;Como verdaderos Hijos del Hierro!;;;;;;;;;x
EVTDESCraid_events.59;The men were enjoying many a hard drink after a good days reaving, when [FromFrom.GetFirstName] [FromFrom.GetOnlyDynastyName] challenged [From.GetFirstName] [From.GetOnlyDynastyName], who was boasting of his reaving exploits, to a finger dance! [FromFrom.GetFirstName] was clearly unwise in his challenge, as [From.GetFirstName] caught and dodged the axes far more ably. [FromFrom.GetFirstName] eventually submitted after losing a few fingers.;Les hommes prenaient du bon temps en se saoulant après bien des jours de raids lorsque [FromFrom.GetFirstName] [FromFrom.GetOnlyDynastyName]défia [From.GetFirstName] [From.GetOnlyDynastyName], qui se vantait de ses exploits durant les raids, à une danse du doigt! [FromFrom.GetFirstName] a clairement fait une erreur en lançant ce défi, puisque [From.GetFirstName] attrapa et esquiva les haches d'une manière bien plus adroite. [FromFrom.GetFirstName] a finis par abandonner après avoir perdu quelques doigts. ;;;Los hombres disfrutaban emborrachándose tras muchos días de saqueos cuando [FromFrom.GetFirstName] [FromFrom.GetOnlyDynastyName] desafió a [From.GetFirstName] [From.GetOnlyDynastyName], que se vanagloriaba de sus hazañas a una danza del dedo! [FromFrom.GetFirstName] claramente cometió un error al lanzar el desafío, ya que [From.GetFirstName] atrapaba y esquivaba las hachas de una forma más hábil. [FromFrom.GetFirstName] acabó por abandonar tras perder varios dedos.;;;;;;;;;x
EVTDESCraid_events.60;The Drowned God have mercy! Our Longships have encountered a great Kraken which threatens to pull them down! Krakens were thought to be a myth from the Age of Heroes, but are a very real menace for us now!;Que le Dieu Noyé ait pitié de nous! Nos boutres ont rencontré une Seiche Géante qui menace de les couler! Nous pensions que les pieuvres géantes n'étaient que des mythes remontant à l'Age des Héros, mais elles sont bien réelles!;;;Que el Dios Ahogado tenga piedad de nosotros! Nuestros barcoluengos se han encontrado con un Kraken gigante que amenaza de hundirlos! Pensábamos que los Krakens no eran más que mitos que se remontaban a la Edad de los Héroes, pero son bien reales!;;;;;;;;;x
EVTOPTAraid_events.60;Ironborn! To Arms!;Fer-nés! Aux armes!;;;Hijos del Hierro! A las armas!;;;;;;;;;x
TOOLTIPKRAKENDEFEATED;The Kraken is Slain\n;La Seiche Géante est vaincue\n;;;El Kraken ha sido vencido\n;;;;;;;;;x
TOOLTIPKRAKENWINS;The Kraken devours our Longships\n;La Seiche Géante dévore nos boutres\n;;;El Kraken devora nuestros barcoluengos\n;;;;;;;;;x
EVTDESCraid_events.61;Victory for the Ironborn! The Kraken was fierce, but not as fierce as the reavers. The Kraken was ultimately slain and our ships saved, we have won much fame and reknown this day.;Victoire pour les Fer-nés! La Seiche Géante était un féroce adverse, mais pas aussi féroce que les Fer-nés! La Seiche Géante a finalement été tuée et nos boutres sont sauvées. En ce jour, nous avons gagné gloire et renommée! ;;;Victoria para los Hijos del Hierro! El Kraken fue un feroz adversario, pero no tan feroz como los Hijos del Hierro! Matamos al Kraken y salvamos nuestros barcoluengos. Este día, hemos ganado fama y gloria!;;;;;;;;;x
EVTOPTAraid_events.61;Even Krakens cower before us!;Même les Seiches Géantes tremblent devant nous!;;;Incluso los Krakens tiemblan delante nuestro!;;;;;;;;;x
EVTDESCraid_events.62;The Kraken was too mighty, too strong. It broke asunder our Longships and pulled many an Ironborn down to the Drowned God's watery halls. ;La Seiche Géante était trop puissante, trop forte. Elle a écrasé et coulé nos boutres comme de vulgaires barques et envoyé de nombreux Fer-nés festoyer dans les demeures liquides du Dieu Noyé.;;;El Kraken era demasiado poderoso, demasiado fuerte. Aplastó y hundió los barcoluengos y envío a muchos Hijos del Hierro a las estancias acuosas del Dios Ahogado.;;;;;;;;;x
EVTOPTAraid_events.62;What is dead may never die;Ce qui est mort ne saurait mourir;;;Lo que está muerto no puede morir.;;;;;;;;;x
EVTDESCraid_events.63;Whilst out at sea, our Longships led by [From.GetFirstName] [From.GetOnlyDynastyName] encountered a great Kraken which threatened to pull them down! It was fierce, but not as fierce as the Ironborn, we slew the beast and sent it back to the Drowned God!;Alors qu'elles étaient en mer, nos boutres menées par [From.GetFirstName] [From.GetOnlyDynastyName] ont rencontré une Seiche Géante qui menaçait de les couler! Elle était féroce, mais pas aussi féroce que les Fer-nés, nous l'avons tuée et renvoyée au Dieu Noyé! ;;;Mientras estaban el mar, nuestros barcoluengos liderados por [From.GetFirstName] [From.GetOnlyDynastyName] se encontraron con un Kraken que amenazaba con hundirlos! Era un monstruo feroz, pero no tan feroz como los Hijos del Hierro, lo matamos y lo envíamos de vuelta al Dios Ahogado!;;;;;;;;;x
EVTDESCraid_events.64;The Drowned God have mercy! Our Longships led by [From.GetFirstName] [From.GetOnlyDynastyName] encountered a great Kraken which threatened to pull them down! It was too mighty, too strong. It broke asunder our Longships and pulled many an Ironborn down to the Drowned God's watery halls. ;Que le Dieu Noyé ait pitié de nous! Nos boutres menées par [From.GetFirstName] [From.GetOnlyDynastyName] ont rencontré une Seiche Géante qui menaçait de les couler! Elle était trop puissante, trop forte. Elle a écrasé et coulé nos boutres comme de vulgaires barques et envoyé de nombreux Fer-nés festoyer dans les demeures liquides du Dieu Noyé.;;;Que el Dios Ahogado tenga piedad de nosotros! Nuestros barcoluengos liderados por [From.GetFirstName] [From.GetOnlyDynastyName] se han encontrado con un Kraken gigante que amenaza de hundirlos! Era demasiado poderoso, demasiado fuerte. Aplastó y hundió los barcoluengos y envío a muchos Hijos del Hierro a las estancias acuosas del Dios Ahogado.;;;;;;;;;x
EVTDESCraid_events.66;[From.GetName] has fallen to our band of reavers, perhaps I should claim a salt wife?;[From.GetName] est tombé face a notre bande de razzieurs. Peut-être devrais-je réclamer une femme-sel ? ;;;[From.GetName] ha caído en manos de nuestra banda de saqueadores. Tal vez debería reclamarla como esposa de sal?;;;;;;;;;x
EVTDESCraid_events.66B;[From.GetName] has fallen to our band of raiders, perhaps I should claim a girl for myself?;[From.GetName] est tombé face a notre bande de razzieurs. Peut-être devrais-je réclamer une femme-sel ? ;;;[From.GetName] ha caído en manos de nuestra banda de saqueadores. Tal vez debería reclamar una chica para mi?;;;;;;;;;x
EVTDESCraid_events.66C;[From.GetName] has fallen to our band of raiders, perhaps I should claim a boy for myself?;[From.GetName] est tombé face a notre bande de razzieurs. Peut-être devrais-je réclamer une femme-sel ? ;;;[From.GetName] ha caído en manos de nuestra banda de saqueadores. Tal vez debería reclamar un chico para mi?;;;;;;;;;x
EVTOPTAraid_events.66;[salt_wife_1.GetSheHeCap] will make a fine concubine;Elle fera une bonne femme-sel.;;;[salt_wife_1.GetSheHeCap] será una buena concubina.;;;;;;;;;x
EVTOPTBraid_events.66;I like the look of [salt_wife_2.GetHerHim];J'aime bien ses formes.;;;Me gusta su aspecto.;;;;;;;;;x
EVTOPTCraid_events.66;Bring [salt_wife_3.GetHerHim] to my ship;Amenez la sur mon boutre.;;;Llevadla a mi barco.;;;;;;;;;x
EVTOPTDraid_events.66;I have no need for this;Je n'ai pas besoin de femme-sel.;;;No tengo necesidad de esto;;;;;;;;;x
EVTDESCraid_events.660;[FromFrom.GetName] has fallen, and [From.GetTitledFirstName] has made me his salt wife!;[FromFrom.GetName] est tombé, et [From.GetTitledFirstName] a fait de moi sa femme-sel !;;;[FromFrom.GetName] ha caído, y [From.GetTitledFirstName] me ha hecho su esposa de sal!;;;;;;;;;x
EVTDESCraid_events.660B;[FromFrom.GetName] has fallen, and [From.GetTitledFirstName] has made me his concubine!;[FromFrom.GetName] est tombé, et [From.GetTitledFirstName] a fait de moi sa femme-sel !;;;[FromFrom.GetName] ha caído, y [From.GetTitledFirstName] me ha hecho su concubina!;;;;;;;;;x
EVTOPTDraid_events.660;Oh no!;Oh non !;;;Oh no!;;;;;;;;;x
EVTDESCraid_events.661;After looting my castle for all it's worth, [FromFrom.GetFirstName] [FromFrom.GetOnlyDynastyName] has insulted me further by taking my [GetFromRelation] [From.GetFirstName] as his salt wife!;Après avoir piller mon château de tous ses biens, [FromFrom.GetFirstName] [FromFrom.GetOnlyDynastyName] m'a insulté davantage en faisant de ma [GetFromRelation] [From.GetFirstName] sa femme-sel !;;;Tras saquear mi castillo, [FromFrom.GetFirstName] [FromFrom.GetOnlyDynastyName] me insultó aún más haciendo de mi [GetFromRelation] [From.GetFirstName] su esposa de sal!;;;;;;;;;x
EVTDESCraid_events.661B;After looting my castle for all it's worth, [FromFrom.GetFirstName] [FromFrom.GetOnlyDynastyName] has insulted me further by taking my [GetFromRelation] [From.GetFirstName] as a concubine!;Après avoir piller mon château de tous ses biens, [FromFrom.GetFirstName] [FromFrom.GetOnlyDynastyName] m'a insulté davantage en faisant de ma [GetFromRelation] [From.GetFirstName] sa femme-sel !;;;Tras saquear mi castillo, [FromFrom.GetFirstName] [FromFrom.GetOnlyDynastyName] me insultó aún más haciendo de mi [GetFromRelation] [From.GetFirstName] su concubina!;;;;;;;;;x
EVTOPTDraid_events.661;I will avenge [From.GetHerHim];Je la vengerai !;;;La vengaré!;;;;;;;;;x
EVTDESCraid_events.662;[FromFrom.GetTitledFirstName] has proved himself worthy to be called Ironborn as he has captured [From.GetFirstName] as his salt wife.;[FromFrom.GetTitledFirstName] a prouvé qu'il méritait d'être appelé fer-né en capturant [From.GetFirstName] et en faisant sa femme-sel. ;;;[FromFrom.GetTitledFirstName] ha demostrado que merece ser un Hijo del Hierro capturando a [From.GetFirstName] y haciéndola su esposa de sal.;;;;;;;;;x
EVTDESCraid_events.662B;[FromFrom.GetTitledFirstName] has proved himself a worthy warrior as he has captured [From.GetFirstName] as his concubine.;[FromFrom.GetTitledFirstName] a prouvé qu'il méritait d'être appelé fer-né en capturant [From.GetFirstName] et en faisant sa femme-sel. ;;;[FromFrom.GetTitledFirstName] ha demostrado que merece ser un Hijo del Hierro capturando a [From.GetFirstName] y haciéndola su concubina.;;;;;;;;;x
EVTOPTDraid_events.662;Good man!;Voilà un homme !;;;Buen hombre!;;;;;;;;;x
EVTDESCraid_events.67;Whilst sacking [FromFrom.GetName] for all it's worth, you and your men have located someone in the castle who owns a Valyrian steel blade. Will you take this sword as your own? They may not give it willingly...;Tandis que vous vous empariez de toutes les richesses de [FromFrom.GetName], vous et vos hommes avez repéré quelqu'un au château qui possède un épée en acier valyrien. Allez-vous prendre son arme ? Elle ne la donnera pas de son plein gré…;;;Mientras tomas las riquezas de [FromFrom.GetName], tú y tus hombres os dais cuenta de que alguien en el castillo posee una espada valyria. Tomarás su arma? No la dará de buen grado...;;;;;;;;;x
EVTOPTAraid_events.67;Yes, I shall pay the iron price for it!;Oui, je payerai le fer-prix pour m'en emparer !;;;Sí, pagaré el precio del hierro por ello!;;;;;;;;;x
EVTOPTAraid_events.67B;Yes, I shall make it mine!;Oui, je payerai le fer-prix pour m'en emparer !;;;Sí, la haré mía!;;;;;;;;;x
TOOLTIPraid_events.670;You hunt down [This.GetFirstName] [This.GetOnlyDynastyName];Vous pourchassez [This.GetFirstName] [This.GetOnlyDynastyName];;;Das caza a [This.GetFirstName] [This.GetOnlyDynastyName];;;;;;;;;x
EVTOPTBraid_events.675;No, I have no need for shiny blades;Non, je n'ai pas besoin d'une telle lame.;;;No, no necesito una espada así.;;;;;;;;;x
EVTDESCraid_events.670;[From.GetFirstName] [From.GetOnlyDynastyName] and [From.GetHerHis] band of pillagers have breached my castle defenses and have begun sacking it it ruthlessly. After a while, [From.GetSheHe] has cornered me, and now claims my prized valyrian steel blade for [From.GetHerHim]self!;[From.GetFirstName] [From.GetOnlyDynastyName] et sa bande de pillards ont brisé les défenses de mon château et ont commencé à le saccager. Au bout d'un moment [From.GetSheHe] a fini par me repérer et [From.GetSheHe] réclame désormais ma précieuse lame valyrienne !;;;[From.GetFirstName] [From.GetOnlyDynastyName] y su banda de saqueadores rompieron las defensas de mi castillo y empezaron a saquearlo. Al cabo de un rato, repararon en mi presencia y me reclaman mi preciosa espada valyria!;;;;;;;;;x
EVTOPTAraid_events.670;I will die before [From.GetSheHe] steals [Root.GetValyrianSword]!;Je mourrai avant qu'[From.GetSheHe] ne s’empare de [Root.GetValyrianSword] !;;;;;;;;;;;;x
TOOLTIPraid_events.672;You attack [From.GetFirstName] [From.GetOnlyDynastyName]...;Vous attaquez [From.GetFirstName] [From.GetOnlyDynastyName]...;;;;;;;;;;;;x
EVTOPTBraid_events.670;I surrender, please don't hurt me!;Je me rends ! S'il vous plaît, épargnez moi !;;;;;;;;;;;;x
TOOLTIPraid_events.671;[From.GetFirstName] [From.GetOnlyDynastyName] takes your sword;[From.GetFirstName] [From.GetOnlyDynastyName] prend votre épée.;;;;;;;;;;;;x
EVTDESCraid_events.671;[From.GetFirstName] [From.GetOnlyDynastyName] has been found cowering in one of the towers, and eagerly surrenders to your will. [From.GetSheHeCap] is made to kneel before you outside before all your men, and offers up [From.GetValyrianSwordHerHis] to you in exchange for [From.GetHerHis] life.;[From.GetFirstName] [From.GetOnlyDynastyName] a été découvert dans une tour où [From.GetSheHe] se terrait. [From.GetSheHeCap] s'est empressé de se rendre avant de mettre un genou à terre devant vous et de vous offrir [Root.GetValyrianSword] en échange de sa vie.;;;;;;;;;;;;x
EVTOPTAraid_events.671;I now wield this for House [Root.GetOnlyDynastyName]!;Je manie désormais cette épée au nom de la maison [Root.GetOnlyDynastyName]!;;;;;;;;;;;;x
EVTDESCraid_events.672;Atop the battlements [From.GetFirstName] [From.GetOnlyDynastyName] is finally cornered. The blade you desire, [From.GetValyrianSwordHerHis], is covered in the red blood of the reavers [From.GetSheHe] has slain, and as [From.GetSheHe] charges you know you must truly pay the iron price to win this sword.;Debout sur les remparts, [From.GetFirstName] [From.GetOnlyDynastyName] fait face aux razzieurs et son épée, [From.GetValyrianSwordHerHis], est déjà gorgée de leur sang. [From.GetSheHeCap] vous charge et vous savez désormais qu'il va vous falloir payer le fer-prix pour vous gagner cette épée.;;;;;;;;;;;;x
EVTDESCraid_events.672B;Atop the battlements [From.GetFirstName] [From.GetOnlyDynastyName] is finally cornered. The blade you desire, [From.GetValyrianSwordHerHis], is covered in the red blood of the raiders [From.GetSheHe] has slain, and as [From.GetSheHe] charges you know you must truly fight to win this sword.;Debout sur les remparts, [From.GetFirstName] [From.GetOnlyDynastyName] fait face aux razzieurs et son épée, [From.GetValyrianSwordHerHis], est déjà gorgée de leur sang. [From.GetSheHeCap] vous charge et vous savez désormais qu'il va vous falloir payer le fer-prix pour vous gagner cette épée.;;;;;;;;;;;;x
EVTOPTAraid_events.672;[From.GetSheHeCap]'ll need more than a fancy sword;[From.GetSheHeCap] va lui falloir bien plus qu'une belle épée.;;;;;;;;;;;;x
EVTDESCraid_events.673;[FromFrom.GetFirstName] [FromFrom.GetOnlyDynastyName] lies defeated at your feet, [FromFrom.GetSheHe] was brave you must admit. But now you pick up your prize, [From.GetValyrianSwordHerHis].;[FromFrom.GetFirstName] [FromFrom.GetOnlyDynastyName] gît à vos pieds. C'était un brave, il n'y a pas de doutes. Mais maintenant vous vous emparez de votre prix, [From.GetValyrianSwordHerHis], son épée en acier valyrien.;;;;;;;;;;;;x
EVTOPTAraid_events.673;I now wield this for House [Root.GetOnlyDynastyName]!;Je manie désormais cette épée au nom de la maison [Root.GetOnlyDynastyName]!;;;;;;;;;;;;x
EVTDESCraid_events.674;[From.GetFirstName] [From.GetOnlyDynastyName] has beaten you into submission, almost killing you. And now [From.GetSheHe] claims [Root.GetValyrianSwordOwned], your family's heirloom, as [From.GetHerHis] own, and has also taken you as a 'trophy' as well.;[From.GetFirstName] [From.GetOnlyDynastyName] vous a vaincu. Et maintenant [From.GetSheHe] réclame [Root.GetValyrianSwordOwned], votre épée valyrienne ancestrale. [From.GetSheHeCap] s'est également emparé(e) de vous en tant que’trophée’.;;;;;;;;;;;;x
EVTOPTAraid_events.674;The shame I have brought;Quelle humiliation.;;;;;;;;;;;;x
EVTDESCraid_events.676;After successfully sacking the castle, [From.GetFirstName] [From.GetOnlyDynastyName] captured [FromFrom.GetFirstName] [FromFrom.GetOnlyDynastyName] who wielded a fearsome sword made of Valyrian Steel. As [From.GetSheHe] paid the iron price for it, [From.GetSheHe] has claimed it for [From.GetHerHim]self.;Après avoir saccagé le château, [From.GetFirstName] [From.GetOnlyDynastyName] a capturé [FromFrom.GetFirstName] [FromFrom.GetOnlyDynastyName qui maniait une épée faite en acier valyrien. [From.GetSheHe] a payé le fer-prix pour elle, [From.GetSheHe] l'a fait sienne. ;;;;;;;;;;;;x
EVTDESCraid_events.676B;After successfully sacking the castle, [From.GetFirstName] [From.GetOnlyDynastyName] captured [FromFrom.GetFirstName] [FromFrom.GetOnlyDynastyName] who wielded a fearsome sword made of Valyrian Steel. [From.GetSheHeCap] has claimed the blade for [From.GetHerHim]self.;Après avoir saccagé le château, [From.GetFirstName] [From.GetOnlyDynastyName] a capturé [FromFrom.GetFirstName] [FromFrom.GetOnlyDynastyName qui maniait une épée faite en acier valyrien. [From.GetSheHe] a payé le fer-prix pour elle, [From.GetSheHe] l'a fait sienne. ;;;;;;;;;;;;x
EVTDESCraid_events.677;[From.GetFirstName] [From.GetOnlyDynastyName] and [From.GetHerHis] fellow brigands could not handle you. You and a core of your men carved a path through them and escaped the castle, [Root.GetValyrianSwordOwned] still in your hands all the while.;[From.GetFirstName] [From.GetOnlyDynastyName] et ses pillards n'ont pas pu vous arrêter. Vous et certains de vos hommes avez pu vous frayer un chemin à travers leur rang et vous échapper. [Root.GetValyrianSwordOwned] , votre épée en acier valyrien ancestrale est toujours entre vos mains.;;;;;;;;;;;;x
EVTOPTAraid_events.677;A small victory at least;Une petite victoire, au moins…;;;Una pequeña victoria al menos.;;;;;;;;;x
opinion_stole_sword;Stole my Sword;A volé mon épée;;;Ha robado mi espada;;;;;;;;;x
EVTDESCraid_events.90;The village was ripe for pillaging, and [From.GetFirstName] [From.GetOnlyDynastyName]'s attack was a roaring success. The screams of the peasants and the crackle of fire were sweet music to the reaver's ears. They have won much plunder and honour this day!;Le village était mûr pour le pillage et l'attaque de [From.GetFirstName] [From.GetOnlyDynastyName] fut un succès total. Les gémissements des paysans et le crépitement des flammes sont les plus belles musiques du monde pour des razzieurs. Aujourd'hui ils ont gagné quantité de butins et d'honneur!;;;La aldea estaba madura para el ataque y el asalto de [From.GetFirstName] [From.GetOnlyDynastyName] fue un éxito total. Los gemidios de los campesinos y el crepitar de las llamas son la mejor música del mundo para los saqueadores. Hoy han ganado gran cantidad de botín y honor!;;;;;;;;;x
EVTDESCraid_events.91;[From.GetFirstName] [From.GetOnlyDynastyName]'s decision to attack a fishing village produced a fight that was hard fought and a few of [From.GetHerHis] men were lost. But none can withstand the might of the ironborn and they have claimed their iron price today, winning much plunder from these weak people.;La décision de [From.GetFirstName] [From.GetOnlyDynastyName] d'attaquer le village de pêcheurs a résulté en un combat difficile et acharné et certains de ses hommes ont trouvé la mort. Mais personne ne peut résister à la force des fer-nés et ils ont revendiqué le fer-prix aujourd'hui, gagnant leur butin par le sang de ce peuple faible.;;;La decisión de [From.GetFirstName] [From.GetOnlyDynastyName] de atacar la aldea de pescadores resultó en un dificil combate y perdieron algunos hombres. Pero no pudieron resistir la fuerza de los Hijos del Hierro y reivindicaron el precio del hierro, ganando su botín por la sangre de este débil pueblo.;;;;;;;;;x
