#CODE;ENGLISH;FRENCH;GERMAN;;SPANISH;;;;;;;;;x
ironborn_reaving;Go on a reaving;Partir pour un raid;;;Organizar una expedición de saqueo;;;;;;;;;x
ironborn_reaving_desc;Pay the iron price and organise a ironborn reaving across the Narrow Sea, to pillage and plunder. You will need a §Yregent§! whilst away.;Payer le fer-prix et organiser un raid fer-né au-delà du Détroit pour razzier et piller. Vous allez avoir besoin d'un ¤Yrégent¤! pendant votre absence.;;;Pagar el precio del hierro y organizar una expedición de saqueo más allá del Mar Angosto. Necesitarás un ¤Yregente¤! Durante tu ausencia.;;;;;;;;;x
on_reaving;Reaving;En raid;;;En una expedición de saqueo;;;;;;;;;x
on_reaving_desc;This character is abroad reaving and paying the iron price ;Ce personnage se trouve à l'étranger pour razzier et payer le fer-prix;;;Este personaje está en una expedición de saqueo;;;;;;;;;x
TOOLTIPINVITEREAVING;The Ironborn in your court and family will be invited to go on a reaving\n;Les Fer-nés de votre cour et de votre famille vont être invités à participer à un raid\n;;;Los Hombres del Hierro de tu corte y de tu familia serán invitados a participar en una expedición de saqueo.\n;;;;;;;;;x
EVTDESCraid_events.1;Who shall suffer the wroth of the Ironborn? Where shall we pillage and plunder to pay the Iron price?;Qui subira la colère des Fer-Nés? Où devrions-nous piller et razzier pour payer le fer-prix?;;;Quién sufrirá la cólera de los Hijos del Hierro? Dónde deberíamos saquear para pagar el precio del hierro?;;;;;;;;;x
EVTOPTAraid_events.1;The Disputed Lands are ripe for pillage;Les Terres Disputées sont mûres pour le pillage;;;Las Tierras de la Discordia están maduras para el saqueo;;;;;;;;;x
EVTOPTBraid_events.1;Northern Essos shall suffer;Le Nord d'Essos va souffrir;;;El Norte de Essos sufrirá;;;;;;;;;x
EVTOPTCraid_events.1;The lands of the Summer Sea are weak;Les pays de la Mer d’Été sont faibles;;;Las tierras del Mar del Verano son débiles;;;;;;;;;x
EVTOPTDraid_events.1;Slaver's Bay has much plunder to be found;La Baie des Serfs nous rapportera le plus de butin;;;La Bahía de los Esclavos nos proporcionará un gran botín;;;;;;;;;x
EVTDESCraid_events.2;[Root.GetFirstName] [Root.GetOnlyDynastyName], I invite you to the pay the iron price by joining me on a reaving across in the seas of The Disputed Lands. I promise we will gain many salt wives and much plunder, as in the ways of old!\n\n Yours,\n[From.GetFirstName] [From.GetOnlyDynastyName];[Root.GetFirstName] [Root.GetOnlyDynastyName], je vous invite à payer le fer-prix en rejoignant mon raid au-delà du Détroit. Je vous promet quantité de femme-sels et de butins, comme autrefois!\n\n Bien à vous,\n[From.GetFirstName] [From.GetOnlyDynastyName];;;[Root.GetFirstName] [Root.GetOnlyDynastyName], os invito a pagar el precio del hierro uniéndoos a mi expedición de saqueo más allá de las Tierras de la Discordia. Os prometo gran cantidad de esposas de sal y botines, como las antiguas costumbres!\n\n Atentamente,\n[From.GetFirstName] [From.GetOnlyDynastyName];;;;;;;;;x
EVTDESCraid_events.2B;[Root.GetFirstName] [Root.GetOnlyDynastyName], I invite you to the pay the iron price by joining me on a reaving far to the north in the Shivering Sea, where we can target Lorathi and Ibbenese ships. I promise we will gain many salt wives and much plunder, as in the ways of old!\n\n Yours,\n[From.GetFirstName] [From.GetOnlyDynastyName];[Root.GetFirstName] [Root.GetOnlyDynastyName], je vous invite à payer le fer-prix en rejoignant mon raid au-delà du Détroit. Je vous promet quantité de femme-sels et de butins, comme autrefois!\n\n Bien à vous,\n[From.GetFirstName] [From.GetOnlyDynastyName];;;[Root.GetFirstName] [Root.GetOnlyDynastyName], os invito a pagar el precio del hierro uniéndoos a mi expedición de saqueo más allá del Mar de los Escalofríos, donde atacaremos naves lorathias e Ibbenesas. Os prometo gran cantidad de esposas de sal y botines, como las antiguas costumbres!\n\n Atentamente,\n[From.GetFirstName] [From.GetOnlyDynastyName];;;;;;;;;x
EVTDESCraid_events.2C;[Root.GetFirstName] [Root.GetOnlyDynastyName], I invite you to the pay the iron price by joining me on a reaving to the south in the Summer Sea, where we can target the weak Summer Islanders. I promise we will gain many salt wives and much plunder, as in the ways of old!\n\n Yours,\n[From.GetFirstName] [From.GetOnlyDynastyName];[Root.GetFirstName] [Root.GetOnlyDynastyName], je vous invite à payer le fer-prix en rejoignant mon raid au-delà du Détroit. Je vous promet quantité de femme-sels et de butins, comme autrefois!\n\n Bien à vous,\n[From.GetFirstName] [From.GetOnlyDynastyName];;;[Root.GetFirstName] [Root.GetOnlyDynastyName], os invito a pagar el precio del hierro uniéndoos a mi expedición de saqueo al Sur del Mar del Verano, donde atacaremos las débiles naves estiveñas. Os prometo gran cantidad de esposas de sal y botines, como las antiguas costumbres!\n\n Atentamente,\n[From.GetFirstName] [From.GetOnlyDynastyName];;;;;;;;;x
EVTDESCraid_events.2D;[Root.GetFirstName] [Root.GetOnlyDynastyName], I invite you to the pay the iron price by joining me on a reaving far to the east in Slaver's Bay. I promise we will gain many salt wives and much plunder, as in the ways of old!\n\n Yours,\n[From.GetFirstName] [From.GetOnlyDynastyName];[Root.GetFirstName] [Root.GetOnlyDynastyName], je vous invite à payer le fer-prix en rejoignant mon raid au-delà du Détroit. Je vous promet quantité de femme-sels et de butins, comme autrefois!\n\n Bien à vous,\n[From.GetFirstName] [From.GetOnlyDynastyName];;;[Root.GetFirstName] [Root.GetOnlyDynastyName], os invito a pagar el precio del hierro uniéndoos a mi expedición de saqueo al lejano oriente, en la Bahía de los Esclavos. Os prometo gran cantidad de esposas de sal y botines, como las antiguas costumbres!\n\n Atentamente,\n[From.GetFirstName] [From.GetOnlyDynastyName];;;;;;;;;x
EVTOPTAraid_events.2;I shall join him!;Je vais le rejoindre!;;;Me uniré!;;;;;;;;;x
EVTOPTBraid_events.2;Reaving is not for me;Le raid n'est pas fait pour moi;;;El saqueo no es lo mio;;;;;;;;;x
EVTOPTCraid_events.2;I do not wish to go no any reavings ever!;Je ne veux plus jamais prendre part à aucun raid!;;;No participaré en ninguna expedición nunca!;;;;;;;;;x
TOOLTIPREAVINGDISPUTEDLANDS;You will join [From.GetFirstName] [From.GetOnlyDynastyName] on his reaving in the Disputed Lands. You will need a regent whilst away.\n;Vous allez vous joindre au raid de [From.GetFirstName] [From.GetOnlyDynastyName] sur les Terres Disputées. Vous allez avoir besoin d'un régent pendant votre absence.\n;;;Te unirás a la expedición de [From.GetFirstName] [From.GetOnlyDynastyName] en las Tierras de la Discordia. Necesitarás un regente durante tu ausencia.\n;;;;;;;;;x
TOOLTIPREAVINGNORTHESSOS;You will join [From.GetFirstName] [From.GetOnlyDynastyName] on his reaving in Northern Essos. You will need a regent whilst away.\n;Vous allez vous joindre au raid de [From.GetFirstName] [From.GetOnlyDynastyName] sur le Nord d'Essos. Vous allez avoir besoin d'un régent pendant votre absence.\n;;;Te unirás a la expedición de [From.GetFirstName] [From.GetOnlyDynastyName] en el norte de Essos. Necesitarás un regente durante tu ausencia.\n;;;;;;;;;x
TOOLTIPREAVINGSUMMERSEA;You will join [From.GetFirstName] [From.GetOnlyDynastyName] on his reaving in the Summer Sea. You will need a regent whilst away.\n;Vous allez vous joindre au raid de [From.GetFirstName] [From.GetOnlyDynastyName] en Mer d'Eté. Vous allez avoir besoin d'un régent pendant votre absence.\n;;;Te unirás a la expedición de [From.GetFirstName] [From.GetOnlyDynastyName] en el Mar del Verano. Necesitarás un regente durante tu ausencia.\n;;;;;;;;;x
TOOLTIPREAVINGSLAVERSBAY;You will join [From.GetFirstName] [From.GetOnlyDynastyName] on his reaving in Slaver's Bay. You will need a regent whilst away.\n;Vous allez vous joindre au raid de [From.GetFirstName] [From.GetOnlyDynastyName] dans la Baie des Serfs. Vous allez avoir besoin d'un régent pendant votre absence.\n;;;Te unirás a la expedición de [From.GetFirstName] [From.GetOnlyDynastyName] en la Bahía de los Esclavos. Necesitarás un regente durante tu ausencia.\n;;;;;;;;;x
EVTDESCraid_events.3;The men are ready, the longships prepared. Now we begin our journey across the Narrow Sea to pay the Iron Price!;Les hommes sont prêts, les boutres préparées. Enfin commence notre voyage au-delà du Détroit pour payer le fer-prix!;;;Los hombres están listos, los barcoluengos preparados. Por fin comienza nuestro viaje más allá del Mar Angosto para pagar el precio del hierro!;;;;;;;;;x
EVTOPTAraid_events.3;This will be most profitable;Cela va être très profitable;;;Será muy provechoso;;;;;;;;;x
EVTOPTBraid_events.3;The war makes this impossible;La guerre nous en empêche;;;La guerra hace que esto sea imposible;;;;;;;;;x
EVTDESCraid_events.4;The reaving has come to end. We have returned from across the Seas after abiding by the Old Way of reaving and pillaging like true Ironborn, we have gained much respect for our daring and ambition.;Le raid est achevé. Nous sommes revenus d'au-delà du Détroit après avoir observé l'Antique Voie de la razzia et du pillage comme de vrais Fer-nés, nous avons gagné beaucoup de respect pour notre audace et nos ambitions. ;;;La expedición de saqueo ha llegado a su fin. Hemos regresado de más allá del Mar Angosto tras seguir la Antigua Costumbre del saqueo y el pillaje como verdaderos Hijos del Hierro, hemos ganado mucho respeto por nuestra audacia y ambición. ;;;;;;;;;x
EVTOPTAraid_events.4;We are true Ironborn!;Nous sommes de vrais Fer-nés!;;;Somos verdaderos Hijos del Hierro!;;;;;;;;;x
EVTDESCraid_events.5;[From.GetFirstName] [From.GetOnlyDynastyName]'s reaving has come to end. We have returned from across the Narrows Sea after gaining much plunder and capturing many salt wives. ;Le raid de [From.GetFirstName] [From.GetOnlyDynastyName] est terminé. Nous sommes revenus d'au-delà du détroit après avoir amassé quantité de butins et capturé de nombreuses femme-sels. ;;;La expedición de [From.GetFirstName] [From.GetOnlyDynastyName] ha terminado. Hemos regresado de más allás del Mar Angosto tras conseguir grandes cantidades de botín y haber capturado numerosas esposas de sal. ;;;;;;;;;x
EVTDESCraid_events.6;Due to the war, [From.GetFirstName] [From.GetOnlyDynastyName]'s planned reaving across the Narrow Sea has been cancelled.;A cause de la guerre, le raid prévu par [From.GetFirstName] [From.GetOnlyDynastyName] a été annulé.;;;A causa de la guerra, la expedición de saqueo prevista por [From.GetFirstName] [From.GetOnlyDynastyName] ha sido cancelada.;;;;;;;;;x
EVTOPTAraid_events.6;There is always next year;Peut-être l'année prochaine;;;Quizás el año que viene.;;;;;;;;;x
opinion_on_reaving;On reaving;En raid;;;En una expedición de saqueo;;;;;;;;;x
opinion_went_reaving;Went reaving;A mené un raid;;;Lideró una expedición de saqueo;;;;;;;;;x
EVTDESCraid_events.7;A scout has spied a coastal fishing village, he says there is much plunder and many women to be found there.;Un éclaireur a repéré une village de pêcheurs, il dit que quantité de butins et de femme-sels nous y attendent.;;;Un explorador ha divisado una aldea de pescadores, dice que gran cantidad de botín y esposas de sal nos esperan.;;;;;;;;;x
EVTOPTAraid_events.7;Let the reaving begin!;Que le raid commence!;;;Que comience el saqueo!;;;;;;;;;x
EVTDESCraid_events.9;The raid was a roaring success. The screams of the peasants and the crackle of fire were sweet music to the reaver's ears. We have gained much plunder and honour this day!;Le raid fut couronné de succès. Les gémissements des paysans et le crépitement des flammes sont les plus belles musiques du monde. Aujourd'hui nous avons gagné quantité de butins et d'honneur!;;;El saqueo fue un gran éxito. Los gemidios de los campesinos y el crepitar de las llamas son la mejor música del mundo. Hoy hemos ganado gran cantidad de botín y honor!;;;;;;;;;x
EVTOPTAraid_events.9;All fear the Ironborn!;Tous craignent les Fer-nés!;;;Todos temen a los Hijos del Hierro!;;;;;;;;;x
EVTDESCraid_events.10;The fight was hard fought and a few of our men were lost. But none can withstand the might of the ironborn and we have claimed our iron price today, winning our plunder from these weak people.;Le combat fut difficile et acharné et nous avons perdu quelques-uns de nos hommes. Mais personne ne peut résister à la force des fer-nés et nous avons revendiqué le fer-prix aujourd'hui, gagnant notre butin par le sang de ce peuple faible.;;;El combate fue dificil y perdimos algunos hombres. Pero no pudieron resistir la fuerza de los Hijos del Hierro y reivindicamos el precio del hierro, ganando nuestro botín por la sangre de este débil pueblo.;;;;;;;;;x
EVTOPTAraid_events.10;A successful raid;Un raid couronné de succès;;;Asalto exitoso;;;;;;;;;x
EVTDESCraid_events.11;These men who sow were more hardy than we thought. Our Ironborn managed to make a beachhead but were fought back. We have failed to claim our iron price today.;Ces hommes qui sèment étaient plus forts que nous le pensions. Nous avons bien réussit à mettre en place une tête de pont mais nous avons été repoussé. Nous avons échoué à revendiquer le fer-prix aujourd'hui.;;;Estos hombres que siembran son más fuertes de lo que pensábamos. Logramos establecer una cabeza de puente, pero fuimos rechazados. No hemos conseguido reclamar el precio del hierro hoy.;;;;;;;;;x
EVTOPTAraid_events.11;We shall be back;Nous reviendrons;;;Volveremos;;;;;;;;;x
opinion_failed_raid;Failed raid;Raid échoué;;;Asalto fracasado;;;;;;;;;x
EVTDESCraid_events.12;The raid was a resounding failiure, the men of the fields were much stronger than we thought. Many of our reavers were slain and the dishonour we have brought upon the Ironborn is plain to see..;Le raid fut un échec retentissant. Les hommes des champs étaient bien plus forts que nous ne l'avions pensé. Beaucoup de nos razzieurs ont été tué et nous avons déshonoré le nom de Fer-né;;;El asalto fue un rotundo fracaso. Los hombres de los campos eran más fuertes de lo que pensábamos. Muchos de nuestros hombres han muerto y hemos deshonrado el nombre de los Hijos del Hierro.;;;;;;;;;x
EVTOPTAraid_events.12;We are poor Ironborn;Nous sommes de piètres Fer-nés;;;No merecemos ser Hijos del Hierro;;;;;;;;;x
EVTDESCraid_events.13;The village was ripe for pillaging, and [From.GetFirstName] [From.GetOnlyDynastyName]'s attack was a roaring success. The screams of the peasants and the crackle of fire were sweet music to the reaver's ears. We have much plunder and honour this day!;Le village était mûr pour le pillage et l'attaque de [From.GetFirstName] [From.GetOnlyDynastyName] fut un succès total. Les gémissements des paysans et le crépitement des flammes sont les plus belles musiques du monde. Aujourd'hui nous avons gagné quantité de butins et d'honneur!;;;La aldea estaba madura para el ataque y el asalto de [From.GetFirstName] [From.GetOnlyDynastyName] fue un éxito total. Los gemidos de los campesinos y el crepitar de las llamas son la mejor música del mundo. Hoy hemos ganado gran cantidad de botín y honor!;;;;;;;;;x
EVTDESCraid_events.14;[From.GetFirstName] [From.GetOnlyDynastyName]'s decision to attack a fishing village produced a fight that was hard fought and a few of our men were lost. But none can withstand the might of the ironborn and we have claimed our iron price today, winning our plunder from these weak people.;La décision de [From.GetFirstName] [From.GetOnlyDynastyName] d'attaquer le village de pêcheurs a résulté en un combat difficile et acharné et certains de nos hommes ont trouvé la mort. Mais personne ne peut résister à la force des fer-nés et nous avons revendiqué le fer-prix aujourd'hui, gagnant notre butin par le sang de ce peuple faible.;;;La decisión de [From.GetFirstName] [From.GetOnlyDynastyName] de atacar la aldea de pescadores resultó en un dificil combate y perdimos algunos hombres. Pero no pudieron resistir la fuerza de los Hijos del Hierro y reivindicamos el precio del hierro, ganando nuestro botín por la sangre de este débil pueblo.;;;;;;;;;x
EVTDESCraid_events.15;Most thought [From.GetFirstName] [From.GetOnlyDynastyName]'s raid upon the a village would be simple, but these men who sow were more hardy than we thought. Our Ironborn managed to make a beachhead but were fought back. We have failed to claim our iron price today.;Beaucoup pensait que le raid de [From.GetFirstName] [From.GetOnlyDynastyName] serait une simple formalité, mais ces hommes qui sèment étaient plus forts que nous le pensions. Nous avons bien réussit à mettre en place une tête de pont mais nous avons été repoussé. Nous avons échoué à revendiquer le fer-prix aujourd'hui.;;;Muchos pensaban que el asalto de [From.GetFirstName] [From.GetOnlyDynastyName] sería una simple formalidad pero estos hombres que siembran son más fuertes de lo que pensábamos. Logramos establecer una cabeza de puente, pero fuimos rechazados. No hemos conseguido reclamar el precio del hierro hoy.;;;;;;;;;x
EVTDESCraid_events.16;[From.GetFirstName] [From.GetOnlyDynastyName]'s raid upon a fishing village was a resounding failiure, the men of the fields were much stronger than we thought. Many of our reavers were slain and the dishonour we have brought upon the Ironborn is plain to see.;Le raid de [From.GetFirstName] [From.GetOnlyDynastyName] sur un village de pêcheurs fut un échec retentissant. Les hommes des champs étaient bien plus forts que nous ne l'avions pensé. Beaucoup de nos razzieurs ont été tué et nous avons déshonoré le nom de Fer-né.;;;El asalto de [From.GetFirstName] [From.GetOnlyDynastyName] a una aldea de pescadores fue un rotundo fracaso. Los hombres de los campos eran más fuertes de lo que pensábamos. Muchos de nuestros hombres han muerto y hemos deshonrado el nombre de los Hijos del Hierro.;;;;;;;;;x
opinion_sucessful_raid;Successful raid;Raid réussit;;;Asalto exitoso;;;;;;;;;x
opinion_salt_wife;Salt Wife;Femme-sel;;;Esposa de Sal;;;;;;;;;x
EVTDESCraid_events.17;This day I have proved myself a true Iron Islander, I have captured a salt wife! What shall be done with her?;Aujourd'hui, j'ai prouvé que j'étais un vrai Fer-né, j'ai capturé une femme-sel! Que dois-je faire d'elle maintenant?;;;Hoy, he demostrado que soy un verdadero Hijo del Hierro, he capturado a una esposa de sal! Qué debería hacer con ella?;;;;;;;;;x
EVTOPTAraid_events.17;I shall keep her;Je vais la garder;;;La mantendré;;;;;;;;;x
EVTOPTBraid_events.17;Kill her, she is not worthy;Mieux vaut la tuer, elle n'en est pas digne;;;La mataré, no es digna.;;;;;;;;;x
EVTDESCraid_events.18;[From.GetFirstName] [From.GetOnlyDynastyName] has proved himself worthy to be called Ironborn as he has captured himself a salt wife.;[From.GetFirstName] [From.GetOnlyDynastyName] a prouvé qu'il était digne d'être appelé Fer-né, il a capturé une femme-sel. ;;;[From.GetFirstName] [From.GetOnlyDynastyName] ha demostrado que es un digno Hijo del Hierro, ha capturado una esposa de sal.;;;;;;;;;x
EVTOPTAraid_events.18;Good man!;Un Fer-né!;;;Buen hombre!;;;;;;;;;x
salt_wife;Salt wife;Femme-sel;;;Esposa de sal;;;;;;;;;x
salt_wife_desc;This character is someone's salt wife, captured by an Ironborn reaver.;Ce personnage est la femme-sel de quelqu'un, capturé par un razzieur Fer-né.;;;Este personaje es la esposa de sal de alguien, capturada en un saqueo de los Hijos del Hierro.;;;;;;;;;x
EVTDESCraid_events.20;The reaving party has been roving the coast, but a local patrol has spotted us and is attacking. Being Ironborn we of course shall meet this challenge, but the leader of their band stands before me with but one thought to kill me...;Alors que la flotte longeait la côte, une patrouille locale nous a repéré et cherche à nous affronter. En tant que Fer-nés nous allons relever ce défi, mais leur chef se trouve face à moi avec une seule idée en tête: me tuer.;;;Mientras la flota bordeaba la costa, una patrulla local reparó en nosotros y se enfrentó con nosotros. Como Hijos del Hierro que somos aceptamos el desafío, pero su jefe se encuentra cara a cara conmigo con la única intención de matarme.;;;;;;;;;x
EVTOPTAraid_events.20;Charge!;A l'assaut!!;;;A la carga!;;;;;;;;;x
EVTOPTBraid_events.20;I'm getting out of here;Nous devons nous échapper;;;Debemos escapar;;;;;;;;;x
EVTDESCraid_events.22;The reaving party had been roving the coast when a local patrol headed by [FromFrom.GetFirstName] [FromFrom.GetOnlyDynastyName] attacked. We of course easily butchered these people, but the glory surely belongs to [From.GetFirstName] [From.GetOnlyDynastyName] who bested [FromFrom.GetFirstName] in single combat, swinging the battle in our favour. He now expects to be rewarded.;La flotte longeait les côtes lorsqu'une patrouille locale menée par [FromFrom.GetFirstName] [FromFrom.GetOnlyDynastyName] nous a attaqué. Nous avons, bien sûr, aisément massacré ces faiblards, mais la gloire revient surtout à [From.GetFirstName] [From.GetOnlyDynastyName] qui a terrassé [FromFrom.GetFirstName] en combat singulier, contribuant ainsi grandement à notre victoire. Il espère maintenant en être récompensé.  ;;;La flota bordeaba la costa cuando una patrulla local liderada por [FromFrom.GetFirstName] [FromFrom.GetOnlyDynastyName] nos atacó. Masacramos fácilmente a estos flojos oponentes, pero la gloria ha recaído en [From.GetFirstName] [From.GetOnlyDynastyName] que ha derrotado a [FromFrom.GetFirstName] en combate singular, contribuyendo decisivamente a nuestra victoria. Él espera ser recompensado. ;;;;;;;;;x
opinion_rewarded_reaving;Rewarded;Récompensé;;;Recompensado;;;;;;;;;x
opinion_denied_rewarded_reaving;Denied Reward;Pas récompensé;;;No recompensado;;;;;;;;;x
EVTDESCraid_events.23;The reaving party had been roving the coast when a local patrol headed by [From.GetFirstName] [From.GetOnlyDynastyName] attacked. We lost many men in the attack, [FromFrom.GetFirstName] [FromFrom.GetOnlyDynastyName] being among them, losing to [From.GetFirstName] in single combat. Our party survives however, to reave another day.;La flotte longeait la côte lorsqu'une patrouille locale menée par [From.GetFirstName] [From.GetOnlyDynastyName] nous a attaqué. Nombre de nos hommes sont morts dans l'attaque, [FromFrom.GetFirstName] [FromFrom.GetOnlyDynastyName] en fait parti, tué lors en combat singulier par [From.GetFirstName]. Notre flotte a cependant survécu, nous pourrons continuer de raider.;;;La flota bordeaba la costa cuando una patrulla local liderada por [FromFrom.GetFirstName] [FromFrom.GetOnlyDynastyName] nos atacó. Muchos de nuestros hombres murieron en el combate, entre ellos [FromFrom.GetFirstName] [FromFrom.GetOnlyDynastyName], muerto en combate singular contra [From.GetFirstName]. Sin embargo, nuestra flota sobrevivió, podremos continuar la expedición de saqueo.;;;;;;;;;x
EVTOPTAraid_events.22;Good for him;Bon travail;;;Buen trabajo;;;;;;;;;x
EVTOPTBraid_events.22;Very well, give him some plunder;Très bien, qu'il prenne une part du butin;;;Muy bien, que tome una parte del botín.;;;;;;;;;x
EVTOPTCraid_events.22;Reward? The glory is surely enough;Une récompense? La gloire est sûrement suffisante;;;Una recompensa? La gloria debería ser suficiente;;;;;;;;;x
EVTOPTAraid_events.23;He will be missed;Il va être regretté;;;Será añorado;;;;;;;;;x
TOOLTIPREAVINGDUEL;A duel will ensue with a local master at arms\n;Un duel s'ensuivra avec Maître-d'armes local\n;;;Un duelo tendrá lugar con el Maestro de Armas local\n;;;;;;;;;x
TOOLTIPREAVINGDUELVS;You will take [From.GetFirstName] [From.GetOnlyDynastyName]'s §YValyrian steel sword§! for your own\n;Vous ferez votre l'¤Yépée en acier Valyrien¤! de [From.GetFirstName] [From.GetOnlyDynastyName]\n;;;Harás tuya la §Yespada valyria de§! de [From.GetFirstName] [From.GetOnlyDynastyName]\n;;;;;;;;;x
EVTDESCraid_events.24;During the attack by our reavers I was somehow wounded by one of the enemy, but the Ironborn laugh in the face of flesh wounds surely?;Durant l'attaque, j'ai été blessé par un ennemi, mais un vrai Fer-né se rit des blessures superficielles, n'est-ce pas? ;;;Durante el ataque, fui herido por un enemigo, pero un verdadero Hijo del Hierro se rie de las heridas superficiales, no es así? ;;;;;;;;;x
EVTOPTAraid_events.24;Yes, I will reave some more!;Oui, j'ai encore de nombreuses contrées à razzier!;;;Sí, todavía tengo muchos lugares que saquear!;;;;;;;;;x
EVTOPTBraid_events.24;Actually, I think i should go home;Je crois que je vais rentrer chez moi;;;Creo que debería regresar a casa;;;;;;;;;x
EVTDESCraid_events.25;During the attack, [From.GetFirstName] [From.GetOnlyDynastyName] was wounded by an enemy fighter. But like a true Ironborn, he has chosen to stay with our band of reavers.;Durant l'attaque, [From.GetFirstName] [From.GetOnlyDynastyName] a été blessé par un combattant ennemi. Mais comme un véritable Fer-né, il a choisi de rester. ;;;Durante el ataque, [From.GetFirstName] [From.GetOnlyDynastyName] fue herido por un combatiente enemigo. Pero como un verdadero Hijo del Hierro, ha escogido quedarse.;;;;;;;;;x
EVTOPTAraid_events.25;Good man!;Un véritable Fer-né!;;;Un verdadero Hijo del Hierro!;;;;;;;;;x
EVTDESCraid_events.26;During the attack, [From.GetFirstName] [From.GetOnlyDynastyName] was wounded by an enemy fighter. He has chosen to go back home as a consequence.;Durant l'attaque, [From.GetFirstName] [From.GetOnlyDynastyName] a été blessé par un combattant ennemi. Il a décidé de rentrer chez lui. ;;;Durante el ataque, [From.GetFirstName] [From.GetOnlyDynastyName] fue herido por un combatiente enemigo. Ha decidido regresar a casa.;;;;;;;;;x
