#CODE;ENGLISH;FRENCH;GERMAN;;SPANISH;;;;;;;;;x
EVTDESCraid_events.92;Most thought [From.GetFirstName] [From.GetOnlyDynastyName]'s raid upon the a village would be simple, but these men who sow were more hardy than they thought. [From.GetHerHisCap] Ironborn managed to make a beachhead but were fought back. They have failed to claim their iron price today.;Beaucoup pensait que le raid de [From.GetFirstName] [From.GetOnlyDynastyName] serait une simple formalité, mais ces hommes qui sèment étaient plus forts qu'ils le pensaient. Ses fer-nés ont réussit à mettre en place une tête de pont mais ont été repoussés. Ils ne sont pas parvenus à revendiquer le fer-prix aujourd'hui.;;;Muchos pensaban que el asalto de [From.GetFirstName] [From.GetOnlyDynastyName] sería una simple formalidad pero esos hombres que siembran eran más fuertes de lo que pensaban. Los Hijos del Hierro lograron establecer una cabeza de puente, pero fueron rechazados. No consiguieron reclamar el precio del hierro hoy.;;;;;;;;;x
EVTDESCraid_events.93;[From.GetFirstName] [From.GetOnlyDynastyName]'s raid upon a fishing village was a resounding failiure, the men of the fields were much stronger than they thought. Many of [From.GetHerHis] reavers were slain and the dishonour [From.GetSheHe] has brought upon the Ironborn is plain to see.;Le raid de [From.GetFirstName] [From.GetOnlyDynastyName] sur un village de pêcheurs fut un échec retentissant. Les hommes des champs étaient bien plus forts qu'ils ne l'avaient pensé. Beaucoup de ses razzieurs ont été tué et le déshonneur qu'il a jeté sur les fer-nés est terrible. ;;;El asalto de [From.GetFirstName] [From.GetOnlyDynastyName] a una aldea de pescadores fue un rotundo fracaso. Los hombres de los campos eran más fuertes de lo que pensaban. Muchos de sus hombres murieron y deshonraron el nombre de los Hijos del Hierro.;;;;;;;;;x
EVTDESCraid_events.94;[From.GetFirstName] [From.GetOnlyDynastyName] fearlessly decided to attack a merchant flotilla, and the enemy crews were no match for [From.GetHerHis] Ironborn. They sank their poorly manned escorts, siezed there cargo and slew or took captive many men. This is why we follow the Old Way!;[From.GetFirstName] [From.GetOnlyDynastyName] a décidé sans crainte d'attaquer une flotille marchande. L'équipage ennemi n'était que du menu fretin pour les Fer-nés. Ils ont coulé leur pitoyable escorte, pillé leur cargaison et capturé de nombreux hommes. Voilà pourquoi nous suivons l'Antique Voie! ;;;[From.GetFirstName] [From.GetOnlyDynastyName] decidió sin temor atacar una flota mercante. La tripulación no fue más que un aperitivo a manos de los Hijos del Hierro. Hundieron a su escolta, saquearon su cargamento y capturaron a numerosos prisioneros. Por esto seguimos las Antiguas Costumbres!;;;;;;;;;x
EVTDESCraid_events.95;[From.GetFirstName] [From.GetOnlyDynastyName]'s decision to attack a merhcant fleet was sound, the fleet was fairly well defended. They lost a few men siezing their ships as well as taking some damge to their longships, but in the end no one can resist the Ironborn reavers and much cargo as well many captives were taken.;La décision de [From.GetFirstName] [From.GetOnlyDynastyName] d'attaquer la flotte marchande était bonne. La flotte était bien défendue. Ils ont perdu quelques hommes lorsqu'ils ont abordé leurs bateaux et certaines de leurs boutres ont été endommagées. Mais à la fin, personne ne peut résister aux valeureux Fer-nés et ils se sont emparé de leur cargaison et fait de nombreux prisonniers. ;;;La decisión de [From.GetFirstName] [From.GetOnlyDynastyName] de atacar la flota mercante fue acertada. La flota estaba bien defendida. Perdieron algunos hombres mientras abordaban sus naves y unos cuantos barcoluengos fueron dañados. Pero al final, no pudieron resistir contra los valerosos Hijos del Hierro y se hicieron con su cargamento y numerosos prisioneros.;;;;;;;;;x
EVTDESCraid_events.96;[From.GetFirstName] [From.GetOnlyDynastyName] 's attack on an enemy merhcant fleet seemed foolhardy, as the enemy merchants were too well armed for [From.GetHerHim] to take their gold. They utilised their warships to good effect, not allowing the ironborn to board their merhcant vessels. We lost a few men, but we shall be back to take our Iron price.;La décision de [From.GetFirstName] [From.GetOnlyDynastyName] d'attaquer une flotte marchande semble avoir été imprudente. Les marchands ennemis étaient bien trop armés pour qu'ils puissent prendre leur or. Ils ont bien manœuvré leurs navires de guerre pour empêcher les fer-nés d'aborder leurs voiles marchandes. Quelques hommes festoient désormais dans les demeures liquides mais les fer-nés reviendront pour prendre leur fer-prix. ;;;La decisión de [From.GetFirstName] [From.GetOnlyDynastyName] de atacar una flota mercante parece haber sido imprudente. La flota enemiga estaba muy bien armada para poder tomar su oro. Maniobraron sus navíos de guerra para impedirles abordar sus buques mercantes. Perdieron a unos cuantos hombres pero los Hijos del Hierro regresarán para tomar el precio del hierro.;;;;;;;;;x
EVTDESCraid_events.97;[From.GetFirstName] [From.GetOnlyDynastyName]'s attack on an merhcant flotilla was a disaster. Their warships were too well armed and well manned and [From.GetSheHe] lost many men and longships trying to board their vessels. This makes us look poor ironborn indeed.;L'attaque de[From.GetFirstName] [From.GetOnlyDynastyName] sur une flottille marchande a tourné au désastre. Leurs navires de guerres étaient bien trop armés et manœuvrées et les fer-nés ont perdu nombre d'hommes et de boutres en tentant d'aborder leurs bateaux. Voilà de bien piètres Fer-nés. ;;;El ataque de [From.GetFirstName] [From.GetOnlyDynastyName] a una flotilla mercante fue un desastre. Sus navíos de guerra estaban muy bien armados y dirigidos y los Hijos del Hierro perdieron un gran número de hombres y barcoluengos intentando abordar sus barcos. Unos medicores Hijos del Hierro. ;;;;;;;;;x
EVTOPTAraid_events.97;Lackwits;Imbéciles.;;;Imbéciles;;;;;;;;;x
EVTDESCraid_events.98;Whilst [raiding_target.GetSheHe] has been embroiled in conflict, we have been raiding the lands loyal to [raiding_target.GetTitledFirstName] [raiding_target.GetOnlyDynastyName]. [raiding_target.GetSheHeCap] will surely be displeased with this flagrant breach of the laws of [raiding_target.GetHerHis] land.;Alors qu'ils étaient occupés par un autre conflit, nous avons razzié les terres des seigneurs loyaux au Trône de Fer. Ils ne vont sûrement pas apprécier cette infraction aux lois des terres vertes. ;;;Mientras estaban ocupados en otro conflicto, hemos saqueado las tierras de los señores leales al Trono de Hierro. Seguramente estarán disgustados por esta violación flagrante de las leyes de sus tierras.;;;;;;;;;x
EVTOPTAraid_events.98;Pfft, we are Ironborn! We follow our own way!;Pfff, nous sommes des fer-nés, nous suivons notre propre voie !;;;Pfff, somos Hijos del Hierro, seguimos nuestras propias costumbres!;;;;;;;;;x
EVTOPTAraid_events.98B;I care not what they think!;Je me moque de ce qu'ils pensent!;;;No importa lo que piensen!;;;;;;;;;x
TOOLTIPlootvengeancereturnloot;All women kidnapped, slaves captured and swords stolen from the subjects of [Root.GetTitle] [Root.GetFirstName] [Root.GetOnlyDynastyName] by [From.GetFirstName] [From.GetOnlyDynastyName] and [From.GetHerHis] fellow his raiders shall be returned, along with a sum of gold in recompense.\n;Toutes les femmes kidnappées et les épées volées aux sujets de [Root.GetTitle] [Root.GetFirstName] [Root.GetOnlyDynastyName] par [From.GetFirstName] [From.GetOnlyDynastyName] et ses razzieurs devront être rendues avec en prime un certain montant en or en guise de dédommagement.\n;;;Todas las mujeres secuestradas y las espadas robadas a los súbditos de [Root.GetTitle] [Root.GetFirstName] [Root.GetOnlyDynastyName] por [From.GetFirstName] [From.GetOnlyDynastyName] y sus saqueadores deberán ser devueltas con una suma de dinero en concepto de compensación.\n;;;;;;;;;x
EVTDESCraid_events.99;[From.GetFirstName] [From.GetOnlyDynastyName] has defeated us on the field of battle, as vengeance for us pillaging [From.GetHerHis] lands in the Old Way. Now we must return all the plunder we have taken from them...;[From.GetFirstName] [From.GetOnlyDynastyName] nous a défait sur le champ de bataille. Nous devons maintenant rendre tout notre butin que nous avons pillé sur ses terres... ;;;[From.GetFirstName] [From.GetOnlyDynastyName] nos ha derrotado en el campo de batalla. Ahora debemos devolver todo el botín que saqueamos en sus tierras...;;;;;;;;;x
EVTDESCraid_events.99B;[From.GetFirstName] [From.GetOnlyDynastyName] has defeated us on the field of battle, as vengeance for us pillaging [From.GetHerHis] lands and seas. Now we must return all the plunder we have taken from them...;[From.GetFirstName] [From.GetOnlyDynastyName] nous a défait sur le champ de bataille, en rétribution de nos pillages de ses terres. Nous devons maintenant rendre tout notre butin...;;;[From.GetFirstName] [From.GetOnlyDynastyName] nos ha derrotado en el campo de batalla. Ahora debemos devolver todo el botín que saqueamos en sus tierras...;;;;;;;;;x
EVTOPTAraid_events.99;We will rise again;Nous ressurgirons.;;;Resurgiremos de nuevo.;;;;;;;;;x
EVTDESCraid_events.100;I have been rescued from these filthy pillagers by [FromFrom.GetFirstName] [FromFrom.GetOnlyDynastyName], who defeated [From.GetFirstName] [From.GetOnlyDynastyName] in the field as vengeance for pillaging [From.GetHerHis] lands.;J'ai été sauvé de ces sales fer-nés par [FromFrom.GetFirstName] [FromFrom.GetOnlyDynastyName], qui a défait [From.GetFirstName] [From.GetOnlyDynastyName] sur le champ de bataille.;;;He sido rescatado de estos sucios Hijos del Hierro por [FromFrom.GetFirstName] [FromFrom.GetOnlyDynastyName], que ha vencido a [From.GetFirstName] [From.GetOnlyDynastyName] en el campo de batalla.;;;;;;;;;x
EVTOPTAraid_events.100;Now I can go home;Je peux rentrer chez moi.;;;Puedo regresar a casa.;;;;;;;;;x
EVTDESCraid_events.101;[FromFrom.GetFirstName] [FromFrom.GetOnlyDynastyName] is truly a poor leader for [FromFrom.GetSheHe] has been defeated and has been forced into concessions by as recompense for [FromFrom.GetHerHis] raiding. I will now have to return my captive [From.GetFirstName] to [From.Liege.GetFirstName] [From.Liege.GetOnlyDynastyName] as part of these terms.;[FromFrom.GetFirstName] [FromFrom.GetOnlyDynastyName] est un bien piètre razzieur, [FromFrom.GetSheHe] a été défait et forcé à faire des concessions. Je vais devoir renvoyer ma femme-sel [From.GetFirstName] à [From.Liege.GetFirstName] [From.Liege.GetOnlyDynastyName] comme convenu par les termes de l'accord. ;;;[FromFrom.GetFirstName] [FromFrom.GetOnlyDynastyName] es realmente un saqueador mediocre, ha sido derrotado y forzado a hacer concesiones. Debo devolver a mi esposa de sal [From.GetFirstName] a [From.Liege.GetFirstName] [From.Liege.GetOnlyDynastyName] como parte de los términos del acuerdo. ;;;;;;;;;x
EVTOPTAraid_events.101;How humiliating;Quelle humiliation.;;;Que humillación.;;;;;;;;;x
EVTDESCraid_events.102;The filthy pillager [FromFrom.GetFirstName] [FromFrom.GetOnlyDynastyName] has been forced to concede to defeat, and has agreed terms of recompense. One of these terms is that my [GetFromRelation] [From.GetFirstName] is to be returned to my custody, after a frightful time of captivity.;Le sale razzieur [FromFrom.GetFirstName] [FromFrom.GetOnlyDynastyName] a été forcé de reconnaître sa défaite et a accepté un accord de paix. L'un de ses termes précise que ma [GetFromRelation] [From.GetFirstName] sera libérée après avoir capturée comme femme-sel.;;;El sucio saqueador [FromFrom.GetFirstName] [FromFrom.GetOnlyDynastyName] ha sido forzado a reconocer su derrota y a aceptar un acuerdo de paz. Uno de esos términos precisa que mi [GetFromRelation] [From.GetFirstName] sea liberada tras haber sido capturada como esposa de sal.;;;;;;;;;x
EVTOPTAraid_events.102;Praise [Root.Religion.GetRandomGodName] for [From.GetHerHis] safe return;Loué(s) soi(en)t [Root.Religion.GetRandomGodName] pour son retour.;;;Alabado sea [Root.Religion.GetRandomGodName] por su retorno.;;;;;;;;;x
EVTDESCraid_events.103;[From.GetFirstName] [From.GetOnlyDynastyName] is truly a poor reaver for [From.GetSheHe] has been defeated and has been forced into concessions by [FromFrom.GetFirstName] [FromFrom.GetOnlyDynastyName] as recompense for [From.GetHerHis] raiding. I will now have to return my prized valyrian blade, the blade captured for the supposed glory of [Root.GetOnlyDynastyName].;[From.GetFirstName] [From.GetOnlyDynastyName] est un bien piètre razzieur, [From.GetSheHe] a été défait et a été forcé à faire des concessions par [FromFrom.GetFirstName] [FromFrom.GetOnlyDynastyName]. Je vais maintenant devoir rendre ma précieuse épée en acier valyrien, prise pour la gloire de la maison [Root.GetOnlyDynastyName].;;;[FromFrom.GetFirstName] [FromFrom.GetOnlyDynastyName] es realmente un saqueador mediocre, ha sido derrotado y forzado a hacer concesiones por [FromFrom.GetFirstName] [FromFrom.GetOnlyDynastyName]. Debo devolver mi preciosa espada valyria como parte de los términos del acuerdo.;;;;;;;;;x
EVTOPTAraid_events.103;This will not go unanswered;Cela ne sera pas oublié.;;;Esto no quedará sin respuesta.;;;;;;;;;x
EVTDESCraid_events.104;The filthy pillager [FromFrom.GetFirstName] [FromFrom.GetOnlyDynastyName] has been forced to concede to defeat, and has agreed terms of recompense. One of these terms is that my ancestral valyrian blade is confiscated from [From.GetFirstName] [From.GetOnlyDynastyName] and returned into the keeping of House [Root.GetOnlyDynastyName].;Le sale razzieur [FromFrom.GetFirstName] [FromFrom.GetOnlyDynastyName] a été forcé de reconnaître sa défaite et a accepté un accord de paix. L'un de ses termes précise que mon épée en acier valyrienne ancestrale sera confisquée à [From.GetFirstName] [From.GetOnlyDynastyName] et redeviendra le trésor de la maison [Root.GetOnlyDynastyName].;;;Uno de esos términos precisa que mi espada valyria ancestral sea confiscada a [From.GetFirstName] [From.GetOnlyDynastyName] y devuelta a la casa [Root.GetOnlyDynastyName].;;;;;;;;;x
EVTOPTAraid_events.104;Justice;Justice.;;;Justicia.;;;;;;;;;x
TOOLTIPlootvengeancereturnlootinvasion;All women kidnapped, slaves captured and swords stolen from the subjects of [From.GetTitle] [From.GetFirstName] [From.GetOnlyDynastyName] by [Root.GetFirstName] [Root.GetOnlyDynastyName] and [Root.GetHerHis] fellow his raiders shall be returned, along with a sum of gold in recompense.\n;Toutes les femmes kidnappées et les épées volées aux sujets de [From.GetTitle] [From.GetFirstName] [From.GetOnlyDynastyName] par [Root.GetFirstName] [Root.GetOnlyDynastyName] et ses razzieurs devront être rendues, avec en prime un certain montant en or en guise de dédommagement.\n;;;Todas las mujeres secuestradas y las espadas robadas a los súbditos de [From.GetTitle] [From.GetFirstName] [From.GetOnlyDynastyName] por [Root.GetFirstName] [Root.GetOnlyDynastyName] y sus saqueadores deberán ser devueltas con una suma de dinero en concepto de compensación.\n;;;;;;;;;x
EVTDESCraid_events.399;This past month your [GetFromRelation] [From.GetTitledFirstName] [From.GetOnlyDynastyName] has been organising a reaving, a reaving [From.GetSheHe] has announced will target the seas of The Disputed Lands. [From.GetSheHeCap] and [From.GetHerHis] fellow reavers are now ready, and have set sail from [From.Location.GetName] on their quest to follow the old way.;Lors de la dernière lune, votre [GetFromRelation] [From.GetTitledFirstName] [From.GetOnlyDynastyName] a organisé une razzia, une razzia qui a pour objectif les Terres Disputés. [From.GetSheHeCap] est désormais prêt et a appareillé de [From.Location.GetName] avec ses razzieurs pour suivre l'antique voie. ;;;El mes pasado tu [GetFromRelation] [From.GetTitledFirstName] [From.GetOnlyDynastyName] organizó una expedición de saqueo, una expedición hacia las Tierras de la Discordia que ya está lista para partir de [From.Location.GetName] para continuar con las antiguas costumbres.;;;;;;;;;x
EVTDESCraid_events.399B;This past month your [GetFromRelation] [From.GetTitledFirstName] [From.GetOnlyDynastyName] has been organising a reaving, a reaving [From.GetSheHe] has announced will travel far to the north in the Shivering Sea, where they will target Lorathi and Ibbenese ships. [From.GetSheHeCap] and [From.GetHerHis] fellow reavers are now ready, and have set sail from [From.Location.GetName] on their quest to follow the old way.;Lors de la dernière lune, votre [GetFromRelation] [From.GetTitledFirstName] [From.GetOnlyDynastyName] a organisé une razzia, une razzia qui a pour objectif de prendre la direction de la mer Grelotte pour attaquer les navires ibbéniens et lorathis. [From.GetSheHeCap] est désormais prêt et a appareillé de [From.Location.GetName] avec ses razzieurs pour suivre l'antique voie. ;;;El mes pasado tu [GetFromRelation] [From.GetTitledFirstName] [From.GetOnlyDynastyName] organizó una expedición de saqueo, una expedición hacia el norte del Mar de los Escalofríos que ya está lista para partir de [From.Location.GetName] para continuar con las antiguas costumbres.;;;;;;;;;x
EVTDESCraid_events.399C;This past month your [GetFromRelation] [From.GetTitledFirstName] [From.GetOnlyDynastyName] has been organising a reaving, a reaving [From.GetSheHe] has announced will journey to the south in the Summer Sea, where they will target the weak Summer Islanders. [From.GetSheHeCap] and [From.GetHerHis] fellow reavers are now ready, and have set sail from [From.Location.GetName] on their quest to follow the old way.;Lors de la dernière lune, votre [GetFromRelation] [From.GetTitledFirstName] [From.GetOnlyDynastyName] a organisé une razzia, une razzia qui a pour objectif de prendre la direction du Sud, vers la mer d’Été et les faibles Estiviens. [From.GetSheHeCap] est désormais prêt et a appareillé de [From.Location.GetName] avec ses razzieurs pour suivre l'antique voie. ;;;El mes pasado tu [GetFromRelation] [From.GetTitledFirstName] [From.GetOnlyDynastyName] organizó una expedición de saqueo, una expedición hacia el sur del Mar del Verano que ya está lista para partir de [From.Location.GetName] para continuar con las antiguas costumbres.;;;;;;;;;x
EVTDESCraid_events.399D;This past month your [GetFromRelation] [From.GetTitledFirstName] [From.GetOnlyDynastyName] has been organising a reaving, a reaving [From.GetSheHe] has announced will journey far to the east in Slaver's Bay. [From.GetSheHeCap] and [From.GetHerHis] fellow reavers are now ready, and have set sail from [From.Location.GetName] on their quest to follow the old way.;Lors de la dernière lune, votre [GetFromRelation] [From.GetTitledFirstName] [From.GetOnlyDynastyName] a organisé une razzia, une razzia qui a pour objectif la Baie des Serfs. [From.GetSheHeCap] est désormais prêt et a appareillé de [From.Location.GetName] avec ses razzieurs pour suivre l'antique voie. ;;;El mes pasado tu [GetFromRelation] [From.GetTitledFirstName] [From.GetOnlyDynastyName] organizó una expedición de saqueo, una expedición hacia el este, a la Bahía de los Esclavos que ya está lista para partir de [From.Location.GetName] para continuar con las antiguas costumbres.;;;;;;;;;x
EVTOPTAraid_events.399;Do us proud;Rends nous fiers !;;;Nos hace sentir orgullosos;;;;;;;;;x
EVTOPTBraid_events.399;Let them go, as long as they don't molest my lands;Laissez les partir, tant qu'ils ne ravagent pas mes terres.;;;Que se vayan, así no molestarán mis tierras;;;;;;;;;x
seek_raiding_redress;Seek Redress for Raiding;Demander réparation pour les pillages;;;Pedir reparación por los saqueos;;;;;;;;;x
seek_raiding_redress_desc;Some among [Root.GetTitledFirstName]'s subjects have been known to be openly raiding [From.PrimaryTitle.GetName]. Therefore [From.GetTitledFirstName] can issue a demand for compensation.;Certains des sujets de [Root.GetTitledFirstName] sont reconnus avoir ouvertement mis à sac [From.PrimaryTitle.GetName]. Par conséquent [From.GetTitledFirstName] peut demander une compensation;;;Algunos de los súbditos de [Root.GetTitledFirstName] reconocieron abiertamente que saquearon [From.PrimaryTitle.GetName]. Por consiguiente [From.GetTitledFirstName] puede pedir una compensación.;;;;;;;;;x
opinion_demanded_raiding_redress;Demanded Raiding Redress;Réparation demandée;;;Reparación solicitada;;;;;;;;;x
TOOLTIPseek_raiding_redressSUBJECT;[Root.GetTitledFirstName] has at least one subject who is known to have raided [From.GetTitledFirstName]'s lands, and has NOT already been forbidden from raiding these lands.\n;[Root.GetTitledFirstName] a au moins un sujet ayant pillé les terres de [From.GetTitledFirstName], et n'a pas déjà été interdit d'attaquer ces terres.\n;;;[Root.GetTitledFirstName] tiene al menos un súbdito que se sabe que ha saqueado las tierras de [From.GetTitledFirstName], y no ha sido ya prohibido de atacar estas tierras.\n;;;;;;;;;x
TOOLTIPraid_events.151;[Root.GetTitledFirstName] will be issued a demand that those of [Root.GetHerHis] subjects who have been raiding [From.PrimaryTitle.GetName] will pay [From.GetTitledFirstName] compensation. If they refuse, it will be just cause for war.\nThe subjects who have been raiding [From.PrimaryTitle.GetName] are:;[Root.GetTitledFirstName] recevra une requête exigeant que ses sujets ayant pillé [From.PrimaryTitle.GetName] paieront des réparations à [From.GetTitledFirstName]. S'ils refusent, cela constituerait un casus belli valide.\nLes sujets coupables de pillages sont:;;;[Root.GetTitledFirstName] recibirá una petición exigiendo que sus súbditos que hayan saqueado [From.PrimaryTitle.GetName] pagarán reparaciones a [From.GetTitledFirstName]. Si rechazan, constituirá un casus belli válido.\nLos súbditos culpables de saqueo son:;;;;;;;;;x
EVTDESCraid_events.151;[Root.GetTitledFirstNameNoRegnal], some among your subjects have been found to be pillaging the lands under my dominion. I demand that they are made to pay just recompense so that the damage caused can be repaired, else we may have to resort to force of arms to seek our redress.\n\nSigned,\n[FromFrom.GetTitledFirstName] of the House [FromFrom.GetOnlyDynastyName];[Root.GetTitledFirstNameNoRegnal], certains parmi vos sujets se sont rendus coupables de pillages dans les terres sous ma protection. Je demande qu'ils paient de justes compensations, afin que les dommages causés puissent être réparés, faute de quoi nous pourrions faire usage de la force pour obtenir réparation.\n\nSigné,\n[FromFrom.GetTitledFirstName] de la Maison [FromFrom.GetOnlyDynastyName];;;[Root.GetTitledFirstNameNoRegnal], algunos de sus súbditos son culpables de saquear las tierras bajo mi protección. Exijo que paguen una justa compensación, con el fin de reparar el daño causado, de lo contrario podríamos usar la fuerza para obtener reparación.\n\nFirmado,\n[FromFrom.GetTitledFirstName] de la Casa [FromFrom.GetOnlyDynastyName];;;;;;;;;x
EVTOPTAraid_events.151;Yes, it is only just;Oui, ça n'est que justice;;;Sí, no es más que justicia;;;;;;;;;x
opinion_forbid_raiding;Forbid Raiding;A interdit les raids;;;A prohibido los saqueos;;;;;;;;;x
TOOLTIPraid_events.153 ;[This.GetTitledFirstNameNoRegnal] of [This.PrimaryTitle.GetName] is issued a command to cease raiding [FromFrom.PrimaryTitle.GetName], and to pay compensation to [FromFrom.GetTitledFirstNameNoRegnal]. ;[This.GetTitledFirstNameNoRegnal] de [This.PrimaryTitle.GetName] reçoit l'ordre de cesser les raids contre [FromFrom.PrimaryTitle.GetName], et de payer des réparations à [FromFrom.GetTitledFirstNameNoRegnal]. ;;;[This.GetTitledFirstNameNoRegnal] de [This.PrimaryTitle.GetName] ha recibido la orden de cesar los saqueos contra [FromFrom.PrimaryTitle.GetName], y de pagar reparaciones a [FromFrom.GetTitledFirstNameNoRegnal]. ;;;;;;;;;x
EVTOPTBraid_events.151;Ha, that [GetRootFromFromInsult] will get nothing from me!;Ha! Ce [GetRootFromFromInsult] n'obtiendra rien de moi!;;;Ja! Este [GetRootFromFromInsult] no obtendrá nada de mí!;;;;;;;;;x
TOOLTIPraid_events.152;[FromFrom.GetTitledFirstNameNoRegnal] will be given just cause to use force of arms;[FromFrom.GetTitledFirstNameNoRegnal] obtiendra un casus belli pour employer la force des armes;;;[FromFrom.GetTitledFirstNameNoRegnal] obtendrá un casus belli para emplear la fuerza de las armas;;;;;;;;;x
EVTDESCraid_events.152;To the [GetFromRootInsult] [Root.GetTitledFirstNameNoRegnal], I am afraid I cannot accept these outrageous demands. I imagine these claims of raiding in [Root.PrimaryTitle.GetName] are fabricated, and we will not be bullied by thinly veiled threats.\n\nSigned,\n[From.GetTitledFirstName] of the House [From.GetOnlyDynastyName];Au [GetFromRootInsult] [Root.GetTitledFirstNameNoRegnal], j'ai peur que je ne puisse accepter ces scandaleuses exigences. J'imagine que ces prétendus pillages en [Root.PrimaryTitle.GetName] sont inventés, et nous ne seront pas intimidés par ces menaces à peine voilées.\n\nSigné,\n[From.GetTitledFirstName] de la Maison [From.GetOnlyDynastyName];;;Al [GetFromRootInsult] [Root.GetTitledFirstNameNoRegnal], me temo que no puedo aceptar estas escandalosas exigencias. Imagino que esos supuestos saqueos en [Root.PrimaryTitle.GetName] son inventados, y no nos dejaremos intimidar por estas amenazas veladas.\n\nFirmado,\n[From.GetTitledFirstName] de la Casa [From.GetOnlyDynastyName];;;;;;;;;x
EVTOPTAraid_events.152;This is unacceptable!;C'est inacceptable!;;;Es inaceptable!;;;;;;;;;x
