stillborn;Stillborn;Mort-né;;;Mortinato;;;;;;;;;x;
EVTDESCPIL26;After a long night of effort, you have at last. The story is perfect, the imagery and metaphor crystal clear and brooking no other possible interpretation. You think, at least.;Après une longue nuit de travail vous l'avez enfin. L'histoire est parfaite, les images et métaphores sont claires comme du cristal et ne peuvent se prêter à aucune autre interprétation. En tout cas vous en êtes persuadé. ;;;Tras una larga noche de duro trabajo lo consigues. La historia es perfecta, las imágenes y metáforas son claras como el cristal y no se prestan a ninguna interpretación. Incluso te has convecido a ti mismo.;;;;;;;;;x;
EVTOPTAPIL26;It will have to do.;Cela devrait faire l'affaire. ;;;Así se hará.;;;;;;;;;x;
EVTDESCPIL28;You've made up your mind. It's time to put the Lord of Light to use - and if he wonn't say what you need him to, you might as well say it for him.;Vous avez pris une décision. Il est temps que les visions du Seigneur de la Lumière servent à quelque chose. Et si elles ne veulent pas dire ce que vous voulez entendre, alors vous allez le leur faire dire.;;;Has tomado una decisión. Es el momento de que las visiones del Señor de la Luz sirvan para algo. Y si no te dicen lo que quieres saber, harás que lo hagan.;;;;;;;;;x;
EVTOPTAPIL28;Now, where's that priest?;Bien, où est ce prêtre ?;;;Bien, dónde está ese sacerdoto rojo?;;;;;;;;;x;
EVTTOOLTIPPIL29;will be asked to help create a false vision.;sera sollicité pour aider à la création d'un faux rêve.;;;será solicitado para ayudar a crear una falsa visión;;;;;;;;;x;
EVTDESCPIL29;[From.GetTitledFirstName] comes to you with a proposal. The investigation, it seems, isn't proceeding as quickly as [From.GetSheHe]'d like. [From.GetSheHe] wants you to find a way to speed it up a little - perhaps by claiming to have had one of those visions of yours, even if you haven't. Who's to know, after all?;[From.GetTitledFirstName] vient vers vous avec une proposition. L'enquête, semble-t-il, ne se déroule pas aussi rapidement qu'[From.GetSheHe] le souhaiterait. [From.GetSheHe] veut que vous trouviez un moyen d'accélérer les choses, peut-être en disant que vous avez eu une de vos visions, même si vous n'en n'avez pas eu. Qui le saura après tout ? ;;;[From.GetTitledFirstName] viene con una proposición. La investigación no se desarrolla tan rápidamente como le gustaría así que quiere acelerarla un poco. Tal vez diciendo que has tenido una visión, aunque no sea cierto? Nadie lo sabrá nunca.;;;;;;;;;x;
EVTOPTAPIL29;A solid enough plan, I suppose.;Un plan assez solide je suppose.;;;Un plan bastante sólido, supongo.;;;;;;;;;x;
EVTOPTBPIL29;How DARE you suggest such blasphemy?;Comment osez-vous suggérer un tel blasphème ?;;;Cómo osas sugerir tal blasfemia?;;;;;;;;;x;
EVTDESCPIL30;You're pleasantly surprised to see [From.GetTitledFirstName] agree to your proposal. Of course, the priest is just one part of the plan - you're also going to need to come up with a plausible vision, and that could be a fair bit harder. You're going to need all the help you can get.;Vous êtes agréablement supris de voir [From.GetTitledFirstName] accepter votre proposition. Bien entendu le prêtre est juste une partie du plan, vous allez également avoir besoin d'inventer une vision plausible, et cela risque d'être un peu plus compliqué. Vous allez avoir besoin de toute l'aide possible.;;;Estas agradablemente sorprendido de ver que [From.GetTitledFirstName] ha aceptado la propuesta. El sacerdoto rojo es la primera parte del plan, has de inventar una visión plausible, y eso será complicado. Necesitarás toda la ayuda posible.;;;;;;;;;x;
EVTOPTAPIL30;I think we can handle it.;Je pense que nous pouvons le faire.;;;Creo que podemos hacerlo.;;;;;;;;;x;
EVTOPTBPIL30;On second thought, maybe we're not ready yet.;A la réflexion, peut-être que nous ne sommes pas encore prêts.;;;Reflexionando, tal vez no estemos listos aún.;;;;;;;;;x;
EVTDESCPIL31;Once you make your suggestion, [From.GetFirstName] flies into a rage, demanding that you never speak such blasphemous words in [From.GetHerHis] presence again. You're driven from the room, and forced to lick your metaphorical wounds in a corridor outside.;Votre proposition a mis en colère [From.GetFirstName], qui ne veut plus entendre parler d'un tel blasphème. Vous êtes mis à la porte sans ménagement.;;;Tu propuesta ha enfadado a [From.GetFirstName], que no quiere saber nada del asunto. Te ha echado sin contemplaciones.;;;;;;;;;x;
EVTOPTAPIL31;...well, that didn't work.;… bien, cela n'a pas marché.;;;...bueno, no funcionó.;;;;;;;;;x;
EVTDESCPIL32;While continuing your investigation of [Root.PlotTarget.GetTitledFirstName], you've also been keeping one eye on [Root.PlotTarget.GetHerHis] mother. Last night, you had [Root.PlotTarget.Mother.GetTitledFirstName] followed, and learned that she was having an illicit liaison with [Root.PlotTarget.Mother.Lover.GetTitledFirstName].;Dans le cadre de votre enquête sur [Root.PlotTarget.GetTitledFirstName], vous avez gardé un oeil sur sa mère. La nuit dernière vous avez fait suivre [Root.PlotTarget.Mother.GetTitledFirstName] et vous avez appris qu'elle avait une liaison adultérine avec [Root.PlotTarget.Mother.Lover.GetTitledFirstName].;;;Como parte de la investigación sobre [Root.PlotTarget.GetTitledFirstName], has vigilidado a la madre. La pasada noche has hecho seguir a [Root.PlotTarget.Mother.GetTitledFirstName] y te has enterado que tiene una relación adúltera con [Root.PlotTarget.Mother.Lover.GetTitledFirstName].;;;;;;;;;x;
EVTOPTAPIL32;I think I may have just found [Root.PlotTarget.GetFirstName]'s real father.;Je pense que je viens juste de trouver le véritable père de [Root.PlotTarget.GetFirstName].;;;Creo que acabo de encontrar al verdadero padre de [Root.PlotTarget.GetFirstName].;;;;;;;;;x;
EVTDESCPIL33;While carrying out your investigation, you've been keeping a close eye on the subject's mother. Last night, you had her followed, and discovered that she's been meeting in secret with a man who is most definitely not her husband.;Dans le cadre de votre enquête vous avez gardé un œil sur la mère. La nuit dernière vous l'avez fait suivre et avez découvert qu'elle entretenait une liaison adultérine avec un homme.;;;Como parte de tu investigación vigiliaste a la madre. La pasada noche la hiciste seguir y descubriste que mantiene una relación adúltera con un hombre.;;;;;;;;;x;
EVTOPTAPIL33;Just as we thought.;Comme nous le pensions.;;;Como pensábamos.;;;;;;;;;x;
EVTTOOLTIPPIL33;may be the real father;peut être le véritable père.;;;puede ser el verdadero padre.;;;;;;;;;x;
EVTTOOLTIPPIL34;will want to hear of this;voudra être au courant.;;;querrá estar al corriente.;;;;;;;;;x;
EVTDESCPIL34;[From.GetTitledFirstName] comes to you with the results of the investigation. Apparently, [From.GetSheHe]'s learned that [Root.PlotTarget.Mother.GetTitledFirstName] has been sleeping with [Root.PlotTarget.Mother.Lover.GetTitledFirstName].;[From.GetTitledFirstName] vient à vous avec les résultats de son enquête. Apparemment, [From.GetSheHe] a appris que [Root.PlotTarget.Mother.GetTitledFirstName] a couché avec [Root.PlotTarget.Mother.Lover.GetTitledFirstName].;;;[From.GetTitledFirstName] viene con los resultados de la investigación. Aparentemente, ha descubioerto que [Root.PlotTarget.Mother.GetTitledFirstName] se acuesta con [Root.PlotTarget.Mother.Lover.GetTitledFirstName].;;;;;;;;;x;
EVTOPTAPIL34;I think we may have just found [Root.PlotTarget.GetFirstName]'s real father.;Je pense que nous avons peut-être découvert le véritable père de [Root.PlotTarget.GetFirstName];;;Creo que hemos descubierto al verdadero padre de [Root.PlotTarget.GetFirstName];;;;;;;;;x;
EVTDESCPIL35;Word has reached you that [Root.PlotTarget.Mother.GetTitledFirstName]'s affair has ended, and she and her lover have gone their seperate ways. This has no bearing on the truth of [Root.PlotTarget.GetTitledFirstName]'s parentage, of course - but it may make it more difficult to prove.;Vous avez entendu dire que la liaison de [Root.PlotTarget.Mother.GetTitledFirstName] avec son amant a pris fin. Cela ne change rien quant à la vérité sur la légitimité de [Root.PlotTarget.GetTitledFirstName], mais cela va rendre la chose plus difficile à prouver. ;;;Descubres que la relación de [Root.PlotTarget.Mother.GetTitledFirstName] con su amante se ha acabado. Esto no cambia nada en cuanto a la verdad sobre la legitimidad de [Root.PlotTarget.GetTitledFirstName], pero lo hará más dificil de domostrar.;;;;;;;;;x;
EVTOPTAPIL35;A minor setback.;Une petite difficulté en plus.;;;Un pequeño contratiempo.;;;;;;;;;x;
HASEVIDENCE;Has Evidence\n;A des preuves\n;;;Tiene pruebas\n;;;;;;;;;x;
pil_confront_father;Confront [Root.PlotTarget.Father.GetTitledFirstName];Se confronter à [Root.PlotTarget.Father.GetTitledFirstName];;;Se enfrentará a [Root.PlotTarget.Father.GetTitledFirstName];;;;;;;;;x;
pil_confront_father_desc;The time has come. You've carefully gathered your evidence, and now it is time to bring the truth to light. [Root.PlotTarget.Father.GetFirstName] must know the truth of [Root.PlotTarget.GetFirstName]'s birth.;Le temps est venu. Vous avez soigneusement réuni vos preuves, et maintenant il est temps de faire éclater la vérité au grand jour. [Root.PlotTarget.Father.GetFirstName] doit savoir la vérité sur la naissance de [Root.PlotTarget.GetFirstName].;;;Ha llegado el momento. Reúnes rigurosamente tus pruebas, es la hora de sacar la verdad a la luz. [Root.PlotTarget.Father.GetFirstName] debe saber la verdad sobre el nacimineto de [Root.PlotTarget.GetFirstName].;;;;;;;;;x;
EVTDESCPIL100;You look over your evidence one last time, carefully making sure you have left nothing out. Together with your conspirators, you set out to see [Root.PlotTarget.Father.GetTitledFirstName].;Vous jetez un dernier œil à vos preuves, vous assurant de n'avoir rien oublié. Vous avez l'intention de vous rendre avec vos complices devant [Root.PlotTarget.Father.GetTitledFirstName].;;;Das una última ojeada a las pruebas, asegurándote de no olvidar nada. Junto a tus cómplices, te reúnes con [Root.PlotTarget.Father.GetTitledFirstName].;;;;;;;;;x;
EVTOPTAPIL100;The truth will come out, one way or the other.;La vérité va éclater au grand jour, d'une façon ou d'une autre.;;;La verdad saldrá a la luz, de una forma u otra.;;;;;;;;;x;
EVTTOOLTIPPIL100;reacts;réagit;;;reacciona;;;;;;;;;x;
EVTDESCPIL101;While visiting your father's court, you are shocked to hear of the arrival of a group led by [From.GetTitledFirstName] - and even more shocked when you discover what they intend. Apparently, they believe that [Root.Father.GetFirstName] isn't your father at all, and they intend to prove it.;Alors que vous vous rendez à la cour de votre père, vous êtes choqué d'apprendre l'arrivée d'un groupe mené par [From.GetTitledFirstName], qui n'hésite pas à clamer que [Root.Father.GetFirstName] n'est pas votre père et qu'ils ont l'intention de le prouver. ;;;Mientras ibas a la corte de tu padre, te sorprendes al descubrir la llegada de un grupo liderado por [From.GetTitledFirstName], quien no duda en afirmar que [Root.Father.GetFirstName] no es tu verdadero padre y que tienen la intención de demostrarlo.;;;;;;;;;x;
EVTOPTAPIL101;This is an outrage!;Odieux mensonges !;;;Esto es un ultraje!;;;;;;;;;x;
EVTTOOLTIPPIL101;grants the conspirators an audience;reçoit le groupe en audience.;;;otorga una audiencia a los conspiradores.;;;;;;;;;x;
EVTDESCPIL102;A group led by [FromFrom.GetTitledFirstName] have arrived at your court and demanded an audience. They claim that they believe [From.GetFirstName] is not your [GetFromRelation] at all, but the child of an illicit affair between [From.Mother.GetFirstName] and another man. They demand that you denounce and disinherit [From.GetHerHim] immediately.;Un groupe dirigé par [FromFrom.GetTitledFirstName] est arrivé à la cour et a demandé audience. Ils disent que [From.GetFirstName] n'est pas notre [GetFromRelation], mais l'enfant d'une relation entre [From.Mother.GetFirstName] et un autre homme. Ils exigent que vous dénonciez immédiatement cette infamie et déshéritiez le fruit de l'adultère.;;;Un grupo dirigido por [FromFrom.GetTitledFirstName] ha llegado a la corte y pide una audiencia. Dicen que [From.GetFirstName] no es el padre de nuestro [GetFromRelation], si no el fruto de una relación entre [From.Mother.GetFirstName] y otro hombre. Exigen que denuncies inmediatamente esta infamia y desheredes el fruto del adulterio.;;;;;;;;;x;
EVTOPTAPIL102;Sadly, I'm sure they're right.;Malheureusement j'ai la certitude qu'ils disent la vérité. ;;;Desgraciadamente tengo la certeza de que dicen la verdad.;;;;;;;;;x;
EVTOPTBPIL102;Ah, yes, a 'bastard'. You may consider the claim dismissed.;"Ah oui… un(e) ""bâtard(e)""… je vous suggère de disparaître de ma vue le plus tôt possible.";;;"Ah si… un ""bastardo""...os sugiero que desaparezcáis de mi vista lo antes posible.je vous suggère de disparaître de ma vue le plus tôt possible.";;;;;;;;;x;
EVTTOOLTIPPIL102;They present the following evidence:\n;Ils présentent les preuves suivantes:\n;;;presentan las pruebas siguientes:\n;;;;;;;;;x;
EVTTOOLTIPPIL103;will be declared a bastard\n;sera déclaré bâtard;;;será declarado bastardo\n;;;;;;;;;x;
EVTDESCPIL103;You look on in horror as [From.GetTitledFirstName] makes [From.GetHerHis] decree. [From.GetSheHeCap] proclaims you disinherited and a bastard, and strips you of your family name.;Vous êtes horrifié alors que [From.GetTitledFirstName] proclame son décret. [From.GetSheHeCap] ne vous reconnait plus comme son enfant, vous déclare bâtard(e) et vous déshérite. Même votre nom de famille vous est enlevé. ;;;Te horrorizas mientras [From.GetTitledFirstName] proclama su decreto. Ya no te reconoce como su hijo, te declara bastardo y te deshereda. Además, te han quitado el apellido.;;;;;;;;;x;
EVTOPTAPIL103;Lies, all lies!;Mensonges ! Ce ne sont que des mensonges !;;;Mentiras! Son todo mentiras!;;;;;;;;;x;
EVTTOOLTIPPIL105;is horrified;est horrifié;;;está horrorizado;;;;;;;;;x;
EVTDESCPIL105;You return home to shocking news. A group of conspirators have convinced [From.GetTitledFirstName] that [FromFrom.GetTitledFirstName] is not his child at all, but the product of an illicit affair between you and some other man. [FromFrom.GetSheHeCap] has been stripped of [FromFrom.GetHerHis] family name and declared a bastard.;Vous rentrez chez vous, encore sous le choc de la nouvelle. Un groupe de conspirateurs a convaincu [From.GetTitledFirstName] que [FromFrom.GetTitledFirstName] n'était pas son enfant, mais le produit d'une relation adultérine entre vous et un autre homme. [FromFrom.GetSheHeCap] s'est vu refuser le droit de continuer à porter son nom de famille et a été déclaré(e) bâtard(e). ;;;Vuelves a casa, todavía impactada por la noticia. Un grupa de conspiradores ha convencido a [From.GetTitledFirstName] de  que [FromFrom.GetTitledFirstName] no es su hijo, sino el producto de una relación adúltera entre tu y otro hombre. Le han quitado el apellido y lo han declarado bastardo.;;;;;;;;;x;
EVTOPTAPIL105;Those wretches!;Quel malheur!;;;Qué lástima!;;;;;;;;;x;
EVTTOOLTIPPIL106;is pleased;est content;;;está contento;;;;;;;;;x;
EVTDESCPIL106;You and your conspirators gather before [From.GetTitledFirstName], and make your case. [Root.PlotTarget.GetTitledFirstName] looks on from the sidelines in growing horror, as [Root.PlotTarget.GetSheHe] realizes exactly what you intend. Finally, [From.GetFirstName] rises and makes his decision: to strip [Root.PlotTarget.GetFirstName] of [Root.PlotTarget.GetHerHis] inheritance and family name.;Vous et vos complices vous rendez devant [From.GetTitledFirstName], et présentez vos accusations. C'est l'horreur que vous percevez sur le visage de [Root.PlotTarget.GetTitledFirstName] tandis que se poursuit l'argumentaire et qu'[Root.PlotTarget.GetSheHe] realise ce que vous êtes en train de dire. A la fin, [From.GetFirstName] finit par se lever et énonce son verdict: il déchoit [Root.PlotTarget.GetFirstName] de son héritage et de son nom de famille. ;;;Tu y tus conspiradores os reunís ante [From.GetTitledFirstName], y presentáis las pruebas. Es horror lo que se percibe en el rostro de [Root.PlotTarget.GetTitledFirstName] mientras seguía la argumentación y se daba cuenta lo que estabas a punto de decir. Al final,  [From.GetFirstName] acabó por entonar su veredicto: abastarda a [Root.PlotTarget.GetFirstName] y le quita el apellido y herencia. ;;;;;;;;;x;
EVTOPTAPIL106;A wise decision, [From.PrimaryTitle.GetFOA];Une sage décision, [From.PrimaryTitle.GetFOA].;;;Una  sabia decisión, [From.PrimaryTitle.GetFOA].;;;;;;;;;x;
EVTDESCPIL107;[From.GetTitledFirstName] leads you and the rest of your conspirators before [FromFrom.GetTitledFirstName], and makes your case. [From.PlotTarget.GetTitledFirstName] looks on from the sidelines in growing horror, as [From.PlotTarget.GetSheHe] realizes exactly what you intend. Finally, [FromFrom.GetFirstName] rises and makes his decision: to strip [From.PlotTarget.GetFirstName] of [From.PlotTarget.GetHerHis] inheritance and family name.;[From.GetTitledFirstName] vous conduit vous et vos autres complices devant [FromFrom.GetTitledFirstName], et présente ses accusations. C'est l'horreur que vous percevez sur le visage de [From.PlotTarget.GetTitledFirstName] tandis que se poursuit l'argumentaire et qu'[From.PlotTarget.GetSheHe] realise ce qui est entrain d'être dit. A la fin, [FromFrom.GetFirstName] finit par se lever et énonce son verdict: il déchoit [From.PlotTarget.GetFirstName] de son héritage et de son nom de famille. ;;;[From.GetTitledFirstName] te conduce ante [FromFrom.GetTitledFirstName], y presenta las pruebas. Es horror lo que se percibe en el rostro de [Root.PlotTarget.GetTitledFirstName] mientras seguía la argumentación y se daba cuenta lo que estabas a punto de decir. Al final,  [From.GetFirstName] acabó por entonar su veredicto: abastarda a [Root.PlotTarget.GetFirstName] y le quita el apellido y herencia.  ;;;;;;;;;x;
EVTOPTAPIL107;A wise decision, [FromFrom.PrimaryTitle.GetFOA];Une sage décision, [FromFrom.PrimaryTitle.GetFOA].;;;Una  sabia decisión, [FromFrom.PrimaryTitle.GetFOA].;;;;;;;;;x;
EVTDESCPIL10799;[Root.PrimaryTitle.GetFOA], we have received word of a great scandal from the court in [FromFrom.Capital.GetName]. Apparently a group of conspirators have found evidence that [From.GetTitledFirstName] [From.GetOnlyDynastyName] is not the child of [FromFrom.GetTitledFirstName], but the bastard of an illicit affair by [From.Mother.GetTitledFirstName]. [FromFrom.GetTitledFirstName] was convinced, and has stripped [From.GetFirstName] of [From.GetHerHis] inheritance and family name.;[Root.PrimaryTitle.GetFOA], nous avons entendu parler d'un grand scandale à la court de [FromFrom.Capital.GetName]. Apparemment un groupe de conspirateurs a trouvé des preuves selon lesquelles [From.GetTitledFirstName] [From.GetOnlyDynastyName] ne serait pas l'enfant de [FromFrom.GetTitledFirstName], mais le bâtard d'une liaison de [From.Mother.GetTitledFirstName]. [FromFrom.GetTitledFirstName] a été convaincu et a nié les droits de [From.GetFirstName] sur son héritage et son nom.;;;[Root.PrimaryTitle.GetFOA], nos enteramos de un gran escándalo en la corte de [FromFrom.Capital.GetName]. parece que un grupo de conspiradores ha encontrado pruebas que afirman que [From.GetTitledFirstName] [From.GetOnlyDynastyName] no es hijo de [FromFrom.GetTitledFirstName], sino el bastardo de una aventura de [From.Mother.GetTitledFirstName]. [FromFrom.GetTitledFirstName] ha sido convencido y ha negado los derechos de [From.GetFirstName] sobre su herencia y su dinastíaom.;;;;;;;;;x;
EVTOPTAPIL10799;Scandal indeed;Une scandale en effet.;;;Un escándalo, en efecto.;;;;;;;;;x;
EVTTOOLTIPPIL108;is angry;est en colère;;;está furioso;;;;;;;;;x;
EVTDESCPIL108;You and your conspirators gather before [From.GetTitledFirstName], and make your case. [Root.PlotTarget.GetTitledFirstName] looks on from the sidelines in growing horror, as [Root.PlotTarget.GetSheHe] realizes exactly what you intend. Finally, [From.GetFirstName] rises and makes his decision: to reject your claim. He finds your evidence firmly unconvincing, and has no intention of entertaining your nonsensical theories any further.;"Vous et vos complices vous rendez devant [From.GetTitledFirstName], et présentez vos accusations. C'est l'horreur que vous percevez sur le visage de [Root.PlotTarget.GetTitledFirstName] tandis que se poursuit l'argumentaire et qu'[Root.PlotTarget.GetSheHe] realise ce que vous êtes en train de dire. A la fin, [From.GetFirstName] se lève et énonce son verdict: l'accusation est rejetée. Il trouve que vos preuves sont minces et non convaincantes et il a l'intention de tuer dans l'œuf vos ""théories fumeuses"".";;;"Tu y tus cómplices os presentáis ante [From.GetTitledFirstName], y presentáis las pruebas. Es horror lo que se percibe en el rostro de [Root.PlotTarget.GetTitledFirstName] mientras seguía la argumentación y se daba cuenta lo que estabas a punto de decir. Al final,  [From.GetFirstName] acabó por entonar su veredicto: la acusación es rechazada. Él cree que las pruebas son muy débiles y nada convincentes y tiene la intención de cortar de raíz tus ""teorías extrafalarias"".";;;;;;;;;x;
EVTOPTAPIL108;I suppose that that's the end of it, then.;Je suppose que c'est la fin de toute cette histoire.;;;Supongo que es el fin de toda esta historia.;;;;;;;;;x;
EVTOPTBPIL108;He may be a fool - but his bannermen might not be.;C'est peut-être un fou, mais ce n'est peut-être pas le cas de ses bannerets.;;;Él puede ser un estúpido, pero seguramente sus vasallos no.;;;;;;;;;x;
EVTTOOLTIPPIL109;is pleased;est content;;;está contento;;;;;;;;;x;
EVTDESCPIL109;At first, of course, you find the proceedings horrifying, but soon it becomes apparent that you have nothing to fear - your accusers' argument is riddled with holes, their evidence unconvincing, and your father's patience thin. Finally, he rises to his feet in a fit of rage and demands that they never bring this nonsense before him ever again.;Bien entendu, au début, vous avez été horrifié par ces accusations, mais vous vous êtes rapidement rendu compte que vous n'aviez rien à craindre. Les arguments de vos accusateurs sont présentés avec maladresse, leurs preuves sont minces et la patience de votre père semble s'épuiser. Il finit par se lever, coupant court à cette mascarade et exigeant qu'on ne l'on ne vienne plus jamais lui raconter de telles sornettes. ;;;Por supuesto, al principio, estabas horrorizado por las acusaciones, pero te diste cuenta rápidamente de que no tenías nada que temer. Los argumentos que los acusadores presentaron con torpeza, las pruebas son débiles y la paciencia de tu padre se está acabando. Tu padre acaba por levantarse, cortando esta farsa y exigiendo que no vengan nunca más con semejantes tonterías.;;;;;;;;;x;
EVTOPTAPIL109;A wise decision, father.;Une sage décision père.;;;una sabia decisión padre.;;;;;;;;;x;
EVTTOOLTIPPIL110;is pleased;est content;;;está contento;;;;;;;;;x;
EVTDESCPIL110;You return home to shocking, yet pleasant news - a group of conspirators attempted to convince [From.GetTitledFirstName] that [FromFrom.GetFirstName] was not truly his child, but he rejected their foolish claims.;Vous rentrez chez vous, choqué mais soulagé. Un groupe de conspirateurs a tenté de convaincre [From.GetTitledFirstName] qu'il n'était pas le père de [FromFrom.GetFirstName], mais il a rejeté ces folles accusations. ;;;Vuelves a casa, sorprendido pero aliviado. Un grupo de conspiradores ha tratado de convencer a [From.GetTitledFirstName] de que no era el verdadero padre de [FromFrom.GetFirstName], pero él rechazó estas estúpidas acusaciones.;;;;;;;;;x;
EVTOPTAPIL110;I'm glad to see justice was done;Je suis heureuse d'apprendre que justice a été rendue. ;;;Me complace saber que se ha hecho justicia.;;;;;;;;;x;
EVTDESCPIL111;[From.GetTitledFirstName] leads you and the rest of your conspirators before [FromFrom.GetTitledFirstName], and makes your case. [From.PlotTarget.GetTitledFirstName] looks on from the sidelines in growing horror, as [From.PlotTarget.GetSheHe] realizes exactly what you intend. Finally, [FromFrom.GetFirstName] rises and makes his decision: to reject your claim. He finds your evidence firmly unconvincing, and has no intention of entertaining your nonsensical theories any further.;"[From.GetTitledFirstName] vous conduit vous et vos autres complices devant [FromFrom.GetTitledFirstName], et présente ses accusations. C'est l'horreur que vous percevez sur le visage de [From.PlotTarget.GetTitledFirstName] tandis que se poursuit l'argumentaire et qu'[From.PlotTarget.GetSheHe] realise ce qui est en train d'être dit. A la fin, [FromFrom.GetFirstName] se lève et énonce son verdict: l'accusation est rejetée. Il trouve que vos preuves sont minces et non convaincantes et il a l'intention de tuer dans l'œuf vos ""théories fumeuses"".";;;"Tu y tus cómplices os presentáis ante [From.GetTitledFirstName], y presentáis las pruebas. Es horror lo que se percibe en el rostro de [Root.PlotTarget.GetTitledFirstName] mientras seguía la argumentación y se daba cuenta lo que estabas a punto de decir. Al final,  [From.GetFirstName] acabó por entonar su veredicto: la acusación es rechazada. Él cree que las pruebas son muy débiles y nada convincentes y tiene la intención de cortar de raíz tus ""teorías extrafalarias"".";;;;;;;;;;x
EVTOPTAPIL111;I suppose that that's the end of it, then.;Je suppose que c'est la fin de toute cette histoire.;;;Supongo que es el fin de toda esta historia.;;;;;;;;;x;
