#CODE;ENGLISH;FRENCH;GERMAN;;SPANISH;;;;;;;;;x
EVTDESCsothoryos.20A;You were trekking through he jungles of [Root.Location.GetName], when you encountered a stream. It seems to be unexplored, and upon wading through it the bed of the river is found to contain much gold!;Vous traversiez les jungles de [Root.Location.GetName], lorsque vous êtes tombé sur un cours d'eau. Il semble inexploré et vous y avez découvert de l'or !;;;Viajabas a través de las junglas de [Root.Location.GetName], cuando encontraste un arroyo. Parecía estar inexplorado, y tras vadearlo, descubres que el lecho del arroyo está lleno de oro!;;;;;;;;;x
EVTDESCsothoryos.20B;Journeying far into the wilderness of the jungles of [Root.Location.GetName] can be perilous, but you were rewarded for this bravery on this journey. You found a secluded pool of brackish water which you dove into, and in it you found countless oysters full of large pearls!;Voyager dans les jungles sauvages de [Root.Location.GetName] peut être très périlleux, mais vous avez été récompensé de votre courage. Vous avez découvert un endroit qui regorge d'huîtres avec de grandes perles dedans !;;;Adentrarse en el interior de las salvajes junglas de [Root.Location.GetName] puede ser peligroso, pero has sido recompensado por tu valor. Descubres un recóndito estanque de aguas saladas y al sumergirte, encuentras en su interior abundantes ostras llenas de enormes perlas!;;;;;;;;;x
EVTDESCsothoryos.20C;The jungles of Sothoryos and [Root.Location.GetName] can be thick and difficult to navigate, but can lead to chance discoveries. In a remote clearing you find an abundance of wild exotic spices, all ready to be picked. You have the spices harvested, and will surely fetch high prices at market.;Les jungles de Sothoryos et [Root.Location.GetName] sont des endroits dangereux mais peuvent regorger de richesses. Vous avez découvert une abondance d'épices exotiques qui n'attendent que d'être ramassées. Vous avez récupéré les épices et allez sûrement les vendre une fortune sur les marchés.;;;Las junglas de Sothoryos y [Root.Location.GetName] pueden ser frondosas y difíciles de atravesar, pero pueden conducir a hallazgos fortuitos. En un remoto claro encuentras abundantes y exóticas especias salvajes, listas para ser recogidas. Recolectas las especias, que alcanzarán con seguridad altos precios en los mercados.;;;;;;;;;x
OPTAsothoryos.20;There are indeed riches hidden amongst the jungles!;Il y a effectivement des trésors cachés dans cette jungle !;;;Parece que si que existen riquezas escondidas en la jungla!;;;;;;;;;x
EVTDESCsothoryos.25;Maesters and other scholars alike have puzzled over the greatest of the engimas of Sothoryos, the ancient city of Yeen. A ruin older than time, built of oily black stone, in massive blocks so heavy that it would require a dozen elephants to move them, Yeen has remained a desolation for many thousands of years, yet the jungle that surrounds it on every side has scarce touched it. 'A city so evil that even the jungle will not enter' Nymeria is supposed to have said when she laid eyes on it, if the tales are true.;Mestres et autres érudits ont voulu percer la plus grande énigme de Sothoryos, la cité ancienne d’Yeen. Une ruine plus vieille que le temps, bâtie de pierre noire et huileuse, en blocs massifs si lourds qu’il faudrait douze éléphants pour les déplacer, Yeen  est une désolation depuis des millénaires, mais la jungle qui la cerne de toutes parts l’a à peine touchée. « Une ville tellement funeste que même la jungle n’y entre pas », aurait dit Nymeria en posant les yeux sur elle, si les histoires sont vraies.;;;Maestres y demás eruditos le han dado muchas vueltas al más grande de los enigmas de Sothoryos: el de la antigua ciudad de Yeen. Las ruinas de Yeen se remontan al principio de los tiempos, construida con bloques de piedra negra oleaginosa, tan pesados que haría falta una docena de elefantes para moverlos, lleva abandonada miles de años, pero la jungla que la circunda apenas la ha tocado. 'Es una ciudad tan horrible que ni la selva se atreve a entrar' cuentan que opinó Nymeria al verla.;;;;;;;;;x
OPTAsothoryos.25;I cannot bear this place!;Je ne peux pas supporter cet endroit !;;;¡No soporto este lugar!;;;;;;;;;x
EVTDESCsothoryos.27;Yeen has remained a desolation for many thousands of years, yet the jungle that surrounds it on every side has scarce touched it. Every attempt to rebuild or resettle Yeen has ended in horror, and you were hoping to avoid such a fate. However, everyone in the colony has died from some unspeakable cause...;Yeen est une désolation depuis des millénaires, néanmoins la jungle qui l'entoure ne l'a jamais touchée. Chaque tentative pour reconstruire ou recoloniser Yeen a tournée à l'horreur, et vous avez espéré éviter un tel échec. Néanmoins tout le monde dans la colonie est mort d'une cause indéterminée... ;;;Yeen ha permanecido desolada durante miles de años, y aún así la jungla que la rodea completamente apenas ha tocado la ciudad. Cada intento de reconstruirla o de establecerse en Yeen ha acabado en horror, y tu esperas evitar tal destino. Sin embargo, todo el mundo en la colonia ha muerto de algun tipo de muerte de causa inexplicable...;;;;;;;;;x
EVTOPTAsothoryos.27;Help us!!;Qu'on nous vienne en aide !;;;Ayudadnos!;;;;;;;;;x
TOOLTIPsothoryos.27;The colony at Yeen is destroyed, every inhabitant being killed\n;La colonie à Yeen est détruite, tous les habitants sont morts\n;;;La colonia de Yeen está destruída, y todos los habitantes están muertos\n;;;;;;;;;x
EVTDESCsothoryos.28;Yeen has remained a desolation for many thousands of years, yet the jungle that surrounds it on every side has scarce touched it. Every attempt to rebuild or resettle Yeen has ended in horror, and [From.GetTitledFirstName] was hoping to avoid such a fate with [From.GetHerHis] colony. It is reported, however, everyone in the colony has died from some unspeakable cause...;Yeen est une désolation depuis des millénaires, néanmoins la jungle qui l'entoure ne l'a jamais touché. Chaque tentative pour reconstruire ou recoloniser Yeen a tournée à l'horreur, et [From.GetTitledFirstName] a espéré éviter un tel échec. Néanmoins tout le monde dans la colonie est mort d'une cause indéterminée... ;;;Yeen ha permanecido desolada durante miles de años, y aún así la jungla que la rodea completamente apenas ha tocado la ciudad. Cada intento de reconstruirla o de establecerse en Yeen ha acabado en horror, y [From.GetTitledFirstName] esperaba evitar tal destino para su colonia.  Sin embargo, se ha informado de que todo el mundo en la colonia ha muerto de algún tipo de muerte de causa inexplicable...;;;;;;;;;x
EVTOPTAsothoryos.28;They should never have gone to that evil city;Ils n'auraient jamais dû aller dans cette cité maudite.;;;No deberían haber ido a esa ciudad maldita.;;;;;;;;;x
RED_DEATH_INFO;The Red Death has struck this province, a terrible disease typically caught in the hot and humid lands of Sothoryos. Nine victims of every ten die screaming, bleeding copiously from every orifice, their skin shredding like wet parchment.;La mort rouge a atteint cette province. Il s’agit d’une terrible maladie typique des pays chauds et humides de Sothoryos. Neuf personnes infectées sur dix meurent en hurlant, ensaignant abondemment par tous les orifices, et  la peau se recroquevillant comme du parchemin.;;;La muerte roja ha golpeado esta provincia;;;;;;;;;x
EVTDESC_RIP_11045_has_red_death;[From.GetTitledName] is fairly sure you are developing The Red Death. [From.GetSheHeCap] insists that you follow [From.GetHerHis] instructions.;[From.GetTitledName] a presque la certitude que vous avez la mort rouge. [From.GetSheHeCap] insiste pour que vous suiviez ses instructions.;[From.GetTitledName] ist sich recht sicher, dass Ihr Anzeichen von Schwindsucht zeigt. [From.GetSheHeCap] gibt Euch Anweisungen und besteht darauf, dass Ihr sie befolgt.;;[From.GetTitledName] está bastante seguro/a que has contraído Tisis. [From.GetSheHeCap] insiste que sigas [From.GetHerHis]s instrucciones.;;;;;;;;;x
EVTDESC_RIP_11045_has_red_death_horse;[From.GetTitledName] thinks you sound rather horse and is concerned that you may be developing The Red Death. [From.GetSheHeCap] insists that you follow [From.GetHerHis] instructions.;[From.GetTitledName] dit que vous avez une fièvre de cheval et s'inquiète que vous puissiez avoir contracté la mort rouge. [From.GetSheHeCap] insiste pour que vous suiviez ses instructions.;[From.GetTitledName] findet, Eure Stimme klänge heiser und befürchtet, dass Ihr Anzeichen von Schwindsucht zeigen könntet. [From.GetSheHeCap] gibt Euch Anweisungen und besteht darauf, dass Ihr sie befolgt.;;[From.GetTitledName] cree que sueno bastante ronco y le preocupa que haya contraído Tisis. [From.GetSheHeCap] insiste que sigas [From.GetHerHis]s instrucciones.;;;;;;;;;x
EVTDESC_RIP_11045_has_red_death_certain;[From.GetTitledName] states that [From.GetHerHis] extensive medical experience leads [From.GetHerHim] to the certain conclusion that you are developing The Red Death. [From.GetSheHeCap] insists that you follow [From.GetHerHis] instructions.;[From.GetTitledName] affirme que sa vaste expérience l'amène à la certitude que vous avez la mort rouge. [From.GetSheHeCap] insiste pour que vous suiviez ses instructions.;[From.GetTitledName] ist sich aufgrund langjähriger medizinischer Erfahrung absolut sicher, dass Ihr Anzeichen von Schwindsucht zeigt. [From.GetSheHeCap] gibt Euch Anweisungen und besteht darauf, dass Ihr sie befolgt.;;[From.GetTitledName] expone que [From.GetHerHis]s amplia experiencia médica [From.GetHerHim] lleva a la conclusión de que has contraído Tisis. [From.GetSheHeCap] insiste que sigas [From.GetHerHis]s instrucciones.;;;;;;;;;x
EVTDESC_RIP_11045_has_red_death_sure;[From.GetTitledName] is sure you are developing The Red Death. [From.GetSheHeCap] insists that you follow [From.GetHerHis] instructions.;[From.GetTitledName] a la conviction que vous avez la mort rouge. [From.GetSheHeCap] insiste pour que vous suiviez ses instructions.;[From.GetTitledName] ist sich sicher, dass Ihr Anzeichen von Schwindsucht zeigt. [From.GetSheHeCap] gibt Euch Anweisungen und besteht darauf, dass Ihr sie befolgt.;;[From.GetTitledName] está seguro/a que has contraído Tisis. [From.GetSheHeCap] insiste que sigas [From.GetHerHis]s instrucciones.;;;;;;;;;x
EVTDESC_RIP_11045_has_red_death_uncertain;[From.GetTitledName] hesitantly suggests you are probably developing The Red Death, or something like that. [From.GetSheHeCap] insists that you follow [From.GetHerHis] instructions.;[From.GetTitledName] suggère avec hésitation que vous avez probablement la mort rouge, ou quelque chose du genre. [From.GetSheHeCap] insiste pour que vous suiviez ses instructions.;[From.GetTitledName] zieht zögerlich in Erwägung, dass Ihr möglicherweise Anzeichen von Schwindsucht oder etwas Ähnlichem zeigen könntet. [From.GetSheHeCap] gibt Euch Anweisungen und besteht darauf, dass Ihr sie befolgt.;;[From.GetTitledName] sugiere dudoso/a que puede que hayas contraído Tisis o algo parecido. [From.GetSheHeCap] insiste que sigas [From.GetHerHis]s instrucciones.;;;;;;;;;x
EVTDSC_RIP_5060_red_death;A terrible disease has afflicted by [GetFromRelation] [From.GetTitledFirstName]. [From.GetSheHeCap] has developed an alarming fever and has started bleeding from many orifices, and I have just been informed that [From.GetHerHis] affliction is indeed The Red Death.;Une maladie terrible a touché [GetFromRelation] [From.GetTitledFirstName]. [From.GetSheHeCap] a développé une fièvre alarmante et a commencé à saigner par tous les orifices. J’ai été informé que sa maladie est en fait la mort rouge.;Dies sind finstere Tage. Mein [GetFromRelation] [From.GetTitledFirstName] ist in den letzten Wochen zunehmend schwächer geworden, und ich habe gerade erfahren, dass es sich bei [From.GetHerHis] Krankheit fürwahr um Schwindsucht handelt.;;Son días oscuros. Mi [GetFromRelation], [From.GetTitledFirstName], se ha debilitado en las últimas semanas y acaban de informarme que su enfermedad es claramente el agotamiento.;;;;;;;;;x
