#CODE;ENGLISH;FRENCH;GERMAN;;SPANISH;;;;;;;;;x
EVTDESCsothoryos.2;The lands of [From.Kingdom.GetName] are rife with disease, and one particularly virulent one, the Red Death, has reached [From.GetName]!;Les terres de [From.Kingdom.GetName] sont ravagées par la maladie, et une particulièrement virulente, la mort rouge, a frappé [From.GetName] !;;;Las tierras de [From.Kingdom.GetName] están plagadas de enfermedades, y una particularmente virulenta, la muerte roja, ha alcanzado [From.GetName]!;;;;;;;;;x
EVTOPTAothoryos.2;I sure hope I dont catch it;J'espère ne pas l'attraper. ;;;Espero no cogerla;;;;;;;;;x
red_death;The Red Death;La Mort Rouge;;;La Muerte Roja;;;;;;;;;x
red_death_desc;The Red Death has struck this province, a terrible disease typically caught in the hot and humid lands of Sothoryos. Nine victims of every ten die screaming, bleeding copiously from every orifice, their skin shredding like wet parchment.;La mort rouge a atteint cette province;;;La muerte roja ha golpeado esta provincia;;;;;;;;;x
has_red_death;Has The Red Death;A la mort rouge;;;Tiene la muerte roja;;;;;;;;;x
has_red_death_desc;This character has The Red Death, a terrible disease typically caught in the hot and humid lands of Sothoryos. Nine victims of every ten die screaming, bleeding copiously from every orifice, their skin shredding like wet parchment.;Ce personnage a attrapé la mort rouge, une terrible maladie qu'il est courant de contracter dans les terres chaudes et humides de Sothoryos. Neuf malades sur dix en décèdent, leur sang s'écoulant par tous leurs orifices et leur peau se déchiquetant tel du parchemin mouillé. ;;;Este personaje tiene la muerte roja, una terrible enfermedad endémica de las cálidas y humedas tierras de Sothoryos. Nueve de cada diez de los que la cogen mueren entre gritos agonizantes, sangrando copiosamente por cada uno de sus orificios, con la piel cayéndose a jirones del cuerpo como pergamino mojado.;;;;;;;;;x
has_red_death_death;screaming and bleeding from the Red Death;de la mort rouge;;;de la muerte roja;;;;;;;;;x
EVTDESCsothoryos.3;The Red Death outbreak has complete shattered the colony at [Root.GetName]. Nine men of every ten died screaming, bleeding copiously from every orifice, their skin shredding like wet parchment. The colony has failed as a result.;La mort rouge a complètement ravagé la colonie de [Root.GetName]. Neuf dixièmes des malades sont morts, leur sang ayant quitté leur corps par tous les orifices possibles et leur s'étant déchiqueté comme du parchemin mouillé. Cela a fait échouer la colonie. ;;;La epidemia de muerte roja ha destrozado por completo la colonia de [Root.GetName]. Nueve de cada diez de los que la cogen mueren entre gritos agonizantes, sangrando copiosamente por cada uno de sus orificios, con la piel cayéndose a jirones del cuerpo como pergamino mojado. Esto ha hecho fracasar la colonia.;;;;;;;;;x
EVTOPTAsothoryos.3;It seems colonising here only ends in horror;Il semble que coloniser cette endroit ne résulte qu'en de terribles horreurs. ;;;Parece que colonizar este lugar solo provoca terribles horrores.;;;;;;;;;x
EVTDESCsothoryos.4;Whilst in [Root.Location.GetName], you have caught The Red Death! This agonising disease can cause profusive bleeding and shredded skin.;Alors que vous étiez à [Root.Location.GetName], vous avez attrapé la mort rouge ! Cette très douloureuse maladie provoque des saignements abondants par tous les orifices et le fissurage de la peau.;;;Mientras estabas en [Root.Location.GetName], has cogido la Muerte Roja! Esta dolorosa enfermedad causa sangrados abundantes y que la piel se desmenuce.;;;;;;;;;x
EVTOPTAsothoryos.4;This is not going to be pleasant;Cela ne va pas être plaisant.;;;Esto no será agradable.;;;;;;;;;x
EVTDESCsothoryos.5;Thankfully you did not suffer deadly symptons whilst suffering from The Red Death. You have recovered after experiencing only mildly painful bleeding.;Vous n'avez heureusement pas montré les symptômes mortels de la mort rouge. Vous avez guéri après seulement quelques saignements.;;;Afortunadamente no has sufrido ninguno de los síntomas mortales de la muerte roja. Has sando tras unos dolorosos sangrados.;;;;;;;;;x
EVTOPTAsothoryos.5;Thank [Root.Religion.GetHighGodName];Merci [Root.Religion.GetHighGodName];;;Gracias [Root.Religion.GetHighGodName];;;;;;;;;x
EVTDESCsothoryos.10A;Whilst traversing a humid and green river in [Root.Location.GetName] your boat was attacked by a huge crocodile! It managed to overturn the boat, swimming up from below, after which it devoured much of the crew as they struggled in the water.;Alors que vous traversiez un fleuve verdâtre à [Root.Location.GetName] votre bateau a été attaqué par un immense lézard-lion ! Il est parvenu à renverser l'embarcartion avant de dévorer une bonne partie de l'équipage.;;;Mientras atravesabas un húmedo río verde en [Root.Location.GetName] tu bote fue atacado por un enorme cocodrilo! El animal consiguió volcar el bote, y devorar a gran parte de la tripulación mientras el resto trataba de escapar.;;;;;;;;;x
EVTDESCsothoryos.10B;You were playing in a nearby river, one of those hot humid ones [Root.Location.GetName] is famed for, when a crocodile attacked you! Lurking under the water it ambushed you, trying to devour you!;Vous jouiez dans l'un de ces fleuves si chauds qui font la célébrité de [Root.Location.GetName], lorsqu'un crocodile vous a attaqué ! Il a attendu son heure pour vous dévorer !;;;Estabas jugando cerca de un río de los calientes y húmedos por los que [Root.Location.GetName] es conocido, cuando un cocodrilo te atacó! Acechando debajo del agua consiguió emboscarte, tratando de devorarte!;;;;;;;;;x
EVTDESCsothoryos.10C;You were boating down a river in [Root.Location.GetName] in the humid of heat of the afternoon when a huge storm hit. The intense rain and wind caused the boat to strike a bank and sink. The crew jumped into the water, only to be attacked by swarms of carnivorous fish! Many had their flesh stripped from their bones within minutes.;Vous descendiez le cours d'un fleuve à [Root.Location.GetName] lorsqu'une immense tempête a éclaté. La pluie et le vent intenses ont provoqué une collision entre votre bateau et un banc de sable. Alors que le navire sombrait, l'équipage s'est jeté à l'eau, mais a été attaquée par une nuée de poissons carnivores ! Beaucoup on été dévorés en quelques minutes. ;;;Estabas navegando por un río en [Root.Location.GetName] bajo el calor húmedo de la tarde cuando una gran tormenta estalló. La intensa lluvia y el fuerte viento causaron que el bote golpeara con un banco de arena y se hundiera. La tripulación saltó al agua, solo para descubrir que estaba infestada de peces carnívoros! En pocos minutos devoraron a muchos.;;;;;;;;;x
EVTDESCsothoryos.10D;You and your friends found a stream in the nearby jungles of [Root.Location.GetName] to explore. You were wading through, only to find it is infested by swarms of carnivorous fish! Many of your companions are having the flesh stripped from their bones before they can escape!;Avec vos amis, vous avez découvert un cours d'eau à explorer dans les jungles de [Root.Location.GetName]. Alors que vous pataugiez dedans, vous avez été attaqués par une nuée de poissons carnivores ! Beaucoup de vos compagnons ont été dévorés avant d'avoir pu s'échapper !;;;Encontraste un arroyo en la jungla cercana de [Root.Location.GetName] para explorar. Al vadear el arroyo, descubres que estaba infestado de peces carnívoros! ¡Muchos de tus compañeros fueron devorados antes de que pudieran escapar!;;;;;;;;;x
EVTDESCsothoryos.10E;You decided to explore the jungles of [Root.Location.GetName], hoping to find some interesting treasures or artefacts. However, after a few hours hiking, you accidentally tread on a venomous snake! The bright green creature bites you, leaving you with a painful wound that is quickly swelling.;Vous avez décidé d'explorer les jungles de [Root.Location.GetName] dans l'espoir de trouver des trésors. Cependant, après quelques heures de marche, vous avez rencontré un serpent vénéneux ! La créature au vert éclatant vous a mordu, vous laissant seul avec une blessure très douloureuse qui ne fait que gonfler.;;;Decides explorar las junglas de [Root.Location.GetName], con la esperanza de encontrar algún tesoro. Sin embargo, después de caminar un par de horas, pisas accidentalmente una serpiente venenosa! La criatura de color verde brillante te muerde, dejándote con una dolorosa herida que se hincha rápidamente.;;;;;;;;;x
EVTDESCsothoryos.10F;Whilst in the jungles of [Root.Location.GetName], you found a cave which seemed unexplored. You and your companions entered, only to be attacked by a swarm of wasps! You escaped, but after you returned you started developing painful rashes and lumps under your skin. When cut open, you find they had laid eggs under your skin!;Alors que vous étiez dans les jungles de [Root.Location.GetName], vous avez trouvé une grotte qui semblait inexplorée. Vous êtes entré dedans avec quelques compagnons, mais vous avez été attaqués par un essaim d'abeilles ! Vous vous êtes échappé, mais lors du retour vous avez commencé à ressentir de douloureux fourmillement sous votre peau. En vous coupant un peu vous découvrez avec horreur des oeufs sous votre peau !;;;Mientras estabas en las junglas de [Root.Location.GetName], encuentras una cueva que parecía inexplorada. Al entrar con varios compañeros, fuisteis atacados por un enjambre de avispas! Conseguisteis escapar, pero después de regresar vivos empezasteis a desarrollar erupciones y bultos dolorosos debajo de la piel. Al cortarlos para abrirlos, encontrasteis que las avispas habían puesto huevos debajo de vuestra piel!;;;;;;;;;x
EVTDESCsothoryos.10G;In the deep, wet jungles of [Root.Location.GetName] you were searching for new pastures and treasures. On a particularly overgrown and narrow trail you and your party were suddenly ambushed by a fierce basilisk! It is twice the size of a lion, and it quickly constricts and kills many of you before it turns on you...;Vous étiez à la recherche de trésors dans les humides et profondes jungles de [Root.Location.GetName], lorsqu'un basilic a attaqué votre groupe ! Il avait deux fois la taille d'un lion, et a tué bien des vôtres avant de se tourner vers vous…;;;En las profundas y húmedas junglas de [Root.Location.GetName] mientras buscabas nuevos pastos y tesoros. En un estrecho sendero el grupo fue repentinamente emboscado por un fiero basilisco! Era el doble de grande que un león, y rápidamente atrapó y mató a muchos antes de que se girara hacia ti...;;;;;;;;;x
EVTDESCsothoryos.10H;You were exploring far to the south of [Root.Location.GetName] in the deep, dense jungles of Sothoryos when you found what appears to be an unexplored, pristine valley. You soon find out why it is untouched. You and your companions are attacked by a group of fierce apes! Some of them are so powerful and large they would dwarf the largest giants, and they proceed to rip apart many of your companions...;Vous exploriez les jungles profondes et denses loin au sud de [Root.Location.GetName] lorsque vous avez découvert une vallée vierge et inexplorée. Vous comprenez rapidement pourquoi elle est restée intouchée. Votre groupe est attaqué par un groupe de singes ! Certains d'entre eux sont si puissants et grands qu'ils pourraient regarder de haut le plus grand des géants, et ils ont massacré nombre de vos compagnons...;;;Estabas explorando muy al sur de [Root.Location.GetName] en la profunda y densa jungla de Sothoryos, cuando descubriste lo que parecía un inexplorado valle virgen. Pronto encuentras la razón de su estado. El grupo fue atacado por un fiero grupo de monos! Algunos de ellos tan grandes y poderosos, que harían empequeñecer a los gigantes más grandes, y masacraron a muchos de tus compañeros...;;;;;;;;;x
OPTAsothoryos.10;Arrgh!!;Arrgh !!;;;Arrgh!!!;;;;;;;;;x
EVTDESCsothoryos.11A;Your [GetFromRelation] [From.GetTitledFirstName] was traversing a humid and green river in [From.Location.GetName] when [From.GetHerHis] boat was attacked by a huge crocodile! It managed to overturn [From.GetHerHis] boat, swimming up from below, after which it devoured much of [From.GetHerHis] crew as they struggled in the water.;Votre [GetFromRelation] [From.GetTitledFirstName] traversait un fleuve verdâtre à [From.Location.GetName] lorsque son bateau a été attaqué par un immense lézard-lion ! Il est parvenu à renverser l'embarcation avant de dévorer une bonne partie de l'équipage.;;;Tu [GetFromRelation] [From.GetTitledFirstName] estaba atravesando un húmedo río verde en [Root.Location.GetName] cuando su bote fue atacado por un enorme cocodrilo! El animal consiguió volcar el bote, y devorar a gran parte de la tripulación mientras el resto trataba de escapar.;;;;;;;;;x
EVTDESCsothoryos.11B;Your [GetFromRelation] [From.GetTitledFirstName] was playing in a nearby river, one of those hot humid ones [From.Location.GetName] is famed for, when a crocodile attacked [From.GetHerHim]! Lurking under the water it ambushed [From.GetHerHim], trying to devour [From.GetHerHim]!;Votre [GetFromRelation] [From.GetTitledFirstName] jouait dans l'un de ces fleuves si chauds qui font la célébrité de [From.Location.GetName] lorsqu'un crocodile l'a attaqué ! Il a attendu son heure pour le(a) dévorer !;;;Tu [GetFromRelation] [From.GetTitledFirstName] estabas jugando cerca de un río de los calientes y húmedos por los que [Root.Location.GetName] es conocido, cuando un cocodrilo le atacó! Acechando debajo del agua consiguió emboscarle, tratando de devorarle!;;;;;;;;;x
EVTDESCsothoryos.11C;Your [GetFromRelation] [From.GetTitledFirstName] was boating down a river in [From.Location.GetName] in the humid of heat of the afternoon when a huge storm hit. The intense rain and wind caused [From.GetHerHis] boat to strike a bank and sink. The crew jumped into the water, only to be attacked by swarms of carnivorous fish! Many had their flesh stripped from their bones within minutes.;Votre [GetFromRelation] [From.GetTitledFirstName] descendait le cours d'un fleuve à [From.Location.GetName] lorsqu'une immense tempête a éclaté. La pluie et le vent intenses ont provoqué une collision entre son bateau et un banc de sable. Alors que le navire sombrait, l'équipage s'est jeté à l'eau, mais a été attaqué par une nuée de poissons carnivores ! Beaucoup on été dévorés en quelques minutes.;;;Tu [GetFromRelation] [From.GetTitledFirstName] estaba navegando por un río en [Root.Location.GetName] bajo el calor húmedo de la tarde cuando una gran tormenta estalló. La intensa lluvia y el fuerte viento causaron que el bote golpeara con un banco de arena y se hundiera. La tripulación saltó al agua, solo para descubrir que estaba infestada de peces carnívoros! En pocos minutos devoraron a muchos.;;;;;;;;;x
EVTDESCsothoryos.11D;Your [GetFromRelation] [From.GetTitledFirstName] and [From.GetHerHis] friends found a stream in the nearby jungles of [From.Location.GetName] to explore. They were wading through, only to find it was infested by swarms of carnivorous fish! Many of [From.GetHerHis] companions had the flesh stripped from their bones before they could escape!;Votre [GetFromRelation] [From.GetTitledFirstName] et ses amis ont découvert un cours d'eau à explorer dans les jungles de [From.Location.GetName]. Alors qu'ils pataugeaient dedans, ils ont été attaqués par une nuée de poissons carnivores ! Beaucoup de ses compagnons ont été dévorés avant d'avoir pu s'échapper !;;;Tu [GetFromRelation] [From.GetTitledFirstName] encontró un arroyo en la jungla cercana de [Root.Location.GetName] para explorar. Al vadear el arroyo, descubrió que estaba infestado de peces carnívoros! ¡Muchos de sus compañeros fueron devorados antes de que pudieran escapar!;;;;;;;;;x
EVTDESCsothoryos.11E;Your [GetFromRelation] [From.GetTitledFirstName] decided to explore the jungles of [From.Location.GetName], hoping to find some interesting treasures or artefacts. However, after a few hours hiking, [From.GetSheHe] accidentally trod on a venomous snake! The bright green creature bit [From.GetHerHim], leaving [From.GetHerHim] with a painful wound that is quickly swelling.;Votre [GetFromRelation] [From.GetTitledFirstName] a décidé d'explorer les jungles de [From.Location.GetName], dans l'espoir de trouver des trésors. Cependant, après quelques heures de marche, [From.GetSheHe] a rencontré un serpent vénéneux ! La créature au vert éclatant l'a mordu, le(a) laissant seul(e) avec une blessure très douloureuse qui ne fait que gonfler.;;;Tu [GetFromRelation] [From.GetTitledFirstName] decidió explorar las junglas de [Root.Location.GetName], con la esperanza de encontrar algún tesoro. Sin embargo, después de caminar un par de horas, pisó accidentalmente una serpiente venenosa! La criatura de color verde brillante le mordió,dejándole con una dolorosa herida que se hinchaba rápidamente.;;;;;;;;;x
EVTDESCsothoryos.11F;Whilst in the jungles of [From.Location.GetName], your [GetFromRelation] [From.GetTitledFirstName] found a cave which seemed unexplored. [From.GetSheHeCap] and [From.GetHerHis] companions entered, only to be attacked by a swarm of wasps! They escaped, but after they returned [From.GetTitledFirstName] started developing painful rashes and lumps under [From.GetHerHis] skin. When cut open, you find they had laid eggs under [From.GetHerHis] skin!;Alors qu'[From.GetSheHe] était dans les jungles de [From.Location.GetName], votre [GetFromRelation] [From.GetTitledFirstName] a trouvé une grotte qui semblait inexplorée. [From.GetSheHeCap] est entré dedans avec quelques compagnons, mais a été attaqué par un essaim d'abeilles ! [From.GetSheHeCap] s'est échappé, mais lors du retour [From.GetSheHe] a commencé à ressentir de douloureux fourmillement sous sa peau. En se coupant un peu [From.GetSheHe] a découvert avec horreur des oeufs sous sa peau !;;;Mientras estaba en las junglas de [From.Location.GetName], tu [GetFromRelation] [From.GetTitledFirstName] encontró una cueva que parecía inexplorada. Al entrar con varios compañeros, fueron atacados por un enjambre de avispas! Consiguieron escapar, pero después de regresar vivos empezaron a desarrollar erupciones y bultos dolorosos debajo de la piel. Al cortarlos para abrirlos, encontraron que las avispas habían puesto huevos debajo de su piel!;;;;;;;;;x
EVTDESCsothoryos.11G;In the deep, wet jungles of [From.Location.GetName] your [GetFromRelation] [From.GetTitledFirstName] was searching for new pastures and treasures. On a particularly overgrown and narrow trail [From.GetSheHe] and [From.GetHerHis] party were suddenly ambushed by a fierce basilisk! It was twice the size of a lion, and it quickly constricted and killed many of them before it turned on [From.GetTitledFirstName]...;Votre [GetFromRelation] [From.GetTitledFirstName] était  à la recherche de trésors dans les humides et profondes jungles de [From.Location.GetName] lorsqu'un basilic a attaqué son groupe ! Il avait deux fois la taille d'un lion, et a tué bien des siens avant de se tourner vers [From.GetTitledFirstName]... ;;;En las profundas y húmedas junglas de [Root.Location.GetName] tu [GetFromRelation] [From.GetTitledFirstName] estaba buscando nuevos pastos y tesoros. En un estrecho sendero su grupo fue repentinamente emboscado por un fiero basilisco! Era el doble de grande que un león, y rápidamente atrapó y mató a muchos antes de que se girara hacia [From.GetTitledFirstName]...;;;;;;;;;x
EVTDESCsothoryos.11H;Your [GetFromRelation] [From.GetTitledFirstName] was exploring far to the south of [RFrom.Location.GetName] in the deep, dense jungles of Sothoryos when [From.GetSheHe] found what appeared to be an unexplored, pristine valley. [From.GetSheHeCap] soon find out why it was untouched. [From.GetSheHeCap] and [From.GetHerHis] companions were attacked by a group of fierce apes! Some of them were so powerful and large they would dwarf the largest giants, and they proceeded to rip apart many of the party apart...;Votre [GetFromRelation] [From.GetTitledFirstName] explorait les jungles profondes et denses loin au sud de [From.Location.GetName] lorsqu'[From.GetSheHe] a découvert une vallée vierge et inexplorée. [From.GetTitledFirstName] a très vite compris pourquoi elle est restée intouchée. Son groupe a été attaqué par un groupe de singes ! Certains d'entre eux sont si puissants et grands qu'ils pourraient regarder de haut le plus grand des géants, et ils ont massacré nombre de ses compagnons...;;;Tu [GetFromRelation] [From.GetTitledFirstName] estaba explorando muy al sur de [Root.Location.GetName] en la profunda y densa jungla de Sothoryos, cuando descubrió lo que parecía un inexplorado valle virgen. Pronto encontró la razón de su estado. El grupo fue atacado por un fiero grupo de monos! Algunos de ellos tan grandes y poderosos, que harían empequeñecer a los gigantes más grandes, y masacraron a muchos de sus compañeros...;;;;;;;;;x
OPTAsothoryos.11;Sothoryos is a dangerous place;Sothoryos est un endroit dangereux;;;Sothoryos es un lugar peligroso;;;;;;;;;x
EVTDESCsothoryos.15A;Whilst marching through [Root.Location.GetName], deep in the jungles of Sothoryos, you pass a cave. This is when a ferocious Brindled Wyvern, thirty feet long, suddenly flies out and attacks you! The great jade-and-white beast has an insatiable hunger, and is tearing at you with its cruel beak trying to devour you!;Alors que vous traversiez [Root.Location.GetName], vous démenant avec la terrible jungle de Sothoryos, vous êtes passé devant une grotte. C'est à ce moment qu'une vouivre bringée longue de 30 pieds s'est envolée et vous a attaqué ! La grande bête aux caractéristiques écailles jade et blanc a une faim insatiable et tente de vous dévorer avec son terrible bec !;;;Mientras atraviesas [Root.Location.GetName], en las profundidades de las junglas de Sothoryos, pasas por delante de una cueva. De repente un feroz guiverno pinto, de 30 pies de largo, sale volando de ella y te ataca! ¡La gran bestia de escamas de color jade y blanco posee un insaciable apetito, e intenta devorarte con su terrible pico!;;;;;;;;;x
EVTDESCsothoryos.15B;The people going about there business around you in [Root.Location.GetName] thought they were safe, that was before a pack of Brownbellied Wyverns attacked! Hundreds of these monkey-sized beasts descend on the settlement, hunting for easy catches, pecking at them with their cruel beaks and smothering them with countless leathery wings. A group then picks you out...;Les gens de [Root.Location.GetName] pensaient être en sécurité, jusqu'à ce qu'une bande de vouivres ventres-bruns les attaquent ! Des centaines de ces bêtes pas plus grandes que des singes se sont abattues sur la colonie, cherchant des proies faciles, dévorant toutes les personnes qui avaient le malheur de se trouver face à elles... Un groupe de vouivres vous a d'ailleurs enlevé...;;;Los habitantes de [Root.Location.GetName] pensaban que estaban seguros, hasta que de repente una manada de guivernos panzaparda atacó de improvisto! Cientos de estas bestias de tamaño similar al de monos cayeron sobre el asentamiento, a la caza de presas fáciles, picoteando a la gente sin piedad. Entonces veis como un grupo de estas bestias te escoge como objetivo...;;;;;;;;;x
EVTDESCsothoryos.15C;Deep in the jungles of [Root.Location.GetName] you were camping in the canopy of trees, where you thought you'd be safe from predators. However a dreaded Shadow-wing Wyvern attacks you in the night! The huge black-scaled beast is like a fireless dragon, yet much more ferocious, and is trying to tear you apart!;Vous campiez dans la canopée des arbres de la jungle de [Root.Location.GetName], pensant être en sécurité. Mais une vouivre aile d'ombre vous a attaqué durant la nuit ! L'immense bête aux écailles noires ne crache pas de feu, mais est bien plus féroce qu'un dragon et elle tente de vous dévorer !;;;Acampas bajo el follaje de los árboles de la jungla de [Root.Location.GetName] pensando estar seguro de los depredadores. Sin embargo, un temible guiverno de alas sombrías te ataca en la noche! La enorme bestia de escamas negras es como un dragón sin fuego pero mucho más feroz, y está tratando de despedazarte!;;;;;;;;;x
OPTAsothoryos.15;I must defend myself!;Je dois me défendre !;;;Debo defenderme!;;;;;;;;;x
TOOLTIPsothoryos.16;You kill the Wyvern;Vous tuez la vouivre;;;Matas al guiverno;;;;;;;;;x
TOOLTIPsothoryos.17;The Wyvern mauls you!;La vouivre vous malmène !;;;El guiverno te ataca!;;;;;;;;;x
EVTDESCsothoryos.16;You managed to evade the Wyvern attack, and in the process slayed the tyrannical beast. Its corpse now lies before you.;Vous parvenez à esquiver l'attaque de la vouivre et vous tuez la terrible bête. Son corps gît désormais devant vous.;;;Consigues esquivar el ataque del guiverno, y al mismo tiempo consigues matar a la terrible bestia. Su cadáver yace ahora ante ti.;;;;;;;;;x
EVTOPTAothoryos.16;I fear no Wyverns;Je ne crains pas les vouivres !;;;No tengo miedo a los guivernos;;;;;;;;;x
nick_wyvernsbane;Wyvernsbane;Fléau-des-Vouivres;;;Plaga de Guivernos;;;;;;;;;x
EVTDESCsothoryos.17;You try to fend off the ferocious Wyvern attack, but it is too much. You are mauled by its cruel beak, and you are now its mercy...;Vous tentez d'esquiver l'attaque de la vouivre, mais vous n'y parvenez pas. Vous êtes blessé par son bec et vous êtes maintenant à sa merci…;;;Intentas esquivar el feroz ataque del guiverno, pero no lo logras. El terrible pico de la bestia te deja malherido, y ahora estás a su merced...;;;;;;;;;x
EVTOPTAothoryos.17;Help!;Au secours !;;;¡Ayuda!;;;;;;;;;x
