stillborn;Stillborn;Mort-né;;;Mortinato;;;;;;;;;x;
EVTDESCPIL112;To [Root.PrimaryTitle.GetFOA] [Root.GetTitledFirstName]\nI write this letter to inform you of a great threat. [From.PlotTarget.GetTitledFirstName] is not the child of [From.PlotTarget.Father.GetTitledFirstName] at all, but the product of adultery on the part of [From.PlotTarget.GetHerHis] mother and another man! I urge all good lords of the realm to take arms against this deception.\nSigned,\n[From.GetFirstName] of the House [From.GetOnlyDynastyName], [From.GetTitle] of [From.PrimaryTitle.GetName];A [Root.PrimaryTitle.GetFOA] [Root.GetTitledFirstName]\nJ'écris cette lettre pour vous prévenir d'une grave menace. [From.PlotTarget.GetTitledFirstName] n'est pas l'enfant de [From.PlotTarget.Father.GetTitledFirstName], mais le produit d'une relation adultérine entre sa mère et un autre homme ! J'en appelle à tous les lords du royaume pour qu'ils prennent les armes et défendent la justice.\nSigné,\n[From.GetFirstName] de la maison [From.GetOnlyDynastyName], [From.GetTitle] de [From.PrimaryTitle.GetName];;;A [Root.PrimaryTitle.GetFOA] [Root.GetTitledFirstName]\nEscribo esta carta para advertiros de una grave amenaza. [From.PlotTarget.GetTitledFirstName] no es el hijo de [From.PlotTarget.Father.GetTitledFirstName], sino el resultado de una relación adúltera entres su madre y otro hombre. Hago un llamamiento a todos los señores del Reino para que tomen las armas y defiendan la justicia.\nFirmado,\n[From.GetFirstName] de la casa [From.GetOnlyDynastyName], [From.GetTitle] de [From.PrimaryTitle.GetName];;;;;;;;;x;
EVTOPTAPIL112;Of course, I should have known!;Mais bien sûr, j'aurais dû le savoir !;;;Por supuesto, debería haberlo sabido.;;;;;;;;;x;
EVTOPTBPIL112;All lies, of course.;Des balivernes, rien de plus.;;;Tonterías, nada más!;;;;;;;;;x;
EVTTOOLTIPPIL113;will be furious;sera furieux;;;estará furioso;;;;;;;;;x;
EVTDESCPIL113;The day after [From.GetTitledFirstName] leaves, [Root.job_maester.GetTitledFirstName] wakes you with yet more bad news. Apparently, your judgment wasn't good enough for [From.GetHerHim]. [From.GetSheHeCap] has sent ravens to all of your bannermen, attempting to convince them of [From.GetHerHis] case.;Le lendemain du départ de [From.GetTitledFirstName], [Root.job_maester.GetTitledFirstName] vous réveille avec de très mauvaises nouvelles. Apparemment, votre verdict ne l'a pas satisfait. [From.GetSheHeCap] a envoyé des corbeaux à tous vos bannerets, pour les convaincre du bien fondé de ses accusations. ;;;El dia después de la partida de [From.GetTitledFirstName], [Root.job_maester.GetTitledFirstName] te ha despertado con muy malas noticias. Aparentemente, tu veredicto no le satisfizo. Ha enviado cuervos a todos tus vasallos, para convencerles con sus fundadas acusaciones.;;;;;;;;;x;
EVTOPTAPIL113;How DARE [From.GetSheHe]?;Comment ose-t-[From.GetSheHe] ?;;;Cómo ha osado?;;;;;;;;;x;
EVTTOOLTIPPIL114;will be angry;sera en colère;;;estará furioso;;;;;;;;;x;
EVTDESCPIL114;Apparently, [FromFrom.GetFirstName]'s judgment wasn't good enough for [From.GetTitledFirstName]. [From.GetSheHeCap] has sent ravens to all of [FromFrom.GetFirstName]'s bannermen, attempting to convince them of [From.GetHerHis] case.;Apparemment, le verdict [FromFrom.GetFirstName] n'a pas satisfait [From.GetTitledFirstName]. [From.GetSheHeCap] a envoyé des corbeaux à tous les bannerets de [FromFrom.GetFirstName] pour les convaincre du bien fondé de ses accusations. ;;;Parece que, el veredicto de [FromFrom.GetFirstName] no satisfizo a [From.GetTitledFirstName]. Ha enviado cuervos a todos los vasallos de [FromFrom.GetFirstName] para convencerles de las fundadas acusaciones.;;;;;;;;;x;
EVTOPTAPIL114;How DARE [From.GetSheHe]?;Comment ose-t-[From.GetSheHe] ?;;;Cómo ha osado?;;;;;;;;;x;
EVTTOOLTIPPIL115;will be angry;sera en colère;;;estará furioso;;;;;;;;;x;
EVTDESCPIL115;The day after [From.GetTitledFirstName] leaves, [Root.job_maester.GetTitledFirstName] wakes you with yet more bad news. Apparently, your father's judgment wasn't good enough for [From.GetHerHim]. [From.GetSheHeCap] has sent ravens to all of your bannermen, attempting to convince them of [From.GetHerHis] case.;Le lendemain du départ de [From.GetTitledFirstName], [Root.job_maester.GetTitledFirstName] vous réveille avec de très mauvaises nouvelles. Apparemment le verdict de votre père ne l'a pas satisfait. Il a envoyé des corbeaux à tous vos bannerets pour les convaincre du bien fondé de ses accusation.;;;El dia después de la partida de [From.GetTitledFirstName], [Root.job_maester.GetTitledFirstName] te ha despertado con muy malas noticias. Aparentemente, el veredicto no le satisfizo. Ha enviado cuervos a todos tus vasallos, para convencerles con sus fundadas acusaciones.;;;;;;;;;x;
EVTOPTAPIL115;How DARE [From.GetSheHe]?;Comment ose-t-[From.GetSheHe] ?;;;Cómo ha osado?;;;;;;;;;x;
EVTDESCPIL116;It's done. You watch the ravens fly from your keep, delivering your letters to all the lords of the realm. Soon the whole world will know the truth.;C'est fait. Vous observez les corbeaux qui s'envolent depuis votre donjon, transportant vos lettres adressées à tous les lords du royaume. Bientôt le monde entier saura la vérité. ;;;Está hecho. Observas los cuervos volar desde tus almenas, transportando tus cartas dirigidas a todos los señores del Reino. Pronto todo el mundo sabrá la verdad.;;;;;;;;;x;
EVTOPTAPIL116;It looks like the investigation is over, then.;Il semble que l'enquête soit enfin terminée.;;;Parece que la investigación ha concluido.;;;;;;;;;x;
pil_send_ravens;Publish Your Evidence;Publier vos preuves;;;Publicar tus pruebas;;;;;;;;;x;
pil_send_ravens_desc;You've gathered the evidence. Now is the time to make sure the whole realm learns the truth of [Root.PlotTarget.GetTitledFirstName]'s parentage.;Vous avez réuni les preuves. Maintenant il est temps de vous assurer que tout le royaume apprenne la vérité sur la légitimité de [Root.PlotTarget.GetTitledFirstName].;;;Has reunido las pruebas. Ahora es el momento de asegurarse de que todo el Reino conoce la verdad sobre la legitimidad de [Root.PlotTarget.GetTitledFirstName].;;;;;;;;;x;
EVTTOOLTIPPIL117;You prepare the letter.;Vous préparez la lettre.;;;Preparas la carta.;;;;;;;;;x;
EVTDESCPIL117;You spend all evening preparing the letter, making careful note of all the evidence you have gathered, and copying it out by hand. By dawn, you are finished.;Vous passez la nuit à préparer la lettre, énumérant avec minutie toutes les preuves que vous avez réunies avant de les coucher sur le papier. A l'aube, vous avez enfin terminé. ;;;Pasas la noche escribiendo la carta, enumerando todas las pruebas que has reunido antes de plasmarlas en el papel. Al alba, finalmente terminas.;;;;;;;;;x;
EVTOPTAPIL117;Time to send the ravens.;Il est temps d'envoyer les corbeaux.;;;Es el momento de enviar los cuervos.;;;;;;;;;x;
EVTDESCPIL118;You awake to horrifying news - [From.GetTitledFirstName] has apparently sent letters to all the lords in the realm, claiming that you are the product of adultery on the part of your mother.;A votre réveil vous apprenez une terrible nouvelle, [From.GetTitledFirstName] a apparemment envoyé des lettres à tous les lords du royaume, vous accusant d'être le produit d'un adultère mettant en cause votre mère. ;;;Cuando te levantas, descubres una terrible noticia, [From.GetTitledFirstName] ha enviado cartas a todos los señores del Reino, acusándote de ser el resultado de un adulterio perpetrado por tu madre.;;;;;;;;;x;
EVTOPTAPIL118;Lies, all lies!;Mensonges ! Ce ne sont que des mensonges !;;;Mentiras! Son todo mentiras!;;;;;;;;;x;
EVTDESCPIL119;You awake to horrifying news - [From.GetTitledFirstName] has apparently sent letters to all the lords in the realm, claiming that [From.PlotTarget.GetTitledFirstName] is the product of adultery on your part..;A votre réveil vous apprenez une terrible nouvelle, [From.GetTitledFirstName] a apparemment envoyé des lettres à tous les lords du royaume, accusant [From.PlotTarget.GetTitledFirstName] d'être le produit d'un adultère que vous auriez perpétré.;;;Cuando te levantas, descubres una terrible noticia, [From.GetTitledFirstName] ha enviado cartas a todos los señores del Reino, acusando a [From.PlotTarget.GetTitledFirstName] de ser el resultado de un adulterio por tu parte.;;;;;;;;;x;
EVTOPTAPIL119;Well, hopefully nobody will believe it.;Avec un peu de chance personne n'y croira.;;;Con suerte nadie le creerá.;;;;;;;;;x;
EVTDESCPIL120;Apparently, your secret is out. [From.GetTitledFirstName] has sent letters to all the lords in the realm, claiming that your secret child [From.PlotTarget.GetTitledFirstName] is the product of adultery.;Apparamment, le secret est dévoilé. [From.GetTitledFirstName] a envoyé des missives à tous les lords du royaume, accusant votre enfant caché [From.PlotTarget.GetTitledFirstName] d'être le produit de l'adultère.;;;Parece que el secreto ha sido develado. [From.GetTitledFirstName] ha enviado misivas a todos los señores del Reino, acusando a tu hijo oculto [From.PlotTarget.GetTitledFirstName] de ser el resultado de adulterio.;;;;;;;;;x;
EVTOPTAPIL120;Well, hopefully nobody will believe it.;Avec un peu de chance personne n'y croira.;;;Con suerte nadie le creerá.;;;;;;;;;x;
ACTIONSUCCEED;Success!\n;Succès!\n;;;Éxito!\n;;;;;;;;;x;
ACTIONFAIL;Failure!\n;Echec!\n;;;Fracaso!\n;;;;;;;;;x;
PILEVTRAITMISSING;They argue that [From.PlotTarget.GetFirstName] lacks [From.PlotTarget.GetHerHis] father's features.\n;Ils disent que [From.PlotTarget.GetTitledFirstName] n'a guère de ressemblances avec son père.\n;;;Dicen que [From.PlotTarget.GetTitledFirstName] no se parece en nada a su padre.\n;;;;;;;;;x;
PILEVTRAITPRESENT;They argue that [From.PlotTarget.GetFirstName] has features neither of [From.PlotTarget.GetHerHis] parents possess.\n;Ils disent que [From.PlotTarget.GetTitledFirstName] possède des caractéristiques qui ne sont présentes chez aucun de ses parents.\n;;;Dicen que [From.PlotTarget.GetTitledFirstName] tiene rasgos que no están presentes en ninguno de sus padres.\n;;;;;;;;;x;
PILEVAPPEARANCE;They argue that [From.PlotTarget.GetFirstName] looks nothing like [From.PlotTarget.GetHerHis] father.\n;Ils disent que [From.PlotTarget.GetTitledFirstName] ne ressemble pas du tout son père.\n;;;Dicen que [From.PlotTarget.GetTitledFirstName] no se parece a su padre.\n;;;;;;;;;x;
PILEVCONCEPTION;They claim that [From.PlotTarget.GetFirstName]'s father was away at the time of [From.PlotTarget.GetHerHis] conception.\n;Ils disent que le père de [From.PlotTarget.GetTitledFirstName] n'était pas présent lors de sa conception.\n;;;Dicen que el padre de [From.PlotTarget.GetTitledFirstName] no estaba presente en su concepción.\n;;;;;;;;;x;
PILEVCONCEPTIONFAKE;They claim that [From.PlotTarget.GetFirstName]'s father was away at the time of [From.PlotTarget.GetHerHis] conception, but this is an obvious fabrication.\n;Ils disent que le père de [From.PlotTarget.GetTitledFirstName] n'était pas présent lors de sa conception, mais il s'agit manifestement d'une odieuse machination.\n;;;Dicen que el padre de [From.PlotTarget.GetTitledFirstName] no estaba presente en su concepción, pero es claramente una falsificación.\n;;;;;;;;;x;
PILEVGREENDREAMS;They claim to have seen evidence of [From.PlotTarget.GetFirstName]'s illegitimacy in a green dream.\n;Ils disent avoir vu des preuves de l'illégitimité de [From.PlotTarget.GetTitledFirstName] dans un rêve vert.\n;;;Dicen que vieron evidencias de la ilegitimidad de [From.PlotTarget.GetTitledFirstName] en un sueño verde.\n;;;;;;;;;x;
PILEVGREENDREAMSFAKE;They claim to have seen evidence of [From.PlotTarget.GetFirstName]'s illegitimacy in a green dream, but this is an obvious fabrication.\n;Ils disent avoir vu des preuves de l'illégitimité de [From.PlotTarget.GetTitledFirstName] dans un rêve vert, mais il s'agit manifestement d'une odieuse machination.\n;;;Dicen que vieron evidencias de la ilegitimidad de [From.PlotTarget.GetTitledFirstName] en un sueño verde, pero es claramente una maquinación.\n;;;;;;;;;x;
PILEVFLAMES;They claim to have seen proof of [From.PlotTarget.GetFirstName]'s illegitimacy in the flames.\n;Ils disent avoir vu des preuves de l'illégitimité de [From.PlotTarget.GetTitledFirstName] dans les flammes.\n;;;Dicen que vieron evidencias de la ilegitimidad de [From.PlotTarget.GetTitledFirstName] en las llamas.\n;;;;;;;;;x;
PILEVFLAMESFAKE;They claim to have seen proof of [From.PlotTarget.GetFirstName]'s illegitimacy in the flames, but this is an obvious fabrication.\n;Ils disent avoir vu des preuves de l'illégitimité de [From.PlotTarget.GetTitledFirstName] dans les flammes, mais il s'agit manifestement d'une odieuse machination.\n;;;Dicen que vieron evidencias de la ilegitimidad de [From.PlotTarget.GetTitledFirstName] en las llamas, pero es claramente una maquinación.\n;;;;;;;;;x;
PILEVLOVER;They reveal that [From.PlotTarget.Mother.GetTitledFirstName] has been carrying on an affair.\n;Ils révèlent que [From.PlotTarget.Mother.GetTitledFirstName] a entretenu une relation.\n;;;Revelan que [From.PlotTarget.Mother.GetTitledFirstName] ha tenido  una relación.\n;;;;;;;;;x;
PILEVSPECTRAITMISSING;They argue that [From.GetFirstName] lacks [From.GetHerHis] father's features.\n;Ils disent que [From.GetFirstName] n'a guère de ressemblance avec son père.\n;;;Dicen que [From.GetFirstName] no se parece en nada a su padre.\n;;;;;;;;;x;
PILEVSPECTRAITPRESENT;They argue that [From.GetFirstName] has features neither of [GetHerHis] parents possess.\n;Ils disent que [From.PlotTarget.GetTitledFirstName] possède des caractéristiques qui ne sont présentes chez aucun de ses parents.\n;;;Dicen que [From.PlotTarget.GetTitledFirstName] tiene rasgos que no están presentes en ninguno de sus padres.\n;;;;;;;;;x;
PILEVSPECAPPEARANCE;They argue that [From.GetFirstName] looks nothing like [GetHerHis] father.\n;Ils disent que [From.GetFirstName] ne ressemble pas du tout à son père.\n;;;Dicen que [From.GetFirstName] no se parece a su padre.\n;;;;;;;;;x;
PILEVSPECCONCEPTION;They claim that [From.GetFirstName]'s father was away at the time of [GetHerHis] conception.\n;Ils disent que le père de [From.GetFirstName] n'était pas présent lors de sa conception.\n;;;Dicen que el padre de [From.GetFirstName] no estaba presente en su concepción.\n;;;;;;;;;x;
PILEVSPECCONCEPTIONFAKE;They claim that [From.GetFirstName]'s father was away at the time of [GetHerHis] conception, but this is an obvious fabrication.\n;Ils disent que le père de [From.GetFirstName] n'était pas présent lors de sa conception, mais il s'agit manifestement d'une odieuse machination.\n;;;Dicen que el padre de [From.GetFirstName] no estaba presente en su concepción, pero es claramente una maquinación\n;;;;;;;;;x;
PILEVSPECGREENDREAMS;They claim to have seen evidence of [From.GetFirstName]'s illegitimacy in a green dream.\n;Ils disent avoir vu des preuves de l'illégitimité de [From.GetFirstName] dans un rêve vert.\n;;;Dicen que vieron evidencias de la ilegitimidad de [From.GetFirstName] en un sueño verde.\n;;;;;;;;;x;
PILEVSPECGREENDREAMSFAKE;They claim to have seen evidence of [From.GetFirstName]'s illegitimacy in a green dream, but this is an obvious fabrication.\n;Ils disent avoir vu des preuves de l'illégitimité de [From.GetFirstName] dans un rêve vert, mais il s'agit manifestement d'une odieuse machination.\n;;;Dicen que vieron evidencias de la ilegitimidad de [From.GetFirstName] en un sueño verde, pero es claramente una maquinación\n;;;;;;;;;x;
PILEVSPECFLAMES;They claim to have seen proof of [From.GetFirstName]'s illegitimacy in the flames.\n;Ils disent avoir vu des preuves de l'illégitimité de [From.GetFirstName] dans les flammes.\n;;;Dicen que vieron evidencias de la ilegitimidad de [From.GetFirstName] en las llamas.\n;;;;;;;;;x;
PILEVSPECFLAMESFAKE;They claim to have seen proof of [From.GetFirstName]'s illegitimacy in the flames, but this is an obvious fabrication.\n;Ils disent avoir vu des preuves de l'illégitimité de [From.GetFirstName] dans les flammes, mais il s'agit manifestement d'une odieuse machination.\n;;;Dicen que vieron evidencias de la ilegitimidad de [From.GetFirstName] en las llamas, pero es claramente una maquinación\n;;;;;;;;;x;
PILEVSPECLOVER;They reveal that [From.Mother.GetTitledFirstName] has been carrying on an affair.\n;Ils révèlent que [From.GetFirstName] a entretenu une relation extraconjugale.\n;;;Revelan que [From.GetFirstName] ha tenido  una relación adúltera.\n;;;;;;;;;x;
opinion_suspected_bastard;Suspected Bastard;Suspecté de bâtardise;;;Sospechoso de bastardía;;;;;;;;;x;
suspected_bastard;Suspected Bastard;Suspecté de bâtardise;;;Sospechoso de bastardía;;;;;;;;;x;
EVTTOOLTIP33;[This.GetTitledFirstName] is the lover\n;[This.GetTitledFirstName] est l'amant(e)\n;;;[This.GetTitledFirstName] es el amante\n;;;;;;;;;x;
EVTTOOLTIP34;shall be informed of this new evidence;sera informé de cette nouvelle preuve;;;será informado de esta nueva prueba;;;;;;;;;x;
opinion_ignored_accusation;Ignored my Accusation;A ignoré mon accusation;;;Ignoró mi acusación;;;;;;;;;x;
opinion_unfaithful_deceiver;Unfaithful Deceiver;Pas digne de confiance;;;Indigno de confianza;;;;;;;;;x;
opinion_cuckolded_AGOT;Cuckolded;Cocu;;;Cornudo;;;;;;;;;x;
EVTOPTB406;You would kill my unborn child?;Vous voulez tué mon enfant qui n'est même pas né ?;;;Quieres matar a mi hijo que todavía no ha nacido?;;;;;;;;;x;
TOOLTIPbirth.50;You try and persuade her not to take the moon tea;Vous tentez de la persuadé de ne pas prendre le thé de lune.;;;Intentas persuadirla de que no tome el té de la luna.;;;;;;;;;x;
EVTDESCbirth.50;[From.GetFirstName] was horrified at your notion of using moon tea to prevent the pregnancy, and insists that your refrain from doing so.;[From.GetFirstName] a été horrifié d'apprendre que vous vouliez utiliser le thé de lune pour mettre fin à votre grossesse, et insiste pour que vous ne le fassiez pas.;;;[From.GetFirstName] se horrorizó al enterarse que ibas a utilizar té de la luna para poner fin al embarazo, e insiste para que no lo hagas.;;;;;;;;;x;
EVTOPTAbirth.50;Fine, I will not take it;Bien, je ne vais pas le prendre.;;;Bien, no lo tomaré.;;;;;;;;;x;
TOOLTIPbirth.51;You will not take the moon tea and will have [From.GetFirstName]'s child;Vous n'allez pas prendre le thé de lune et allez avoir l'enfant de [From.GetFirstName], qui passera pour celui de [Root.Spouse.GetTitledFirstName].;;;No tomarás té de la luna y tendrás al niño de [From.GetFirstName];;;;;;;;;x;
TOOLTIPbirth.51B;, passing it off as [Root.Spouse.GetTitledFirstName]'s;;;;, quien pasará por el de [Root.Spouse.GetTitledFirstName].;;;;;;;;;x;
EVTOPTBbirth.50;You cannot force me!;Vous ne pouvez pas me forcer !;;;No me puedes obligar!;;;;;;;;;x;
EVTDESCbirth.51;[From.GetFirstName] agreed to not take the moon tea, and will have your child. She will begrudgingly pass it off as [From.Spouse.GetTitledFirstName]'s.;[From.GetFirstName] a accepté de ne pas prendre le thé de lune et va accoucher de votre enfant. Elle le fera passer pour celui de [From.Spouse.GetTitledFirstName] même si cela ne lui plait pas.;;;[From.GetFirstName] ha aceptado no tomar el té de la luna y tendrá a tu hijo. Lo hará pasar por el de [From.Spouse.GetTitledFirstName] aunque a ella no le gusta la idea.;;;;;;;;;x;
EVTDESCbirth.51B;[From.GetFirstName] agreed to not take the moon tea, and will have your child. She will begrudgingly bear you a bastard.;[From.GetFirstName] a accepté de ne pas prendre le thé de lune et vous donnera un enfant. Elle va porter votre batard, mais de mauvaise grâce. ;;;[From.GetFirstName] ha aceptado no tomar el té de la luna y tendrá a tu hijo. Dará a luz un bastardo aunque a ella no le gusta la idea.;;;;;;;;;x;
EVTOPTAbirth.51;Good;Bien.;;;Bien.;;;;;;;;;x;
EVTDESCbirth.52;[From.GetFirstName] was outraged at your attempt to make her have your child, and has defiantly taken the moon tea to halt her pregnancy.;[From.GetFirstName] a été choquée de votre tentative visant à conserver votre enfant, par défi elle a prit le thé de lune pour arrêter la grossesse.;;;[From.GetFirstName] se sorprendió de tu intento de conservar a tu hijo, desafiándote, ella ha tomado té de la luna para detener el embarazo.;;;;;;;;;x;
EVTOPTAbirth.52;Harlot!;Foutre merde !;;;Ramera!;;;;;;;;;x;
opinion_aborted_my_child;Aborted my Child;A avorté de mon enfant;;;Abortó de mi hijo;;;;;;;;;x;
opinion_coerced_into_having_child;Coerced Into Having Child;A contraint à garder l'enfant;;;Forzada a tener un hijo;;;;;;;;;x;
opinion_ignored_false_accusation;Ignored my Accusation;A ignoré mon accusation;;;Ignoró mi acusación;;;;;;;;;x;
EVTDESCPIL36;Your investigation of [Root.PlotTarget.GetTitledFirstName] is progressing well, you  have collected much evidence already. Then when observing [Root.PlotTarget.GetFirstName]'s siblings you realise they share many features, and that they too must be bastards.;Votre enquête sur [Root.PlotTarget.GetTitledFirstName] se déroule bien, vous êtes déjà parvenu à collecter de nombreuses preuves. En observant les frères et soeurs de [Root.PlotTarget.GetFirstName] vous réalisez qu'ils partagent de nombreuses caractéristiques et qu'ils sont sûrement des bâtards eux aussi.;;;Tu investigación sobre [Root.PlotTarget.GetTitledFirstName] se desarrolla bien, has conseguido muchas pruebas. Observando a los hermanos de [Root.PlotTarget.GetFirstName] te das cuenta que comparten muchos rasgos y que seguramente también serán bastardos.;;;;;;;;;x;
TOOLTIPimplicated_sibling;[This.GetTitledFirstName] will be implicated in the investigation\n;[This.GetTitledFirstName] va être impliqué(e) dans l'enquête\n;;;[This.GetTitledFirstName] se incluirá en la investigación\n;;;;;;;;;x;
EVTOPTAPIL36;Yes, some of them indeed are similar;Oui, ils se ressemblent beaucoup…;;;Sí, se parecen mucho...;;;;;;;;;x;
EVTOPTBPIL36;All of [Root.PlotTarget.Mother.GetFirstName]'s spawn must be bastards!;Toute la progéniture de [Root.PlotTarget.Mother.GetFirstName] doit être entâchée de bâtardise !;;;Toda la progenie de [Root.PlotTarget.Mother.GetFirstName] debe ser acusada de bastardía!;;;;;;;;;x;
EVTOPTCPIL36;No, only [Root.PlotTarget.GetFirstName] shall be implicated;Non, seulement [Root.PlotTarget.GetFirstName] doit être impliqué(e);;;No, sólamente [Root.PlotTarget.GetFirstName] sebe estar implicado.;;;;;;;;;x;
EVTDESCPIL37;Your investigation of the target's bastardy is progressing well, you  have collected much evidence already. Then when observing the target's siblings you realise they share many features, and that they too must be bastards.;Votre enquête sur la bâtardise de la cible se déroule bien, vous êtes déjà parvenu à collecter de nombreuses preuves. En observant ses frères et soeurs vous réalisez qu'ils partagent de nombreuses caractéristiques qu'ils sont sûrement des bâtards eux aussi.;;;Tu investigación sobre la bastardía del objetivo se desarrolla bien, has conseguido muchas pruebas. Observando a sus hermanos te das cuenta que comparten muchos rasgos y que seguramente también serán bastardos.;;;;;;;;;x;
EVTDESCPIL38;Your co-plotter [From.GetTitledFirstName] has come to you with a new theory in the investigation. [From.GetSheHeCap] has pointed out that [Root.PlotTarget.GetFirstName] and [Root.PlotTarget.GetHerHis] siblings share many features, and could easily be implicated as illegitimate as well.;Votre complice [From.GetTitledFirstName] est venu vous voir avec une nouvelle théorie. [From.GetSheHeCap] a fait remarquer que [Root.PlotTarget.GetFirstName] et ses frères et soeurs partagent de nombreuses caractéristiques communes et pourraient aisément être considérés comme illégitimes.;;;Tu cómplice [From.GetTitledFirstName] ha venido con una nueva teoría. Remarca que [Root.PlotTarget.GetFirstName] y sus hermanos comparten cmuchos rasgos y podrían ser considerados ilegítimos.;;;;;;;;;x;
PILEVSIBLINGS;They also implicate [From.PlotTarget.GetTitledFirstName]'s siblings.\n;Ils impliquent également les frères et sœurs de [From.PlotTarget.GetTitledFirstName].\n;;;Implican también a los hermanos de [From.PlotTarget.GetTitledFirstName].\n;;;;;;;;;x;
PILEVSPECSIBLINGS;They also implicate [From.GetTitledFirstName]'s siblings.\n;Ils impliquent également les frères et sœurs de [From.GetTitledFirstName].\n;;;Implican también a los hermanos de [From.GetTitledFirstName].\n;;;;;;;;;x;
opinion_conspired_against_me;Conspired Against Me;A conspiré contre moi;;;Conspiró contra mi;;;;;;;;;x;
opinion_conspired_against_child;Conspired Against My Child;A conspiré contre mon enfant;;;Conspiró contra mi hijo;;;;;;;;;x;
opinion_bastard_spawn;Cuckold Bastard Child;Cocu, enfant bâtard;;;Cornudo con hijo bastardo;;;;;;;;;x;
pil_regent_sieze_throne;Sieze [Root.PlotTarget.PrimaryTitle.GetName];S'emparer de [Root.PlotTarget.PrimaryTitle.GetName];;;Incautar el [Root.PlotTarget.PrimaryTitle.GetName];;;;;;;;;x;
