#CODE;ENGLISH;FRENCH;GERMAN;;SPANISH;;;;;;;;;x
EVTDESCFwikid.307;As your [Root.GetShipName] approaches the Titan, which spanning the entrance of the harbor, it lets out a roaring blast that startles you, causing you to stumble backwards. The captain chuckles before steering the ship into the Canal of Heroes, and settles the ship in Chequy Port. You start to crisscross the canals. In one direction you find the Arsenal, ‘Not here’, so you cross another. There you find a fish market and begin to grow frustrated. You turn back around and cross another ending up in front of a building with Black and White doors. After crossing several more canals, you find the Sealord’s Palace to greet [tour_destination_owner.GetTitledFirstNameNoRegnal] [tour_destination_owner.GetOnlyDynastyName].;Le capitaine fait tourner le bateau vers l'entrée du port. Au moment où votre navire s'approche, le Titan barre l'entrée du port laisse échapper un rugissement qui vous étonne, vous faisant tomber en arrière. Le capitaine rigole avant de diriger le navire dans le Canal des Héro. Incertain de votre direction, vous commencez à traverser les différents canaux. Vous partez dans  une direction et vous trouvez l'Arsenal, mais personne n'est trop intéressé à vous aider, alors vous suivez un autre chenal. Là vous trouvez un marché de poisson et vous commencez à être frustré. Vous revenez en arrière et traversez un autre pont pour vous vous retrouvez devant un bâtiment avec des portes en noir et blanc. Étonnamment, il n'y a personne autour, ce qui aggrave votre irritation. Après avoir traversé plusieurs autres canaux, des verts et des noirs, vous contenez votre rage qui bouillonne et vous trouvez enfin le palais du Seigneur de la Mer pour saluer [tour_destination_owner.GetTitledFirstNameNoRegnal] [tour_destination_owner.GetOnlyDynastyName].;;;;;;;;;;;;x
EVTDESCGwikid.307;‘Hold on to something!' The captain shouts out over the storm. The churning waters violently heave the boat left and right, stealing your footing and nearly dumping you overboard. You wrap your hand in the netting, saving yourself at the cost of pain as the [Root.GetShipName] fights into the port of [tour_destination.GetName]. You head into the city, but the rain has the merchants closing their shops.  Along your way you find an open velvet shop. 'A Person will keep away from the velvet!' the shopkeeper shouts. The rain soaks you as you pass the remains of the Labyrinths and enter the Council house to meet [tour_destination_owner.GetTitledFirstNameNoRegnal] [tour_destination_owner.GetOnlyDynastyName].;'Tenez-vous !' Le capitaine crie par-dessus la tempête. Les eaux turbulentes heurtent violemment le bateau à gauche et à droite, vous faisant perdre l'équilibre et vous jetant presque par-dessus bord. Vous enveloppez votre main dans le filet, vous êtes sauvé au prix de la douleur. Enfin le navire arrive dans le port de [tour_destination.GetName]. Vous commencez à parcourir la ville, mais la pluie battante fait fuir  les baleiniers et les magasins ferment. 'J'espérais pouvoir faire des achats avant de partir.' Vous pensez, puis vous tirez votre capuchon et vous continuez à travers l'averse. En chemin, vous trouvez un magasin de velours encore ouvert et vous plongez à l'intérieur pour échapper à la pluie. 'Un homme gardera la pluie loin du velours ! ', crie le commerçant en vous poussant dehors. Vous commencez à discuter, mais décidez de continuer alors que la pluie vous trempe. Vous passez les vestiges du célèbre labyrinthe et vous entrez dans la maison du Conseil pour rencontrer [tour_destination_owner.GetTitledFirstNameNoRegnal] [tour_destination_owner.GetOnlyDynastyName].;;;;;;;;;;;;x
EVTDESCHwikid.307;A beset journey brings you to [tour_destination.GetName]’s drawbridge. Inside is the marketplace and all around you are caravans from lands far and near. As you hop from cart to cart a large bell chimes across the city, sending Norvosi men, their mustaches oiled and kempt, and bald Norvosi women scurrying off in pairs. Unsure of what just happened, and with the peddlers packing up, you head for the for the great Temple of the Bearded Priests. You make your way up the Sinner’s Steps for your meeting with [tour_destination_owner.GetTitledFirstNameNoRegnal] [tour_destination_owner.GetOnlyDynastyName], yearning for a taste of the local specialty, Nasha, at one of the drink houses afterwards.;Un voyage vous conduit aux portes de la ville dans les collines de [tour_destination.GetName] et vous traversez le pont-levis. Vous vous trouvez dans un marché inondé, tout autour de vous, des caravanes de Pentos, Myr, Braavos et Lorath, chacun vendant des marchandises de leur patrie ou de la mer Dothrak. Comme vous passez de charrette à charrette, en regardant les différents produits, une grande cloche sonne à travers la ville, appelant des hommes Norvoshis, leurs visages rasés, sauf pour les moustaches, et les femmes Norvoshis chauves. Incertain de ce qui vient de se passer, et avec les colporteurs qui ferment leur étale, vous vous dirigez vers le pour le grand temple des prêtres à barbe. Vous faites votre chemin vers les marches de la Pécheresse et vers la forteresse-temple pour votre rencontre avec [tour_destination_owner.GetTitledFirstNameNoRegnal] [tour_destination_owner.GetOnlyDynastyName], il sera temps de goûter la spécialité locale, le Nasha, dans l'une des maisons de boissons plus tard.;;;;;;;;;;;;x
EVTDESCIwikid.307;You dismiss the captain at [tour_destination.GetName] and rent a palanquin. You see soldiers outfitted in exquisite armor and long spear along the walls. Inside you find a great many stalls and hawkers. Beyond them are the merchant shops, some offering fine cuts of timber, others linens and fabrics and more, are the woodworkers offering expert woodcrafts. Further in the city you find the armorsmiths, their forges churning out the mastercrafts of armor the city is famous for. And though you yearn for a set of the finest craft you know you have other matters and urge your driver on to [tour_destination_owner.GetTitledFirstNameNoRegnal] [tour_destination_owner.GetOnlyDynastyName]’s feast.;Vous renvoyez le capitaine avec le navire sur les quais du nord de [tour_destination.GetName], louez un palanquin, et parcourez la route à l'intérieur des terres. Vous voyez d'abord les murs massifs, tout le long d'eux se trouvent des soldats équipés d'armure exquise et armés d'une longue lance. Ensuite vous entrez par les portes de la ville et trouvez la route bordée d'un grand nombre de commerçants et vendeurs ambulants, vendant des marchandises de leurs wagons, au-delà se trouvent les magasins marchands, certains offrent de belles pièces de menuiserie, d'autres du lin et ou des tissus. Des boutiques proposent des amulettes et des jouets fabriqués à partir des meilleures coupes de bois local. Plus loin dans la ville, vous trouvez les forgerons, leurs forges produisent les meilleures armures, la ville est célèbre pour ça. Et bien que vous ayez envie de voir l'artisanat le plus fin, vous savez que vous avez d'autres choses à faire et vous pressez votre pilote de vous conduire au banquet de [tour_destination_owner.GetTitledFirstNameNoRegnal] [tour_destination_owner.GetOnlyDynastyName].;;;;;;;;;;;;x
EVTDESCAwikid.308;Just as the sun begins to fade, the captain steers your [Root.GetShipName] to port in [tour_destination.GetName]. Your small party heads through the arching gateway, a small golden Harpy adorning its towers. On either side you see small pyramids housing the Ghiscari of the city. The torches above their doors, fresh and newly lit, cast their glow outwards, lighting the dark road. The city itself offers little in the way of architecture and art, until you find the drillyards. More soldiers than you’ve ever seen all stand in formation. You stand watching the drills but soon break away for your meeting with [tour_destination_owner.GetTitledFirstNameNoRegnal] [tour_destination_owner.GetOnlyDynastyName].;Le capitaine dirige votre navire par le détroit et arrive au port de [tour_destination.GetName] juste avant que le soleil commence à se coucher. Vous débarquez et rejoignez les autres arrivants. Vous traversez la passerelle, une petite Harpie d'or orne les tours de briques couleur de boue. Vous suivez la rue sinueuse de briques brunes à travers la ville. De chaque côté, vous voyez de petites pyramides, abritant les marchands ghiscaris et les familles nobles de la ville. Les torches au-dessus de leurs portes viennent d'être allumées, elles jettent leur lueur vers l'extérieur, éclairant la route sombre. La ville elle-même offre peu de diversité d'architecture et d'art. Alors que vous voyagez dans les rues, vous ne trouvez rien de notable, jusqu'à ce que vous trouviez les cours d'entrainement. Il y a plus de soldats que vous n'en avez jamais vus, vous vous tenez debout, observant les exercices mais bientôt vous partez pour votre rencontre avec [tour_destination_owner.GetTitledFirstNameNoRegnal] [tour_destination_owner.GetOnlyDynastyName].;;;;;;;;;;;;x
EVTDESCBwikid.308;As your [Root.GetShipName] sails into the dock at [tour_destination.GetName], you see the great red pyramids. A shimmer of golden light shines off of the Harpies atop them. A massive gold Harpy with its wings spreads spans the whole of the entrance as you enter the Plaza of Pride. You maneuver through the crowds and come to the fighting pits. In the pit closest to you, a dozen fighters clash with sword and shield to the deafening roars of the crowd. You can’t help but join in the spectacle and begin cheering for a small scrappy fighter. As the fighters are cut down you remember your meeting with [tour_destination_owner.GetTitledFirstNameNoRegnal] [tour_destination_owner.GetOnlyDynastyName].;Alors que votre navire entre dans le dock à [tour_destination.GetName], vous voyez les grandes pyramides rouges s'élever en dominant l'horizon. Un rayon de lumière dorée brille au-dessus des harpies qui se trouvent au sommet de chacune d'elles. Comme vous passez sous la porte, une harpie avec ses ailes d'or massif s'étend sur toute l'entrée, vous entrez dans la plaza d'Orgueil. Tout autour de vous, les commerçants et les clients bruissent, ils marchandent, criant les uns sur les autres. Vous manoeuvrez à travers la foule et venez aux fosses de combat. Dans la fosse la plus proche de vous, une douzaine de combattants se battent à l'épée et au bouclier, sous les rugissements assourdissants de la foule. Vous ne pouvez pas vous empêcher de suivre le spectacle et de commencer à applaudir un petit combattant, même si vous n'avez aucune idée réelle de qui il est. Après que plusieurs des combattants soient abattus, vous vous souvenez de votre rencontre avec [tour_destination_owner.GetTitledFirstNameNoRegnal] [tour_destination_owner.GetOnlyDynastyName] et vous faites le chemin à travers les rues rouges de poussière.;;;;;;;;;;;;x
EVTDESCCwikid.308;The [Root.GetShipName] pulls into the harbor at [tour_destination.GetName], docking at one of the open wharves. You disembark and make your way into the city, passing under a great golden Harpy. Inside the city, the streets are lined with yellow pyramid shops, some specializing in bronzework figures. As you traverse the markets, you see the Great Yellow Pyramids in the distance and begin making your way towards. When you get out of the markets, you enter the tavern district and the famed bedfellows of the city try and tempt you inside. Your steps slow as you consider it, but refuse them so you can meet with [tour_destination_owner.GetTitledFirstNameNoRegnal] [tour_destination_owner.GetOnlyDynastyName].;Le navire arrive dans le port à [tour_destination.GetName], et est amarré à l'un des quais livres. Vous débarquez et, en vous joignant à un grand nombre d'autres nouveaux arrivants, vous vous rendez dans la ville en passant sous les ailes d'une grande Harpie d'or. À l'intérieur de la ville, les rues sont bordées d'échoppes. Chacune offre une variété de produits exotiques provenant d'artisans locaux, dont certains se spécialisent dans les statuettes en bronze et les statues. Au fur et à mesure que vous traversez les marchés, vous voyez au loin les grandes pyramides jaunes, abritant les maisons nobles de la ville et surmontées d'une harpie d'or, et commencez votre chemin vers elles. Lorsque vous sortez des marchés, vous entrez dans le quartier des tavernes et les bordels, on essaye de de vous tenter à rentrer à l'intérieur. Vous hésitez mais à la fin vous refusez afin que vous puissiez rencontrer [tour_destination_owner.GetTitledFirstNameNoRegnal] [tour_destination_owner.GetOnlyDynastyName].;;;;;;;;;;;;x
EVTDESCDwikid.308;The captain of your [Root.GetShipName] sails into the mouth of the Skahazadhan and the harbor at [tour_destination.GetName], tying off the ship at one of the docks as you disembark. You see the Great Pyramid, its multicolored stones rising far above the horizon. You get caught up in the hustle and run along with the crowd, ending up in the fighting pits. You watch on as a half dozen skilled fighters square off against twice their number of beasts, unknown to your eyes. As much as you want to join the crowd, you have matters to attend with [tour_destination_owner.GetTitledFirstNameNoRegnal] [tour_destination_owner.GetOnlyDynastyName] and continue on to the Great Pyramid, passing the Temple of Graces.;Le capitaine navigue dans l'embouchure du Skahazadhan et arrive au port de [tour_destination.GetName], il attache le navire à l'un des quais et vous procédez à votre débarquement. Vous voyez la Grande Pyramide, ses pierres multicolores s'élevant bien au-dessus de l'horizon, lorsque vous passez la porte de la tête de la harpie et que vous entrez dans la ville. Les rues à l'intérieur de la ville sont pleines de marchands, de clients et de voyageurs se précipitant autour en essayant d'arriver à leurs destinations. Vous êtes pris dans l'agitation et vous courez avec la foule. Vous vous retrouvez vers les fosses de combat. Vous regardez une demi-douzaine de combattants bataillant contre deux fois leur nombre de bêtes, que vous ne reconnaissez pas. Alors que vous aimeriez rejoindre la foule et regarder l'habileté des combattants, vous avez des choses plus importantes à faire et vous devez rejoindre [tour_destination_owner.GetTitledFirstNameNoRegnal] [tour_destination_owner.GetOnlyDynastyName] et vous continuez vers la Grande Pyramide, en passant le Temple des Grâces.;;;;;;;;;;;;x
EVTDESCEwikid.308;The captain sails the [Root.GetShipName] along the outer edge of the Sea of Sighs, as your ship sails into [tour_destination.GetName]. You eagerly step off the deck as the ship coasts to a stop. 'The last intact remains of Old Valyria.' You think as you look to the city. You enter and find yourself amidst Ghiscari merchants along the ancient road. As you walk, you happen upon a Jewelry. The jeweler smiles, his auburn hair oiled and styled, and directs your attention. As you look over the stones you remember you have a meeting with [tour_destination_owner.GetTitledFirstNameNoRegnal] [tour_destination_owner.GetOnlyDynastyName], so you exit. As you enter the ancient keep, you can't help but admire it.;Le capitaine navigue le long du bord extérieur de la mer des soupirs, en évitant les terres ravagées de Valyria et la mer fumeuse lorsque votre bateau vogue vers [tour_destination.GetName]. Vous quittez avec empressement le pont lorsque le navire s'arrête. 'Les derniers vestiges intacts de l'ancienne Valyra', vous pensez alors que vous avez passé le chantier naval pour entrer dans la ville elle-même. Vous passez entre les murs de pierre noire vous vous retrouvez au milieu des dizaines de marchands ghiscaris. Vous faites votre chemin le long de la route en pierre noire, en passant devant des colporteurs. Comme vous marchez, vous arrivez devant un marchand de bijoux et vous entrez à l'intérieur. Le joaillier sourit, ses cheveux auburn huilés et dénommés, et il attire votre attention sur le présentoir. Lorsque vous regardez les pierres taillées, vous vous rappelez que vous avez une réunion avec [tour_destination_owner.GetTitledFirstNameNoRegnal] [tour_destination_owner.GetOnlyDynastyName], alors vous remerciez le marchand en promettant de revenir. Passé le mur intérieur se trouve le donjon, vous ne pouvez pas vous empêcher d'admirer. Bien que ce ne soit pas le plus grand, il a été construit en briques de pierre noire et vous pouvez imaginer la puissance qu'il faudrait pour le vaincre.;;;;;;;;;;;;x
EVTDESCFwikid.308;The captain argues with you, 'No, no, no. By [Root.Religion.GetRandomGodName] no. I won’t go, that’s a city of monsters, I won’t do it.' Your frustration grows and you bark at the captain, 'That’s just rumors, so dock the ship already. I have an engagement in [tour_destination.GetName].' The captain smolders but sails into the corroded docks. The blackstone streets are wrapped in a thin smoke. Each breath is heavy and hard as you make your way towards a burning light. The few people you do meet are stunted, twisted, and malformed, and you try your best not to sneer as you head to sup with [tour_destination_owner.GetTitledFirstNameNoRegnal] [tour_destination_owner.GetOnlyDynastyName].;Le capitaine n'est pas d'acccord avec vous: 'Non, non, non. Par [Root.Religion.GetRandomGodName] Non. Je n'irai pas, c'est une ville de monstres, je ne le ferai pas.' Votre frustration grandit et vous aboyer au capitaine, 'C'est juste des rumeurs, alors accoster le navire mainteanant. J'ai un dendez-vous dans [tour_destination.GetName].' Le capitaine maugré mais finalement accepte et entre dans les vieux docks. Alors que vous débarquez, il détache le navire, 'Je serai de retour après ma réunion, je vous rappelerez' Les rues de pierre noire sont enveloppées par une fine fumée, qui provient de l'intérieur des murs en ruines brûlantes de Valyria. Chaque souffle que vous prenez est lourd et difficile alors que vous faites votre chemin à travers les rues vides vers une lumière brûlante que vous supposez être le donjon. Les quelques personnes que vous rencontrez sont rabougries, tordues et mal formées, et vous faites de votre mieux pour ne pas ricaner ou les regarder avec dégoût comme vous vous dirigez vers [tour_destination_owner.GetTitledFirstNameNoRegnal] [tour_destination_owner.GetOnlyDynastyName].;;;;;;;;;;;;x
EVTDESCGwikid.308;You dismiss the [Root.GetShipName] on the Skahazadhan and pass into the Dothraki Sea. It’s not long before you come across [tour_destination_owner.GetTitledFirstNameNoRegnal] and [tour_destination_owner.GetHerHis] Khalasar, and after some strained attempts at conversing,  the [tour_destination_owner.GetTitle] motions and a horse is brought out for you to ride. Over the next few weeks you roam the Great Grass Sea with the Dothraki, observing their culture and joining their festivities. Each night after the ride, you join the [tour_destination_owner.GetTitle] in drinking mare’s milk while the Khalasar busy themselves with singing and dancing. You even accept a fight once and duel with one of the [tour_destination_owner.GetTitle]’s Bloodriders.;Vous renvoyez le navire sur les bords du Skahazadhan et passez des terres civilisées vers la mer Dothrak. Il ne fallut pas longtemps avant que vous rencontriez [tour_destination_owner.GetTitledFirstNameNoRegnal] et son khalasar, et après quelques tentatives tendues pour lier la conversation et une petite quantité de cadeaux, vous sentez que vous les avez convaincus de ne pas vous tuer ou vous asservir. Des gestes de [tour_destination_owner.GetTitle] et un cheval est mis à votre disposition pendant que le khalasar continue son voyage. Au cours des prochaines semaines, vous parcourez les plaines herbeuses avec les Dothrakis, en observant leur culture et en rejoignant leurs festivités. Chaque jour vous prenez des repas avec eux, viande de cheval, saucisse de sang et ragoûts. Chaque nuit après le trajet, vous rejoignez le [tour_destination_owner.GetTitle] en buvant abondamment du lait de jument tandis que le khalasar s'occupe à chanter et à danser. Vous acceptez même une bagarre une fois, à une occasion où vous avez bu un peu trop de lait fermenté de jument vous vous battez en duel avec un Sang-Coureur de [tour_destination_owner.GetTitle].;;;;;;;;;;;;x
EVTDESCHwikid.308;You cross over the Skahazadhan and enter the city of [tour_destination.GetName], home of the Lhazareen and their Sheep God. You find it rather unassuming, filled hovels, pens, and a plain hall. As you head into the city, you find the townsfolk rushing off. Several of the huts are burning, lingering effects of a recent Dothraki raid. You follow and join the Lhazareen in throwing water to fight the flames and, while not overly successful, the combined efforts manage to stymie and contain the fires. Your aid garners you favor and [tour_destination_owner.GetTitledFirstNameNoRegnal] [tour_destination_owner.GetOnlyDynastyName] invites you to dine in the hall with the people, which you accept.;Vous traversez le Skahazadhan et entrez dans la ville de [tour_destination.GetName], la maison des Lhazaréens et leur Pâtre Suprême. Vous trouvez la ville plutôt modeste, remplis de bâtiments en bois, d'innombrables enclos avec les troupeaux de moutons, et d'une simple salle au centre de la ville. En vous dirigeant vers la ville, vous trouvez les citadins qui se précipitent, l'air est  empli de cris et les bêlements paniqués de moutons, plusieurs des huttes brûlent, les effets d'un raid récent de Dothrakis. Vous continuez, marchant devant les marchands qui viennent des plaines, et vous rejoignez les Lhazaréens en jetant de l'eau pour combattre les flammes. Les efforts combinés réussissent à contenir les feux. Votre aide vous attire les faveurs de [tour_destination_owner.GetTitledFirstNameNoRegnal] [tour_destination_owner.GetOnlyDynastyName] et il vous invite à dîner dans la salle avec les gens, ce que vous acceptez.;;;;;;;;;;;;x
EVTDESCIwikid.308;After weeks of riding the Great Grass Sea, you come to the two Bronze Horses of [tour_destination.GetName]. The Khal riding with you removes his sword and looks at you. You disarm as instructed, turning them over to the dosh khaleen. The Khalasar disperses as you continue up the Godsway, towards the Mother of Mountains, and enter the Western market. You come to a gathering of the Dothraki on the south bank of the Womb. In the open pit, you watch as a woman slowly devours a horse heart to the rhythmic chants of the crowd. You join in the cheering as she finishes, then continue into the market and look over the eastern goods, chief among them, the strange stripped beasts of the Jogos Nhai.;Après des semaines de chevauchée au sein de la Mer Dothrak, vous arrivez aux deux chevaux de bronze de [tour_destination.GetName]. Le Khal qui chevauche avec vous décroche son épée, vous regarde et dit entre ses dents ‘pas d’épée dans la ville, alors enlevez vos lames’. Une fois désarmé(e) comme on vous l’a demandé, vous vous dirigez vers le dosh khaleen. Le Khalasar se disperse dans la ville pendant que vous continuez sur la voie des dieux, la Mère des Montagnes dominant l’horizon. Vous entrez dans le marché et passez entre les stands construits à la hâte, regardant les biens amenés depuis les Cités libres. En vous dirigeant vers l’est, vous arrivez à un rassemblement de Dothrakis sur la berge sud du Nombril. Dans la fosse, vous observez une femme qui dévore lentement un coeur de cheval alors que la foule autour d’elle chante. Vous vous joignez aux choeurs alors qu’elle finit puis revenez au marché où vous passez le reste de la journée à regarder les marchandises de l’est, notamment les étranges bêtes à rayures de Jogos Nhai.;;;;;;;;;;;;x
