#CODE;ENGLISH;FRENCH;GERMAN;;SPANISH;;;;;;;;;x
EVTOPTBwikid.115;I'll take the door beneath the Ghiscari;Je pendrai la porte au-dessous des Ghiscaris;;;;;;;;;;;;x
EVTOPTCwikid.115;I'll take the door beneath the Rhoynar;Je pendrai la porte au-dessous des Rhoynars;;;;;;;;;;;;x
EVTOPTDwikid.115;I'll take the door beneath the Sarnori;Je pendrai la porte au-dessous des Ibbéniens;;;;;;;;;;;;x
EVTDESCwikid.116;Through more twisting passage ways you go until you reach the last room. Here is one black stone wall before which is a large bottle of mysterious blue liquid. Clearly it must be drunk. You and [wikid_companion.GetFirstName] drink and the wall vanishes and four doors appear! You suffer terrible visions of dragons, wyverns and wolves attacking however, and desperately flee to a door to escape the terror...;Au travers des passages encore plus tortueux, vous atteignez la dernière pièce. Vous vous trouvez devant un mur de pierre noire devant lequel se trouve une grande bouteille qui contient un mystérieux liquide bleu. Clairement, il faut le boire. Avec [wikid_companion.GetFirstName], vous buvez et le mur disparaît pour laisser apparaître quatre portes ! A ce moment, vous avez de terribles visions de dragons, de wyvernes et de loups qui vous attaquent, vous fuyez désespérément vers une porte pour échapper à cette terreur...;;;;;;;;;;;;x
EVTOPTAwikid.116;The first door!;La première porte !;;;;;;;;;;;;x
EVTOPTBwikid.116;The second door!;La deuxième porte !;;;;;;;;;;;;x
EVTOPTCwikid.116;The third door!;La troisième porte !;;;;;;;;;;;;x
EVTOPTDwikid.116;The fourth door!;La quatrième porte !;;;;;;;;;;;;x
EVTDESCwikid.118;After crashing through the door in a frenzied panic, you and [wikid_companion.GetFirstName] fortunately come to rest in large hallway. It would seem we have found the end of the labyrinth, the doors to a large vault stand before you. Before you can enter, however, [wikid_companion.GetFirstName] stops you and says '[Root.PrimaryTitle.GetFOA], I must have a word if it may please you.';Après avoir enfoncé la porte dans une peur panique, vous et [wikid_companion.GetFirstName] pouvez vous reposer dans un grand couloir. Il semble que vous avez trouvé la fin du labyrinthe, les portes vers une grande voûte se trouvent devant vous. Avant de pouvoir entrer, [wikid_companion.GetFirstName] vous arrête et s'adresse à vous '[Root.PrimaryTitle.GetFOA], si je puis vous dire un mot.';;;;;;;;;;;;x
EVTOPTBwikid.118;Please go ahead;Allez-y s'il vous plaît;;;;;;;;;;;;x
TOOLTIPwikidCOMPANIONTALK;You and [wikid_companion.GetFirstName] talk;Vous parlez avec [wikid_companion.GetFirstName];;;;;;;;;;;;x
EVTOPTAwikid.118;No, I do not trust you!;Non, je ne vous fais pas confiance !;;;;;;;;;;;;x
TOOLTIPwikidCOMPANIONDUEL;You try to kill [wikid_companion.GetFirstName]!;Vous essayez de tuer [wikid_companion.GetFirstName] !;;;;;;;;;;;;x
EVTTITLEwikid.119;The Vault;La Voûte;;;;;;;;;;;;x
EVTDESCwikid.119;[wikid_companion.GetFirstName] has been defeated, [wikid_companion.GetHerHis] bid to betray you and take the treasure for [wikid_companion.GetHerHim]self foiled.\n\nYou proceed into the vault alone, moving aside the heavy door made of fused black stone. Inside you see a wonderous sight. Vast piles of gold, silver and other treasures lie before you, and mounted above it all is a magnificent set of valyrian steel armour! It is scale armor made smoky black steel, edged in red-gold, and covered in Valyrian runes and glyphs. Such armour would be worth a kingdoms fortune! It is now time to head home with this new [Root.GetOnlyDynastyName] heirloom.;[wikid_companion.GetFirstName] a été battu, [wikid_companion.GetFirstName] a essayé de vous trahir et de s'accaparer le trésor.\n\nVous vous engagerez sous la voûte, seul, en ouvrant la lourde porte faite de pierre de lave noire. A l'intérieur, une vue merveilleuse s'offre à vous. Des tas d'or, d'argent et d'autres trésors s'étalent devant vous et au dessus se trouve une magnifique armure en acier valyrien ! C'est une armure faite d'acier noir fumé bordé l'or rouge et couverte de runes et glyphes valyriennes. Une telle armure vaut la fortune d'un royaume entier ! Il est maintenant temps de retourner chez vous avec le nouvel héritage des [Root.GetOnlyDynastyName].;;;;;;;;;;;;x
EVTOPTAwikid.119;Yes, my quest is complete!;Oui, je finis ma quête !;;;;;;;;;;;;x
You are a cheating scumbag.;No cheating :);Et sans tricher :);;;;;;;;;;;;x
EVTDESCwikid.120;[wikid_companion.GetFirstName] kneels before you and swears [wikid_companion.GetHerHis] eternal loyalty to you and House [Root.GetOnlyDynastyName]. You then bid [wikid_companion.GetHerHim] rise, so you can enter the vault together.;[wikid_companion.GetFirstName] s'agenouille devant vous et jure sa loyauté éternelle envers vous et la maison [Root.GetOnlyDynastyName]. Vous lui demandez de se relever et vous entrez ensemble sous la voûte.;;;;;;;;;;;;x
EVTOPTAwikid.120;Come my friend, lets take this treasure!;Viens mon ami, allons nous emparer de ce trésor !;;;;;;;;;;;;x
EVTTITLEwikid.121;The Vault;La Voûte;;;;;;;;;;;;x
EVTDESCwikid.121;You and [wikid_companion.GetFirstName] proceed into the vault, moving aside the heavy door made of fused black stone. Inside you see a wonderous sight. Vast piles of gold, silver and other treasures lie before you, and mounted above it all is a magnificent set of valyrian steel armour! It is scale armor made smoky black steel, edged in red-gold, and covered in Valyrian runes and glyphs. Such armour would be worth a kingdoms fortune! It is now time to head home with this new [Root.GetOnlyDynastyName] heirloom.;Avec [wikid_companion.GetFirstName], vous vous engagerez sous la voûte, en ouvrant la lourde porte faite de pierre de lave noire. A l'intérieur,  une vue merveilleuse s'offre à vous. Des tas d'or, d'argent et d'autres trésors s'étalent devant vous et au dessus se trouve une magnifique armure en acier valyrien ! C'est une armure faite d'acier noir fumé bordé l'or rouge et couverte de runes et glyphes valyriennes. Une telle armure vaut la fortune d'un royaume entier ! Il est maintenant temps de retourner chez vous avec le nouvel héritage des [Root.GetOnlyDynastyName].;;;;;;;;;;;;x
EVTOPTAwikid.121;Our quest has been fruitful!;Notre quête a été fructueuse !;;;;;;;;;;;;x
go_on_quest;Go on a Foreign Tour;Partir pour un voyage à l'étranger;;;;;;;;;;;;x
go_on_quest_desc;Go on a tour of foreign lands so that you may learn and become a better [From.GetManWoman].;Partir pour un voyage dans les terres étrangères afin de s'instruire et de devenir meilleur.;;;;;;;;;;;;x
set_manual_tour_destination;Visit on Tour;A visiter durant le voyage;;;;;;;;;;;;x
set_manual_tour_destination_desc;Add this location to your list of destinations on your foreign tour.;Ajouter cet endroit à la liste des destinations de votre voyage à l'étranger.;;;;;;;;;;;;x
TOOLTIPwikid.295;You will decide where you wish to travel to.;Vous décidez de l'endroit où vous avez envie de voyager.;;;;;;;;;;;;x
EVTDESCwikid.295;Where do you wish to go on your tour?;Où voulez-vous voyager ?;;;;;;;;;;;;x
EVTOPTAwikid.295;Show me more locations;Montre-moi d'autres endroits;;;;;;;;;;;;x
EVTOPTBwikid.295;I shall tour the feudal lands of Westeros;Je visiterai les terres de Westeros;;;;;;;;;;;;x
EVTOPTCwikid.295;The trade of the Free Cities entices me the most;Le commerce avec les Cités Libres m'intéresse au plus haut point;;;;;;;;;;;;x
EVTOPTDwikid.295;There are most wonderous constructions in the great slave cities of Ghiscar;Ce sont les constructions les plus merveilleuses dans les grandes cités ghiscaris.;;;;;;;;;;;;x
EVTOPTEwikid.295;There are many different cultures of the Jade Sea, they should be very interesting;Il y a différentes cultures dans la Mer de Jade, elles doivent être très intéressantes;;;;;;;;;;;;x
EVTOPTFwikid.295;The fertile lands of the Summer Sea would be a sight to see;Les terres fertiles de la Mer d'Eté doivent être belles à voir;;;;;;;;;;;;x
EVTOPTGwikid.295;I shall plan my own tour;Je planifierai moi-même mon voyage;;;;;;;;;;;;x
TOOLTIPwikid_manual_tour;You have 10 days to choose a location to be the start of your adventure. To choose it as your destination you must right click on the title flag of the location and select the option to 'Visit on Tour'.;Vous avez 10 jours pour choisir l'endroit pour démarrer votre aventure. Pour choisir vos destinations, vous devez faire un clic droite sur le drapeau de la destination et sélectionner l'option 'A visiter durant le voyage';;;;;;;;;;;;x
EVTDESCwikid.296;How long do you wish your tour to be?;Quelle durée souhaitez-vous pour votre voyage ?;;;;;;;;;;;;x
EVTOPTAwikid.296;A short visit of a few places will do;Un petit voyage avec quelques étapes est suffisant;;;;;;;;;;;;x
TOOLTIPwikid_westeros_sa;You shall visit King's Landing, Highgarden and The Eyrie.\n;Vous visiterez Port-Réal, Hautjardin et Les Eyrié.\n;;;;;;;;;;;;x
TOOLTIPwikid_westeros_sb;You shall visit Dragonstone, Highgarden and The Eyrie.\n;Vous visiterez Peyredragon, Hautjardin et Les Eyrié.\n;;;;;;;;;;;;x
TOOLTIPwikid_free_cities_s;You shall visit Volantis, Pentos and Braavos.\n;Vous visiterez Volantis, Pentos et Braavos.\n;;;;;;;;;;;;x
TOOLTIPwikid_ghiscar_s;You shall visit New Ghis, Astapor and Elyria.\n;Vous visiterez la Nouvelle-Ghis, Astapor et Elyria.\n;;;;;;;;;;;;x
TOOLTIPwikid_jade_sea_s;You shall visit Qarth, Yin and Asshai.\n;Vous visiterez Quarth, Yin et Asshai.\n;;;;;;;;;;;;x
TOOLTIPwikid_summer_sea_s;You shall visit Lotus Point, Naath and the Isle of Flies.\n;Vous visiterez Pointe-Lotus, Naath et l'Ile des Taons.\n;;;;;;;;;;;;x
TOOLTIPwikid_manual_tour_s;You shall choose three provinces you wish to visit.\n;Vous devez choisir les trois provinces que vous voulez visiter.\n;;;;;;;;;;;;x
EVTOPTBwikid.296;The tour should be decent in length;Le voyage doit durer un long moment;;;;;;;;;;;;x
TOOLTIPwikid_westeros_ma;You shall visit King's Landing, Storm's End, Highgarden, Casterly Rock, Riverrun and The Eyrie.\n;Vous visiterez Port-Réal, Accalmie, Hautjardin, Castral Roc, Vivesaigues et Les Eyrié.\n;;;;;;;;;;;;x
TOOLTIPwikid_westeros_mb;You shall visit Dragonstone, Storm's End, Highgarden, Casterly Rock, Riverrun and The Eyrie.\n;Vous visiterez Peyredragon, Accalmie, Hautjardin, Castral Roc, Vivesaigues et Les Eyrié.\n;;;;;;;;;;;;x
TOOLTIPwikid_free_cities_m;You shall visit Volantis, Tyrosh, Myr, Pentos, Braavos and Norvos.\n;Vous visiterez Volantis, Tyrosh, Myr, Pentos, Braavos et Norvos.\n;;;;;;;;;;;;x
TOOLTIPwikid_ghiscar_m;You shall visit New Ghis, Astapor, Yunkai, Meereen, Elyria and Mantarys.\n;Vous visiterez la Nouvelle-Ghis, Astapor, Yunkai, Meereen, Elyria et Mantarys. \n;;;;;;;;;;;;x
TOOLTIPwikid_jade_sea_m;You shall visit Qarth, Faros, Yin, Leng, Asshai and the Bone Mountains.\n;Vous visiterez Quarth, Faros, Yin, Leng, Asshai et les Montagnes des Os.\n;;;;;;;;;;;;x
TOOLTIPwikid_summer_sea_m;You shall visit Lotus Point, Heartvale, Goldenheart, Naath, the Isle of Flies and Ax Isle.\n;Vous visiterez Pointe-Lotus, Valcoeur, Cœur-Dorée, Naath, l'Ile des Taons et l'Ile de la Hache.\n;;;;;;;;;;;;x
TOOLTIPwikid_manual_tour_m;You shall choose six provinces you wish to visit.\n;Vous devez choisir les six provinces que vous voulez visiter.\n;;;;;;;;;;;;x
EVTOPTCwikid.296;I wish to see all the world has to offer!;Je veux voir tout ce que le monde peut offrir !;;;;;;;;;;;;x
TOOLTIPwikid_westeros_la;You shall visit King's Landing, Storm's End, Sunspear, Highgarden, Casterly Rock, Pyke, Riverrun, The Eyrie and Winterfell.\n;Vous visiterez Port-Réal, Accalmie, Lancehélion, Hautjardin, Castral Roc, Pyke, Vivesaigues, Les Eyrié et Winterfell.\n;;;;;;;;;;;;x
TOOLTIPwikid_westeros_lb;You shall visit Dragonstone, Storm's End, Sunspear, Highgarden, Casterly Rock, Pyke, Riverrun, The Eyrie and Winterfell.\n;Vous visiterez Peyredragon, Accalmie, Lancehélion, Hautjardin, Castral Roc, Pyke, Vivesaigues, Les Eyrié et Winterfell.\n;;;;;;;;;;;;x
TOOLTIPwikid_free_cities_l;You shall visit Volantis, Lys, Tyrosh, Myr, Pentos, Braavos, Lorath, Norvos and Qohor.\n;Vous visiterez Volantis, Lys, Tyrosh, Myr, Pentos, Braavos Lorath, Norvos et Qohor.\n;;;;;;;;;;;;x
TOOLTIPwikid_ghiscar_l;You shall visit New Ghis, Astapor, Yunkai, Meereen, Elyria, Mantarys, the Dothraki, Lhazosh and Vaes Dothrak.\n;Vous visiterez la Nouvelle-Ghis, Astapor, Yunkai, Meereen,  Elyria, Mantarys, les Dothraki, Lhazosh et Vaes Dothrak. \n;;;;;;;;;;;;x
TOOLTIPwikid_jade_sea_l;You shall visit Qarth, Faros, Yin, Leng, Asshai, the Five Forts, the Jogos Nhai, the Bone Mountains and Vaes Dothrak.\n;Vous visiterez Quarth, Faros, Yin, Leng, Asshai, les Cinq Forts, les Jogos Nhai, les Montagnes des Os et Vaes Dothrak.\n;;;;;;;;;;;;x
TOOLTIPwikid_summer_sea_l;You shall visit Lotus Point, Heartvale, Moluu, Red Flower Bay, Goldenheart, Naath, the Isle of Flies, Ax Isle and Talon.\n;Vous visiterez Pointe-Lotus, Valcoeur, Moluu, Val-aux-Pivoines, Cœur-Dorée, Naath, l'Ile des Taons l'Ile de la Hache et la Serre.\n;;;;;;;;;;;;x
TOOLTIPwikid_manual_tour_l;You shall choose nine provinces you wish to visit.\n;Vous devez choisir les neuf provinces que vous voulez visiter.\n;;;;;;;;;;;;x
EVTDESCwikid.297;You have failed to pick a destination for your tour.;Vous n'avez pas réussi à sélectionner une destination pour votre voyage.;;;;;;;;;;;;x
EVTOPTAwikid.297;Whoops... guess I'll stay at home then...;Oups … je pense que je vais rester à la maison, alors …;;;;;;;;;;;;x
EVTDESCwikid.298;And off we go to explore the world!;Et nous partons explorer le monde !;;;;;;;;;;;;x
EVTOPTAwikid.298;I shall return a better [Root.GetManWoman];Je reviendrai un homme meilleur/une femme meilleure;;;;;;;;;;;;x
EVTDESCwikid.299;During your journey across the seas your ship was hit by a terrible storm! The ships is violently rocking back and forth, and you try to cling on to anything to keep steady whilst your men tend to keeping the ship on course, and more importantly in one piece...;Durant votre voyage sur les mers, votre navire a été frappé par une terrible tempête ! Le bateau est violemment ballotté d'avant en arrière et alors que vous essayez de vous maintenir debout et vous agrippant à tout ce qui passe à votre portée, les hommes tentent de garder le bateau dans sa trajectoire et le plus important en un seul morceau ...;;;;;;;;;;;;x
EVTOPTAwikid.299;Oh [Root.Religion.GetRandomGodName] no!;Oh [Root.Religion.GetRandomGodName] non !;;;;;;;;;;;;x
TOOLTIPwikid.299_survive;Your men get the ship under control and you safely pass through the storm.;Vos hommes parviennent à garder le contrôle du bateau et vous arrivez à sortir indemne de la tempête.;;;;;;;;;;;;x
TOOLTIPwikid.299_wounded;You are hit by some debris from above and are injured but the ship manages to make it through the storm.;Vous être frappé par des débris et vous êtes blessé alors que le bateau arrive à sortir de la tempête.;;;;;;;;;;;;x
EVTDESCAwikid.300;Your men have managed to get the ship under control and you are safe to continue on your way.;Vos hommes parviennent à garder le contrôle du bateau et vous pouvez continuer votre route.;;;;;;;;;;;;x
EVTDESCBwikid.300;As your men slowly manage to get the ship back under control you hear a loud crack from above and a piece of the mast comes hurtling towards you hitting your arm. As you slowly recover and stand up you see that it has impaled itself in your arm. The surgeon on board comes to help you as the crew have got the ship under control and proceed to your destination.;Alors que vos hommes parviennent lentement à reprendre le contrôle du  navire, vous entendez un craquement au-dessus de vous et un morceau de mât vient se précipiter vers vous et frappe votre bras, comme vous vous remettez lentement et vous vous levez, vous voyez qu'un morceau de bois s'est empalé dans votre bras. Le mestre à bord vient vous aider car l'équipage a maintenant le bateau sous contrôle et vous pouvez continuer vers votre destination.;;;;;;;;;;;;x
EVTOPTAwikid.300;Well that's a relief;Eh bien,  c'est un soulagement;;;;;;;;;;;;x
EVTOPTBwikid.300;This better not get infected;Il vaut mieux ne pas être infecté;;;;;;;;;;;;x
EVTDESCwikid.301;'PIRATES!' is the shout you hear all around the deck as a vessel bearing the flag of pirates is spotted on the horizon sailing towards your ship. It approaches and crashes into the side of the ship, its crew of pirates jumping on board. You must prepare to fight...;PIRATES !! Est le cri que vous entendez tout autour de vous alors qu'un navire au large portant un pavillon noir fait voile vers votre navire. Ils s'écrasent sur le côté du navire et les pirates sautent à bord, vous devez vous préparer à combattre …;;;;;;;;;;;;x
EVTOPTAwikid.301;Defend the ship!;Défendez le bateau !;;;;;;;;;;;;x
TOOLTIPwikid.301_survive;You repel the attack and are unharmed.;Vous repoussez l'attaque et vous êtes indemne.;;;;;;;;;;;;x
TOOLTIPwikid.301_wounded;You repel the attack but take a wound.;Vous repoussez l'attaque mais vous êtes blessé.;;;;;;;;;;;;x
EVTDESCAwikid.302;You manage to repel the attacking pirates with great ease. They did not expect you to be so well defended and must have thought you to be some petty trade ship.;Vous repoussez l'attaque des pirates facilement, ils ne devaient pas s'attendre à une telle défense, ils devaient penser qu'il devait s'agir d'un bateau marchand.;;;;;;;;;;;;x
EVTDESCBwikid.302;You manage to repel the attacking pirates but in the fight you take a wound. In the end you are still the victor as your wound may hea,l but they are not going to be coming back to life any time soon.;Vous repoussez l'attaque des pirates mais dans la bagarre vous recevez une blessure. Au final vous être quand même victorieux et la blessure va guérir et eux n'y reviendront pas de sitôt.;;;;;;;;;;;;x
EVTOPTAwikid.302;They learned their lesson the hard way;Ils ont appris durement la leçon;;;;;;;;;;;;x
EVTOPTBwikid.302;The bastards got me;Ces bâtards m'ont eu;;;;;;;;;;;;x
EVTDESCwikid.303;After many days at the sea and on your [Root.GetShipName], you have finally arrived at [tour_destination.GetName]. You are very excited and cannot wait to explore these new lands and the [tour_destination.Culture.GetName] culture!;Après bien des jours en mer, vous êtes finalement arrivés à [tour_destination.GetName]. Vous êtes très excité et vous ne pouvez pas attendre pour explorer ces nouvelles terres et la culture [tour_destination.Culture.GetName]  !;;;;;;;;;;;;x
EVTOPTAwikid.303;[tour_destination.Holder.GetTitledFirstName] [tour_destination.Holder.GetOnlyDynastyName] shall be informed of your arrival;[tour_destination.Holder.GetTitledFirstName] [tour_destination.Holder.GetOnlyDynastyName] sera informé de votre arrivée;;;;;;;;;;;;x
EVTDESCwikid.304;[From.GetTitledFirstName] [From.GetOnlyDynastyName] has arrived at the port;[From.GetTitledFirstName] [From.GetOnlyDynastyName] est arrivé au port;;;;;;;;;;;;x
EVTOPTAwikid.304;May they enjoy their tour;Puissiez-vous profiter de votre voyage;;;;;;;;;;;;x
EVTOPTBwikid.306;I am in need of a wife, a [tour_destination.Culture.GetName] woman would be most wonderful;J'ai besoin d'une épouse, une femme [tour_destination.Culture.GetName] serait parfaite;;;;;;;;;;;;x
EVTOPTCwikid.306;I am in need of a husband, a [tour_destination.Culture.GetName] man would be most wonderful;J'ai besoin d'un mari, un homme [tour_destination.Culture.GetName] serait parfait;;;;;;;;;;;;x
EVTDESCAwikid.306;The smell of salt water fills your nose and the waters of the sea spill around the deck of your [Root.GetShipName] as you finally pull into the harbor at [tour_destination.GetName]. The docks are busy as ships from all over the world congregate here. Traders and fishermen are all in a hurry as they pass through the River Gate, one of seven entrances to the city that stand on all majors roads of the realm. You pass through it and decide to take a small detour to the street of steel and past Visenya's Hill and over to the main plaza. You take a good look at the Sept of Baelor and can’t help but be impressed at the enormous size and scope of the capital city of House Targaryen. You take one distant look at the dragonpit before turning down towards the Red Keep, after all it wouldn’t do to miss a meeting with [tour_destination_owner.GetTitledFirstNameNoRegnal]!;L'odeur de l'eau salée remplit votre nez et les eaux de la mer déversent autour du pont de votre bateau que vous commencez enfin à entrer dans le port à [tour_destination.GetName]. Les docks sont occupés par des navires de partout dans le monde qui se rassemblent ici. Les commerçants et les pêcheurs en toute hâte passent par la Porte de la rivière, une des sept entrées de la ville qui se trouvent sur toutes les grandes routes du royaume. Vous traversez et décidez de prendre un petit détour vers la rue d'acier et vous passez par la colline de Visenya et ensuite par la place principale. Vous jetez un coup d'oeil au Septuaire de Baelor et vous ne pouvez vous empêcher d'être impressionné par l'énorme taille et l'étendue de la capitale de la maison Targaryen. Vous voyez au loin Fossedragon avant de tourner vers le Donjon Rouge, après tout ça ne se fait pas de manquer une réunion avec le Seigneur des Sept Royaumes !;;;;;;;;;;;;x
EVTDESCBwikid.306;You have sailed your [Root.GetShipName] across the Narrow Sea to [tour_destination.GetName], the black and awe-inspring castle. It is unique, with nothing quite like it in Westeros or Essos. The ancient seat of House Targaryen shows its lineage with a number of stone dragons and other beasts decorating the castle. You heard some of the sailors tell of it being haunted and that it was stuff of nightmares. You think to yourself it's amazing that at one point this small rock was the frontier of the Valyrian Freehold. As you approach the gate you see the sigil of house [tour_destination_owner.GetOnlyDynastyName] flying from the Stone Drum, and when you enter the Great Hall through the Dragons Mouth and [tour_destination_owner.GetTitledFirstNameNoRegnal] welcomes you. [tour_destination_owner.GetSheHeCap] tells you of the castles history and shows you the Painted Table where Aegon the Conqueror planned his invasion of Westeros. Soon you feel at ease in the isle of stone dragons.;Vous êtes jeté à travers le navire, la mer est une maîtresse cruelle et [Root.Religion.GetHighGodName] ne vous favorise pas. Pourtant, vous parvenez à survivre à traverser le Détroit. Le château est un monstre noir et impressionnant. Il est unique et vous n'avez jamais vu quelque chose comme ça à Westeros ou Essos. L'ancien siège de la maison Targaryen montre ses remparts avec nombre de dragons de pierre et d'autres gargouilles aux traits de basilics ou de vouivres. Vous avez entendu certains marins dirent qu'il était hanté et que c'était un truc à vous donner des cauchemars. Vous pensez vous-même que c'est étonnant qu'à un moment donné ce petit rocher près de la Néra était l'extrémité ouest de l'empire de Valyria. Les dernières traces de l'empire et de ses seigneurs dragon ont survécu ici avec leurs dragons. Vous voyez le symbole de la maison [tour_destination_owner.GetOnlyDynastyName] au sommet du donjon. Vous entrez dans la Grande Salle et [tour_destination_owner.GetTitledFirstNameNoRegnal] vous souhaite la bienvenue. [Tour_destination_owner.GetSheHeCap] vous raconte l'histoire des châteaux et vous montre la table peinte où Aegon le Conquérant a planifié son invasion de Westeros. Bientôt vous vous sentez à l'aise dans l'île des dragons de pierre.;;;;;;;;;;;;x
