#CODE;ENGLISH;FRENCH;GERMAN;;SPANISH;;;;;;;;;x
TOOLTIPmega_wars.79LIEGEREBEL;[This.GetTitle] [This.GetFirstName] shall be ordered to surrender all lands and titles to the crown and be executed, as well as a hostage taken from House [This.GetOnlyDynastyName]\nAs [This.GetSheHe] is currently not your prisoner [This.GetSheHe] will likely rebel, or possibly flee\nIf successful, this will likely §Yanger§! [This.GetHerHis] former loyal §Ybannermen§!\n;[This.GetTitle] [This.GetFirstName] se verra ordonner de livrer toutes ses terres et titres à la couronne et sera exécuté(e). Un otage sera également demandé à la Maison [This.GetOnlyDynastyName]\nComme [From.GetSheHe] n'est pas actuellement notre prisonnier(ère) et [From.GetSheHe] pourrait se rebeller ou s'enfuir\nSi l'accord venait à être accepté, cela mettra §Ymettre en colère§ ! ses anciens et loyaux §Ybannerets§ !\n;;;Se ordenará a [This.GetTitle] [This.GetFirstName] entregar todas las tierras y títulos a la Corona y será ejecutado, también entregará un rehén de la casa [This.GetOnlyDynastyName]\nActualmente no es tu prisionero y quizás se rebele o huya\nSi tienes éxito, esto §Yenfadará§! a sus antiguos leales §Yvasallos§!\n;;;;;;;;;x
TOOLTIPmega_wars.79NONLIEGEREBEL;[This.GetTitle] [This.GetFirstName] shall be ordered to surrender all lands and titles to [This.Liege.GetTitle] [This.Liege.GetFirstName] [This.Liege.GetOnlyDynastyName] and be executed, as well as a hostage taken from House [This.GetOnlyDynastyName]\nAs [This.GetSheHe] is currently not your prisoner [This.GetSheHe] will likely rebel, or possibly flee\nIf successful, this will likely §Yanger§! [This.GetHerHis] former loyal §Ybannermen§!\n;[This.GetTitle] [This.GetFirstName] se verra ordonner de livrer tous ses terres et titres à [This.Liege.GetTitle] [This.Liege.GetFirstName] [This.Liege.GetOnlyDynastyName] et sera exécuté(e). Un otage sera également demandé à la Maison [This.GetOnlyDynastyName]\nn'est pas actuellement notre prisonnier(ère) [From.GetSheHe] pourrait se rebeller ou s'enfuir\nSi l'accord venait à être accepté, cela mettra §Ymettre en colère§ ! ses anciens et loyaux §Ybannerets§ !\n;;;Se ordenará a [This.GetTitle] [This.GetFirstName] entregar todas las tierras y títulos a [This.Liege.GetTitle] [This.Liege.GetFirstName] [This.Liege.GetOnlyDynastyName] será ejecutado, también entregará un rehén de la casa [This.GetOnlyDynastyName]\nActualmente no es tu prisionero y quizás se rebele o huya\nSi tienes éxito, esto §Yenfadará§! a sus antiguos leales §Yvasallos§!\n;;;;;;;;;x
EVTDESCmega_wars.76;[Root.GetFirstName] [Root.GetOnlyDynastyName], The [From.GetTitle] has decided to be merciful despite your treasonous actions. You shall be allowed to return to your lands unmolested and be pledged to uphold the [From.GetTitle]'s peace forthwith. As a guarantee to this pledge, a hostage from your family shall be taken.\n\nThis is the judgement of [From.GetFirstName] of the House [From.GetOnlyDynastyName], the [From.GetRegnalOrdinal] of [From.GetHerHis] name, [From.GetTitle] of [From.PrimaryTitle.GetName] and Lord of [From.Capital.GetName], Protector of the Realm;[Root.GetFirstName] [Root.GetOnlyDynastyName], le(a) [From.GetTitle] a décidé de se montrer miséricordieux(euse) malgré notre trahison. Vous serez autorisé(e) à retourner sur vos terres sans qu'aucun mal ne vous soit fait et devrez vous engager à maintenir la paix du(e la) [From.GetTitle]. Pour garantir cet engagement, un otage de votre famille vous sera demandé.\n\ntel est le verdict de [From.GetTitledFirstName] de la maison [From.GetOnlyDynastyName] [From.GetRegnalOrdinal] du nom, [From.GetTitle] de [From.PrimaryTitle.GetName] et seigneur de [From.Capital.GetName], Protecteur du Royaume;;;;;;;;;;;;x
EVTOPTAmega_wars.76;That is merciful;Voilà qui est miséricordieux;;;Eso es misericordioso;;;;;;;;;x
NOSUITABLEHOSTAGE;As you have no suitable relatives to be hostages you shall be kept as a prisoner;Puisque que vous n'avez pas de parents pouvant être otage, vous serez gardé(e) prisonnier(ère);;;Como no tienes parientes que puedan hacer de rehén, te mantendrán prisionero.;;;;;;;;;x
EVTDESCmega_wars.77;[Root.GetFirstName] [Root.GetOnlyDynastyName], The [From.GetTitle] has decreed that you shall be incarcerated in the dungeon as punishment for your treason, and will not be released until [From.GetSheHe] sees fit.\n\nThis is the judgement of [From.GetFirstName] of the House [From.GetOnlyDynastyName], the [From.GetRegnalOrdinal] of [From.GetHerHis] name, [From.GetTitle] of [From.PrimaryTitle.GetName] and Lord of [From.Capital.GetName], Protector of the Realm;[Root.GetFirstName] [Root.GetOnlyDynastyName], le(a) [From.GetTitle] a décidé que vous serez incarcéré dans un cachot  et vous ne serez pas libéré jusqu'à ce [From.GetSheHe] le juge utile.\n\nTel est le verdict de [From.GetTitledFirstName] de la maison [From.GetOnlyDynastyName] [From.GetRegnalOrdinal] du nom, [From.GetTitle] de [From.PrimaryTitle.GetName] et seigneur de [From.Capital.GetName], Protecteur du Royaume;;;;;;;;;;;;x
EVTOPTAmega_wars.77;A damning judgement;Un satané jugement;;;;;;;;;;;;x
EVTDESCmega_wars.78;[Root.GetFirstName] [Root.GetOnlyDynastyName], The [From.GetTitle] has decreed that as you cannot to be trusted to keep the [From.GetTitle]'s peace you shall forfeit [Root.PrimaryTitle.GetName]. You shall also be put into the [From.GetTitle]'s custody whilst [From.GetHerHis] Grace decides if further action is required.\n\nThis is the judgement of [From.GetFirstName] of the House [From.GetOnlyDynastyName], the [From.GetRegnalOrdinal] of [From.GetHerHis] name, [From.GetTitle] of [From.PrimaryTitle.GetName] and Lord of [From.Capital.GetName], Protector of the Realm;[Root.GetFirstName] [Root.GetOnlyDynastyName], le [From.GetTitle] a jugé que vous n'étiez pas digne de confiance et ne pouviez maintenir la paix du(e la) [From.GetTitle], par conséquent vous devrez renoncer à [Root.PrimaryTitle.GetName]. De plus, vous serez remi à la garde de [From.getTitle] jusqu'à ce que sa Grâce décide de votre futur.\n\nTel est le verdict de [From.GetTitledFirstName], [From.GetTitle] des Andals, du Rhoynar et des Premiers Hommes, Seigneur des Sept Couronnes et Protecteur du Royaume;;;;;;;;;;;;x
EVTOPTAmega_wars.78;At least House [Root.GetOnlyDynastyName] shall survive;Au moins la Maison [Root.GetOnlyDynastyName] survivra;;;;;;;;;;;;x
EVTDESCmega_wars.79;[Root.GetFirstName] [Root.GetOnlyDynastyName], The [From.GetTitle] has decided treason cannot go unpunished and that the only just course of action is the forfeiture of all your lands and titles as well as your beheading. Additionally a hostage from your family shall be taken as a gurantee of their future good behaviour.\n\nThis is the judgement of [From.GetFirstName] of the House [From.GetOnlyDynastyName], the [From.GetRegnalOrdinal] of [From.GetHerHis] name, [From.GetTitle] of [From.PrimaryTitle.GetName] and Lord of [From.Capital.GetName], Protector of the Realm;[Root.GetFirstName] [Root.GetOnlyDynastyName], le(a) [From.GetTitle] a décidé que votre trahison ne peut pas rester impunie et que la seule solution est de vous confisquer vos titres et vos terres ainsi que de vous décapiter. Pour garantir leur comportement à l'avenir, un otage sera prit dans votre famille.\n\nTel est le verdict de [From.GetTitledFirstName] de la maison [From.GetOnlyDynastyName] [From.GetRegnalOrdinal] du nom, [From.GetTitle] de [From.PrimaryTitle.GetName] et seigneur de [From.Capital.GetName], Protecteur du Royaume;;;;;;;;;;;;x
EVTOPTAmega_wars.79;House [Root.GetOnlyDynastyName] shall rise again;La Maison [Root.GetOnlyDynastyName] s'en relèvera tout de même;;;La Casa [Root.GetOnlyDynastyName] resurgirá de nuevo;;;;;;;;;x
opinion_usurped_my_liege;Usurped my Liege Lord;A usurpé mon suzerain;;;Ha usurpado a mi Señor;;;;;;;;;x
opinion_wiped_out_my_liege;Wiped out my Liege Lord;S'est débarrassé de mon suzerain;;;Ha aniquilado a mi Señor;;;;;;;;;x
opinion_wiped_out_my_family;Wiped out my Family;A anéanti ma famille;;;Ha aniquilado a mi familia;;;;;;;;;x
TOOLTIPmega_wars.75;will decide your fate;va décider de votre destin;;;decidirá tu destino;;;;;;;;;x
TOOLTIPVASSALTYRANYKING;Your §YLords Paramount§! will view this as tyrannical and relations with them will decrease by §Y20§!\n;Vos §Ylords Suzerain§ ! vont considérer ceci comme un acte tyrannique et vos relations avec eux vont baisser de §Y20§ !\n;;;Tus §YSeñores Supremos§! considerarán esto como un acto tiránico, y tus relaciones con ellos bajarán §Y20§ !\n;;;;;;;;;x
TOOLTIPVASSALTYRANYDUKE;Your §YHigh Lords§! will view this as tyrannical and relations with them will decrease by §Y10§!\n;Vos §Ygrands Lords§ ! vont considérer ceci comme un acte tyrannique et vos relations avec eux vont baisser de §Y10§ !\n;;;Tus §YGrandes Señores§! considerarán esto como un acto tiránico, y tus relaciones con ellos bajarán §Y10§ !\n;;;;;;;;;x
EVTOPTCmega_wars.79;Outrageous! I will die before I surrender!;C'est inacceptable ! Plutôt la mort que la reddition !;;;Es inaceptable! Prefiero la muerte antes que rendirme!;;;;;;;;;x
EVTOPTBmega_wars.79;I must try and flee;Je dois tenter de m'enfuir;;;Debo tratar de huir;;;;;;;;;x
TOOLTIPmega_wars.79RUNAWAY;You will attempt to flee from your execution;Vous allez tenter de vous échapper avant votre exécution;;;Tratarás de escapar antes de la ejecución;;;;;;;;;x
EVTDESCmega_wars.81;Me and my family have managed to evade capture;Moi et ma famille sommes parvenus à échapper à la capture;;;Mi familia y yo hemos conseguido escapar de la captura;;;;;;;;;x
EVTOPTAmega_wars.81;To the Free Cities;Vers les Cités Libres;;;Hacia las Ciudades Libres;;;;;;;;;x
EVTOPTBmega_wars.81;To the Golden Company;Rejoindre la Compagnie Dorée;;;Unirse a la Compañía Dorada;;;;;;;;;x
EVTOPTCmega_wars.81;To a new Kingdom;Vers un nouveau Royaume;;;Hacia un nuevo Reino;;;;;;;;;x
EVTDESCmega_wars.82;I have failed to evade capture, and will now be executed...;J'ai échoué dans ma tentative d'échapper à la capture, et je vais maintenant être exécuté(e)…;;;He fracasado en mi intento de escapar y ahora seré ejecutado...;;;;;;;;;x
EVTOPTAmega_wars.82;Oh dear;Quel malheur;;;Una lástima;;;;;;;;;x
EVTDESCmega_wars.83;[Root.PrimaryTitle.GetFOA], [FromFrom.GetFirstName] [FromFrom.GetOnlyDynastyName] has managed to evade capture and hence has avoided your just judgement, [FromFrom.GetSheHe] is beyond our reach now.;[Root.PrimaryTitle.GetFOA], [FromFrom.GetFirstName] [FromFrom.GetOnlyDynastyName] est parvenu(e) à échapper à la capture et s'est ainsi soustrait(e) à votre juste jugement, [FromFrom.GetSheHe] est désormais hors de votre portée. ;;;[Root.PrimaryTitle.GetFOA], [FromFrom.GetFirstName] [FromFrom.GetOnlyDynastyName] ha conseguido escapar a la captura y ha evitado someterse a tu juicio justo, ahora está fuera de tu alcance.;;;;;;;;;x
EVTOPTAmega_wars.83;Lackwits, how hard is it to arrest someone!;Bande d'incompétents, en quoi est-ce dur d'arrêter quelqu'un ?;;;Banda de incompetentes, tan difícil es arrestar a alguien?;;;;;;;;;x
EVTDESCmega_wars.830;[Root.PrimaryTitle.GetFOA], rather than face your judgement with dignity and honour, [FromFrom.GetFirstName] [FromFrom.GetOnlyDynastyName] tried to flee the realm. We captured [FromFrom.GetHerHim] however, and now will face the block...;[Root.PrimaryTitle.GetFOA], plutôt que de faire face avec dignité et honneur à votre jugement, [FromFrom.GetFirstName] [FromFrom.GetOnlyDynastyName] a tenté de fuir le royaume. Nous l'avons cependant capturé(e) et il(elle) devra se soumettre à votre justice…;;;[Root.PrimaryTitle.GetFOA],en vez de afrontar el juicio con dignidad y honor, [FromFrom.GetFirstName] [FromFrom.GetOnlyDynastyName] intentó escapar del Reino. Conseguimos capturarlo, y se someterá a vuestra justicia.;;;;;;;;;x
EVTOPTAmega_wars.830;Justice will be done;Justice sera faite;;;Se hará justicia;;;;;;;;;x
EVTDESCmega_wars.84;[Root.GetFirstName] [Root.GetOnlyDynastyName], I find your judgement harsh, and as such my bannermen and I no longer acknowledge your dominion over [From.PrimaryTitle.GetName], this is a declaration of war!\n\n Regards,\n[From.GetFirstName] [From.GetOnlyDynastyName];[Root.GetFirstName] [Root.GetOnlyDynastyName], je trouve votre jugement bien trop dur, aussi moi et mes bannerets ne reconnaissons plus votre autorité sur [From.PrimaryTitle.GetName], c'est une déclaration de guerre !\n\n Cordialement,\n[From.GetFirstName] [From.GetOnlyDynastyName];;;[Root.GetFirstName] [Root.GetOnlyDynastyName], encuestro vuestra sentencia demasiado dura, por ello yo y mis vasallos no reconocemos más vuestra autoridad sobre [From.PrimaryTitle.GetName],es una declaración de guerra!\n\n Cordialmente,\n[From.GetFirstName] [From.GetOnlyDynastyName];;;;;;;;;x
EVTOPTAmega_wars.84;I will crush [From.GetHerHim] as well;Je vais également l'écraser;;;Los aplastaré también;;;;;;;;;x
TOOLTTIPmega_wars.76KG;[This.GetTitle] [This.GetFirstName] shall be reprimanded\n;[This.GetTitle] [This.GetFirstName] sera puni(e)\n;;;[This.GetTitle] [This.GetFirstName] será castigado\n;;;;;;;;;x
EVTOPTEmega_wars.75;[FromFrom.GetSheHeCap] is not fit to serve in the Kingsguard;[FromFrom.GetSheHeCap] n'est pas apte pour servir dans la Garde Royale;;;[FromFrom.GetSheHeCap] no es apto para servir en la Guardia Real;;;;;;;;;x
EVTOPTFmega_wars.75;I shall remove him from his position as High Septon;Je vais le(la) démettre de ses fonctions de Grand Septon;;;Lo relevaré de su cargo de Septón Supremo;;;;;;;;;x
TOOLTIPmega_wars.78HS;[This.GetBestName] shall be removed from office and a new High Septon shall be chosen\n;[This.GetBestName] sera démis de ses fonctions et un nouveau Grand Septon sera choisi\n;;;[This.GetBestName] será destituido y un nuevo Septón Supremo será elegido\n;;;;;;;;;x
TOOLTIPmega_wars.78HSREBEL;[This.GetBestName] shall be ordered to step down and a new High Septon shall be chosen\nAs he is not your prisoner he may rebel\n;[This.GetBestName] sera sommé de renoncer à sa fonction et un nouveau Grand Septon sera choisi\nComme il n'est pas votre prisonnier, il peut se rebeller\n;;;[This.GetBestName] será conminado a renunciar a su cargo y un nuevo Septón Supremo será elegido\nActualmente no es tu prisionero y quizás se rebele\n;;;;;;;;;x
EVTOPTGmega_wars.75;Bring me [From.GetHerHis] head!;Amenez-moi sa tête ! ;;;Traedme su cabeza!;;;;;;;;;x
TOOLTIPmega_wars.79HSKG;[This.GetBestName] shall be removed from office and will then be executed\n;[This.GetBestName] sera démis(e) de sa fonction et exécuté(e)\n;;;[This.GetBestName] será destituido de su cargo y ejecutado\n;;;;;;;;;x
TOOLTIPmega_wars.79HSKGREBEL;[This.GetBestName] shall be ordered to step down and will then be executed\nAs he is not your prisoner he may rebel or possibly flee\n;[This.GetBestName] sera sommé(e) de renoncer à sa fonction et exécuté(e)\nComme il(elle) n'est pas votre prisonnier, il(elle) peut se rebeller ou s'enfuir\n;;;[This.GetBestName] será conminado a renunciar a su cargo y ejecutado\nActualmente no es tu prisionero y quizás se rebele\n;;;;;;;;;x
EVTDESCmega_wars.85;[Root.GetFirstName] [Root.GetOnlyDynastyName], The [From.GetTitle] has decided to be merciful despite your treasonous actions. You shall be be pledged to better uphold the honour of your office and to keep the [From.GetTitle]'s peace forthwith\n\nThis is the judgement of [From.GetFirstName] of the House [From.GetOnlyDynastyName], the [From.GetRegnalOrdinal] of [From.GetHerHis] name, [From.GetTitle] of [From.PrimaryTitle.GetName] and Lord of [From.Capital.GetName], Protector of the Realm;[Root.GetFirstName] [Root.GetOnlyDynastyName], le [From.GetTitle] a décidé d'être miséricordieux malgré vos actes de trahisons. Vous devrez vous engager à mieux exercer votre office et à préserver la paix du(e la) [From.GetTitle]\n\nTel est le verdict de [From.GetTitledFirstName] de la maison [From.GetOnlyDynastyName] [From.GetRegnalOrdinal] du nom, [From.GetTitle] de [From.PrimaryTitle.GetName] et seigneur de [From.Capital.GetName], Protecteur du Royaume;;;;;;;;;;;;x
EVTOPTD999900937;I prefer this rebel;Je préfère ce rebelle;;;Prefiero a este rebelde;;;;;;;;;x
opinion_traitor_AGOT;Traitor;Traître;;;Traidor;;;;;;;;;x
EVTOPTAMEGAWARIDONTCARE;Don't bother me with the dealings of small lords;Ne me dérangez pas pour les affaires de quelques petits lords;;;No me molestes más con las desavenencias de los pequeños señores.;;;;;;;;;x
indep_war;Independence War;Guerre d'indépendance;;;Guerra de Independencia;;;;;;;;;x
indep_faction_won;Independence Faction Won;Victoire de la Faction Indépendantiste;;;Victoria de la facción Independentista;;;;;;;;;x
EVTDESCmega_wars.43;The Realm is embroiled in war, thank [Root.Religion.GetRandomGodName] we are no longer subject to their whims!;Le royaume est impliqué dans une guerre, [Root.Religion.GetRandomGodName] soit(ent) loué(s), nous ne sommes plus soumis à ses caprices !;;;El Reino está involucrado en una guerra, [Root.Religion.GetRandomGodName] sea alabado, ya no estamos sujetos a sus caprichos!;;;;;;;;;x
EVTOPTAmega_wars.43;We shall forge our own path!;Nous forgerons notre propre destin !;;;Forjaremos nuestro propio camino;;;;;;;;;x
EVTDESCmega_wars.19;The realm is in a state of war, [FromFrom.PrimaryTitle.GetName] is in embroiled in a great conflict. As a loyalist to the crown we are honour bound to fight for [From.GetTitle] [From.GetFirstName].;La guerre déchire le royaume, [FromFrom.PrimaryTitle.GetName] est impliqué dans un grand conflit. En tant que loyaliste fidèle à la couronne c'est un honneur de nous battre pour le [From.GetTitle] [From.GetFirstName].;;;El reino está en guerra, [FromFrom.PrimaryTitle.GetName] está involucrado en una gran guerra. Como leal fiel a la Corona es un honor batirnos por el [From.GetTitle] [From.GetFirstName].;;;;;;;;;x
EVTOPTAmega_wars.19;It is my duty to defend the realm;Défendre le royaume est mon devoir.;;;Defender el Reino es mi deber.;;;;;;;;;x
EVTDESCmega_wars.20;The realm is in a state of war, [FromFrom.PrimaryTitle.GetName] is in embroiled in a great conflict. I have commited my loyalty to my liege lord [Root.Liege.GetFirstName] [Root.Liege.GetOnlyDynastyName], and so am honour bound to follow [Root.Liege.GetHerHim].;La guerre déchire le royaume, [FromFrom.PrimaryTitle.GetName] est impliqué dans un grand conflit. J'ai confirmé ma loyauté envers mon suzerain [Root.GetFirstName] [Root.Liege.GetOnlyDynastyName], et je suis fier(e) de le(a) suivre.;;;El reino está en guerra, [FromFrom.PrimaryTitle.GetName] está involucrado en una gran guerra. Soy leal a mi Señor [Root.GetFirstName] [Root.Liege.GetOnlyDynastyName], y mi honor me obliga a seguirle.;;;;;;;;;x
EVTOPTAmega_wars.20;We shall prevail!;Nous prévaudrons !;;;Prevaleceremos;;;;;;;;;x
EVTDESC999900967;The Iron Throne has been lost, and the new [Root.Liege.GetTitle] now demands dominion over the Crownlands as a condition of our defeat.;Le Trône de Fer est perdu. Le(a) nouveau(elle) [Root.Liege.GetTitle] exige désormais que nous lui cédions notre suzeraineté sur les Terres de la Couronne comme marque de notre défaite. ;;;El Trono de Hierro está perdido. El nuevo [Root.Liege.GetTitle] exige que le cedamos las Tierras de la Corona como condición de nuestra derrota.;;;;;;;;;x
EVTOPTA999900967;I will have vengeance;Je me vengerai !;;;Me vengaré;;;;;;;;;x
TOOLTIPmaintenance.38;All your bannermen in the Crownlands shall henceforth swear fealty to [Root.Liege.GetTitle] [Root.Liege.GetFirstName];Tous vos bannerets des Terres de la Couronne jureront désormais fidélité à [Root.Liege.GetTitle] [Root.Liege.GetFirstName];;;Todos tus vasallos de las Tierras de la Corona juran lealtad a [Root.Liege.GetTitle] [Root.Liege.GetFirstName];;;;;;;;;x
EVTDESCmaintenance.38;I have managed to gain the Iron Throne that is mine by right, but the deposed [From.GetFirstName] [From.GetOnlyDynastyName] still holds dominion over the Crownlands. This should be rectified.;Je suis parvenu à m'emparer du Trône de Fer qui est mien de droit, mais [From.GetFirstName] [From.GetOnlyDynastyName] est toujours le(a) suzerain(e) des Terres de la Couronne. Cette situation doit prendre fin. ;;;Conseguí tomar El Trono de Hierro que ahora es mío por derecho pero el depuesto [From.GetFirstName] [From.GetOnlyDynastyName] todavía domina las Tierras de la Corona. Esta situación va a cambiar.;;;;;;;;;x
EVTOPTAmaintenance.38;I am their rightful liege;Je suis leur suzerain légitime;;;Soy el Señor legítimo;;;;;;;;;x
rebel_leader;Rebel Leader;Chef Rebelle;;;Jefe Rebelde;;;;;;;;;x
rebel_leader_desc;This character has been the leader of a rebellion against the realm;Ce personnage est le chef d'une rébellion contre le Trône de Fer;;;Este personaje es el jefe de una rebelión contra el Trono de Hierro;;;;;;;;;x
new_rebel_leader;Rallying Support;Ralliement de soutien;;;Reuniendo apoyos;;;;;;;;;x
EVTDESCmega_wars.86;After defeating [FromFrom.GetFirstName] [FromFrom.GetOnlyDynastyName], [From.GetFirstName] [From.GetOnlyDynastyName] is now in a postition of great power. Now I must suffer [From.GetHerHis] judgement...;Après avoir usurpé le titre de [FromFrom.GetFirstName] [FromFrom.GetOnlyDynastyName], [From.GetFirstName] [From.GetOnlyDynastyName] est parvenu(e) à s'asseoir sur le Trône de Fer en tant que nouveau(elle) [From.GetTitle]. Je me tiens désormais devant [From.GetHerHim] pour entendre son jugement... ;;;Tras derrotar a [FromFrom.GetFirstName] [FromFrom.GetOnlyDynastyName], [From.GetFirstName] [From.GetOnlyDynastyName] está en una posición de gran poder. Ahora me encuentro delante de él para escuchar su sentencia... ;;;;;;;;;x
EVTOPTAmega_wars.86;Let us hope [From.GetSheHe] is merciful;Espérons qu'[From.GetSheHe] soit miséricordieux(euse);;;Esperemos que sea misericordioso.;;;;;;;;;x
EVTDESCmega_wars.87;The war has been won, our enemy's armies have been crushed and the loyalist forces have been defeated. [From.GetTitle] [From.GetFirstName] [From.GetOnlyDynastyName], one your opponents, as been brought before you to hear your judgement...;La guerre est gagnée, les armées de nos ennemis ont été écrasées et les soutiens du Trône de Fer ont été défaits. [From.GetTitle] [From.GetFirstName] [From.GetOnlyDynastyName], l'un de vos opposants, a été amené devant vous pour entendre votre jugement... ;;;Ganamos la guerra, los ejércitos lealistas enemigos fueron aplastados y el Trono de Hierro derrotado. [From.GetTitle] [From.GetFirstName] [From.GetOnlyDynastyName], uno de tus oponentes, ha sido traído ante tí para escuchar su sentencia... ;;;;;;;;;x
EVTOPTAmega_wars.87;I shall judge [From.GetHerHis] family justly;Je jugerai sa famille avec équité;;;Juzgaré a su familia con equidad;;;;;;;;;x
TOOLTIPmega_wars.88;[This.GetFirstName] [This.GetOnlyDynastyName] shall be brought before you to hear your judgement;sera amené devant vous pour entendre votre jugement;;;será llevado ante ti para escuchar su sentencia;;;;;;;;;x
EVTOPTBmega_wars.87;I want all their heads on pikes!;Je veux voir leur tête sur des piques !;;;Quiero ver todas sus cabezas en picas!;;;;;;;;;x
TOOLTIPmega_wars.93;[This.GetFirstName] [This.GetOnlyDynastyName] shall be executed;sera exécuté;;;será ejecutado;;;;;;;;;x
999900967WARNING;§RWarning:§! You will accrue §Rtyranny§! for each person you execute without just cause\n;§RAttention:§! Vous allez augmenter votre §Rtyrannie§! pour chaque personne que vous faites exécuter sans raison\n;;;§RAtención:§! aumentará tu §Rtiranía§! por cada persona que ejecutes sin razón\n;;;;;;;;;x
TOOLTIPmega_wars.78TYRANNY;This will be seen as a §Rtyrannical§! action;Ce sera perçu comme une action §Rtyrannique§ ! ;;;Será visto como una acción §Rtiránica§! ;;;;;;;;;x
EVTDESCmega_wars.88;[From.GetTitle] [From.GetFirstName] has decided that you and your family shall be judged individually on your merits and actions.;Sa Grâce [From.GetTitle] [From.GetFirstName] a décidé que vous et votre famille devrez être jugés individuellement sur vos mérites et vos actions.;;;[From.GetTitle] [From.GetFirstName] ha decidido que tu y tu familia seáis juzgados individualmente por sus acciones.;;;;;;;;;x
EVTOPTAmega_wars.88;I pray for mercy;Je prie qu'elle fasse preuve de miséricorde ;;;Ruego por que sea misericordioso;;;;;;;;;x
EVTDESCmega_wars.89;[From.GetFirstName] of the defeated royal [From.GetOnlyDynastyName] family has been brought before you. What is to be done with [From.GetHerHim]?;[From.GetFirstName] de la famille royale [From.GetOnlyDynastyName] qui a été défaite, est amené(e) devant vous. Que doit-il être fait de cette personne ?;;;[From.GetFirstName] de la familia real [From.GetOnlyDynastyName] que ha sido vencido, es llevado ante tí. Qué debemos hacer con él?;;;;;;;;;x
EVTOPTAmega_wars.89;Release [From.GetHerHim], [From.GetSheHe] has done nothing wrong.;Relâchez-le(a), [From.GetSheHe] n'a rien fait de mal.;;;Liberadlo, no ha hecho nada malo.;;;;;;;;;x
EVTOPTBmega_wars.89;Throw [From.GetHerHim] in the dungeon!;Jetez le(a) au cachot !;;;Llevadlo a las mazmorras!;;;;;;;;;x
EVTOPTCmega_wars.89;I shall take [From.GetHerHim] as a hostage;Je vais le(a) garder en tant qu'otage.;;;Me lo quedaré como rehén.;;;;;;;;;x
EVTOPTDmega_wars.89;I shall have [From.GetHerHis] head!;Je vais lui couper la tête !;;;Cortadle la cabeza!;;;;;;;;;x
TOOLTIPmega_wars.93;shall be executed;sera exécuté(e);;;será ejecutado;;;;;;;;;x
