#CODE;ENGLISH;FRENCH;GERMAN;;SPANISH;;;;;;;;;x
TOOLTIPcreate_e_westerlands;The title Lord Paramount of The Westerlands will become defunct and the Rock will become dejure independent\n;Le titre de Lord Suzerain des Terres de l'Ouest va disparaître et le Roc va être indépendant de jure\n;;;El título de Señor Supremo de Las Tierras del Oeste desaparecerá y La Roca será independiente de jure.\n;;;;;;;;;x
TOOLTIPcreate_e_reach;The title Lord Paramount of The Reach will become defunct and the Reach will become dejure independent\n;Le titre de Lord Suzerain du Bief va disparaître et le Bief va être indépendant de jure\n;;;El título de Señor Supremo de El Dominio desaparecerá y El Dominio será independiente de jure.\n;;;;;;;;;x
TOOLTIPcreate_e_stormlands;The title Lord Paramount of The Stormlands will become defunct and the Stormlands will become dejure independent\n;Le titre de Lord Suzerain des Terres de l'Orage va disparaître et les Terres de l'Orage vont être indépendantes de jure\n;;;El título de Señor Supremo de Las Tierras de la Tormenta desaparecerá y La Tormenta será independiente de jure.\n;;;;;;;;;x
TOOLTIPcreate_e_dorne;The title Lord Paramount of Dorne will become defunct and Dorne will become dejure independent\n;Le titre de Lord Suzerain de Dorne va disparaître et Dorne va être indépendant de jure\n;;;El título de Señor Supremo de Dorne desaparecerá y Dorne será independiente de jure.\n;;;;;;;;;x
TOOLTIPcreate_e_iron_isles;The title Lord Paramount of The Iron Islands will become defunct and the Iron Islands will become dejure independent\n;Le titre de Lord Suzerain des Iles de Fer va disparaître et les Iles de Fer vont être indépendantes de jure\n;;;El título de Señor Supremo de Las Islas del Hierro desaparecerá y Las Islas del Hierro serán independientes de jure.\n;;;;;;;;;x
TOOLTIPbid_for_indep_fail;[Root.GetFirstName] [Root.GetOnlyDynastyName] will lose their crown and be named Lord Paramount of [This.GetName], becoming dejure part of [From.PrimaryTitle.GetName]\n;[Root.GetFirstName] [Root.GetOnlyDynastyName] va perdre sa couronne et va devenir Lord Suzerain de [This.GetName], devenant de jure partie de [From.PrimaryTitle.GetName]\n;;;[Root.GetFirstName] [Root.GetOnlyDynastyName] perderá su corona y se convertirá en Señor Supremo de [This.GetName], volviéndose parte de jure de [From.PrimaryTitle.GetName]\n;;;;;;;;;x
TOOLTIPdejure_kingdom_EMP_vassal;will become part of [Root.PrimaryTitle.GetName]\n;va faire partie de [Root.PrimaryTitle.GetName]\n;;;será parte de [Root.PrimaryTitle.GetName]\n;;;;;;;;;x
join_rebel_leader_1;Decide Upon Civil War Sides;Choisir un camp ;;;Elegir bando de la guerra civil;;;;;;;;;x
join_rebel_leader_1_desc;Decide which side to join in a civil war;Choisir quel camp soutenir dans une guerre civile;;;Elegir que bando apoyar en una guerra civil;;;;;;;;;x
TOOLTIP_join_rebel_leader_A;[This.PrimaryTitle.GetName] is NOT being attacked by a foreign realm\n;[This.PrimaryTitle.GetName] n'est PAS attaqué par un royaume étranger\n;;;;;;;;;;;;x
TOOLTIP_join_rebel_leader; or, if allowed, join [This.GetFirstName] [This.GetOnlyDynastyName] in their civil war\n;ou, si cela est autorisé, de rejoindre [This.GetFirstName] [This.GetOnlyDynastyName] dans sa guerre civile\n;;;o, si está permitido, unirse a [This.GetFirstName] [This.GetOnlyDynastyName] en su guerra civil\n;;;;;;;;;x
TOOLTIP_join_emperor;You will be presented with the option to either support your liege [This.GetTitle] [This.GetFirstName];Vous allez avoir le choix de soutenir votre suzerain [This.GetTitle] [This.GetFirstName];;;Tendrás la ocasión de apoyar a tu Señor [This.GetTitle] [This.GetFirstName];;;;;;;;;x
join_rebel_leader_2;Decide upon civil war sides;Choisir un camp ;;;Elegir bando de la guerra civil;;;;;;;;;x
join_rebel_leader_2_desc;Decide which side to join in a civil war;Choisir quel camp soutenir dans une guerre civile;;;Elegir que bando apoyar en una guerra civil;;;;;;;;;x
join_rebel_leader_3;Decide upon civil war sides;Choisir un camp ;;;Elegir bando de la guerra civil;;;;;;;;;x
join_rebel_leader_3_desc;Decide which side to join in a civil war;Choisir quel camp soutenir dans une guerre civile;;;Elegir que bando apoyar en una guerra civil;;;;;;;;;x
join_rebel_leader_4;Decide upon civil war sides;Choisir un camp ;;;Elegir bando de la guerra civil;;;;;;;;;x
join_rebel_leader_4_desc;Decide which side to join in a civil war;Choisir quel camp soutenir dans une guerre civile;;;Elegir que bando apoyar en una guerra civil;;;;;;;;;x
join_rebel_leader_5;Decide upon civil war sides;Choisir un camp ;;;Elegir bando de la guerra civil;;;;;;;;;x
join_rebel_leader_5_desc;Decide which side to join in a civil war;Choisir quel camp soutenir dans une guerre civile;;;Elegir que bando apoyar en una guerra civil;;;;;;;;;x
join_rebel_leader_6;Decide upon civil war sides;Choisir un camp ;;;Elegir bando de la guerra civil;;;;;;;;;x
join_rebel_leader_6_desc;Decide which side to join in a civil war;Choisir quel camp soutenir dans une guerre civile;;;Elegir que bando apoyar en una guerra civil;;;;;;;;;x
TOOLTIP_liege_supporting_king;Your Liege, [Root.Liege.GetFirstName] [Root.Liege.GetOnlyDynastyName], is §YSUPPORTING§! the Throne\n;Votre suzerain, [Root.Liege.GetFirstName] [Root.Liege.GetOnlyDynastyName], §SSOUTIENT§ le Trône\n;;;Tu Señor, [Root.Liege.GetFirstName] [Root.Liege.GetOnlyDynastyName], §YAPOYA§! al Trono\n;;;;;;;;;x
TOOLTIP_liege_neutral;Your Liege, [Root.Liege.GetFirstName] [Root.Liege.GetOnlyDynastyName], is §YNEUTRAL§!\n;Votre suzerain, [Root.Liege.GetFirstName] [Root.Liege.GetOnlyDynastyName], est §NNEUTRE§\n;;;Tu Señor, [Root.Liege.GetFirstName] [Root.Liege.GetOnlyDynastyName], es §NEUTRAL§\n;;;;;;;;;x
TOOLTIP_liege_against_king;Your Liege, [Root.Liege.GetFirstName] [Root.Liege.GetOnlyDynastyName], is §YOPPOSING§! The Throne\n;Votre suzerain, [Root.Liege.GetFirstName] [Root.Liege.GetOnlyDynastyName], §SS'OPPOSE§ au Trône\n;;;Tu Señor, [Root.Liege.GetFirstName] [Root.Liege.GetOnlyDynastyName], se §YOPONE§! al Trono\n;;;;;;;;;x
WAR_NAME_claim_iron_throne_ACOK;$ATTACKER$'s $ORDER$ War for the Iron Throne;$ATTACKER$ $ORDER$ Guerre pour le Trône de Fer;;;$ATTACKER$ $ORDER$ Guerra por el Trono de Hierro;;;;;;;;;x
CB_NAME_claim_iron_throne_ACOK;Claim on the Iron Throne;Revendication sur le Trône de Fer;;;Reclamación del Trono de Hierro;;;;;;;;;x
EVTDESCmega_wars.31;[Root.GetFirstName] [Root.GetOnlyDynastyName], I see just cause in your struggle against the Throne. I will take up arms and stand beside you.\n\n Regards,\n[From.GetFirstName] [From.GetOnlyDynastyName];[Root.GetFirstName] [Root.GetOnlyDynastyName], je vois une juste cause dans votre lutte contre le Trône de Fer. Je vais prendre les armes et me ranger derrière votre bannière.\n\n Cordialement,\n[From.GetFirstName] [From.GetOnlyDynastyName];;;[Root.GetFirstName] [Root.GetOnlyDynastyName], veo una causa justa en vuestra guerra contra el Trono de Hierro. Tomaré las armas y estaré a vuesro lado.\n\n Cordialmente,\n[From.GetFirstName] [From.GetOnlyDynastyName];;;;;;;;;x
TOOLTIPdejure_kingdom_claim_EMP_success;[Prev.GetFirstName] [Prev.GetOnlyDynastyName] will lose their crown and be named Lord Paramount of [This.GetName], swearing fealty to [Root.PrimaryTitle.GetName]\n;[Prev.GetFirstName] [Prev.GetOnlyDynastyName] va perdre sa couronne et devenir Lord Suzerain de [This.GetName], jurant fidélité au [Root.PrimaryTitle.GetName]\n;;;;;;;;;;;;x
TOOLTIPother_claim_iron_throne_kingdom_SUCCESS;[Root.GetTitledFirstNameNoRegnal] [Root.GetOnlyDynastyName] will be named Lord Paramount of [This.GetName], swearing fealty to [FromFrom.PrimaryTitle.GetName]\n;[From.GetFirstName] [From.GetOnlyDynastyName] va perdre sa couronne et devenir Lord Suzerain de [This.GetName], jurant fidélité au [Root.PrimaryTitle.GetName]\n;;;[Root.GetTitledFirstNameNoRegnal] [Root.GetOnlyDynastyName] se convertirá en Señor Supremo de [This.GetName], jurando lealtad al [FromFrom.PrimaryTitle.GetName]\n;;;;;;;;;x
EVTDESCmega_wars.60;Despite being at the mercy of [Root.Host.GetTitledFirstName], my close relative is currently at war with [Root.Host.GetHerHim]. Which means [Root.Host.GetSheHe] can do as [Root.Host.GetSheHe] pleases with me.;Bien que je sois à la merci de [Root.Host.GetTitledFirstName], mon parent proche est actuellement enguerre avec [Root.Host.GetHerHim]. Ce qui veut dire qu'[Root.Host.GetSheHe] peut faire ce qu'[Root.Host.GetSheHe] veut de moi. ;;;A pesar de estar bajo la merced de [Root.Host.GetTitledFirstName], mi familiar cercano está en guerra contra [Root.Host.GetHerHim]. Esto quiere decir que puede hacer conmigo lo que quiera.;;;;;;;;;x
EVTOPTAmega_wars.60;Let us hope [Root.Host.GetSheHe] is merciful;Espérons qu'[Root.Host.GetSheHe] soit miséricordieux(euse);;;Esperemos que sea misericordioso.;;;;;;;;;x
EVTTOOLTIPmega_wars.61;will decide what is to be done with you;va décider ce qu'on doit faire de vous ;;;decidirá que hacer contigo;;;;;;;;;x
EVTDESCmega_wars.61;[From.GetFirstName] [From.GetOnlyDynastyName] is currently under my control, and [From.GetHerHis] close relative is currently opposing us. We can rightfully execute or imprison [From.GetHerHim] as a warning to our enemies.;Je détiens [From.GetFirstName] [From.GetOnlyDynastyName] et un membre de sa famille s'oppose actuellement à moi. Nous pouvons librement l'emprisonner ou l'exécuter pour envoyer un avertissement à nos ennemis. ;;;[From.GetFirstName] [From.GetOnlyDynastyName] está bajo mi poder y un miembro de su familia se opone abiertamente a mi. Podemos encarcelarlo o ejecutarlo para enviar un aviso a nuestros enemigos.;;;;;;;;;x
EVTOPTAmega_wars.61;It's not [From.GetHerHis] fault;Ce n'est pas sa faute;;;No hará falta;;;;;;;;;x
EVTOPTBmega_wars.61;Imprison [From.GetHerHim];Emprisonnez-le(a);;;A prisión!;;;;;;;;;x
EVTOPTCmega_wars.61;Bring me [From.GetHerHis] head!;Apportez moi sa tête !;;;Traedme su cabeza!;;;;;;;;;x
EVTOPTDmega_wars.61;Have [From.GetHerHim] questioned, torture [From.GetHerHim] if necessary;Questionnez le(a), torturez le(a) s'il le faut.;;;Interrogadlo, torturadlo si es preciso!;;;;;;;;;x
EVTDESCmega_wars.62;[From.GetTitledFirstName] has mercifully spared me punishment for my relatives crimes;[From.GetTitledFirstName] m'a épargné la punition pour les crimes de ma famille;;;[From.GetTitledFirstName] me ha perdonado el castigo por los crímenes de mi familia.;;;;;;;;;x
EVTOPTAmega_wars.62;What a relief;Quel soulagement;;;Que alivio!;;;;;;;;;x
EVTDESCmega_wars.67;[From.GetTitledFirstName] has decreed that I should be imprisoned in the dungeons for my relatives crimes;[From.GetTitledFirstName] a décrété que je devais être emprisonné pour les crimes de ma famille;;;[From.GetTitledFirstName] ha decretado que debo ser encarcelado por los crímenes de mi familia.;;;;;;;;;x
EVTOPTAmega_wars.67;It's not my fault!;Ce n'est pas ma faute !;;;No es mi culpa!;;;;;;;;;x
EVTDESCmega_wars.68;[From.GetTitledFirstName] has decreed that I should be executed for my relatives crimes;[From.GetTitledFirstName] a décrété que je devais être executé pour les crimes de ma famille;;;[From.GetTitledFirstName] ha decretado que debo ser ejectudado por los crímenes de mi familia.;;;;;;;;;x
EVTOPTAmega_wars.68;I hope it is worth it for them;J'espère pour eux que cela vaut le coup;;;Espero que valga la pena;;;;;;;;;x
EVTDESCmega_wars.71;[From.GetTitledFirstName] has had you locked in the dungeon, and has decided you must be questioned. They interrogate you for days, subjecting you to horrifically painful methods of torture.;[From.GetTitledFirstName] vous a mis au cachot et a décidé de vous interroger. On vous questionne pendant des jours, vous soumettant à d'horribles et douloureuses méthodes de torture.;;;[From.GetTitledFirstName] te ha enviado a las mazmorras para interrogarte. Te interrogan durante días, sometiéndote a horribles y dolorosas torturas.;;;;;;;;;x
EVTOPTAmega_wars.71;But it's not my fault!;Mais ce n'est pas de ma faute !;;;Pero no es mi culpa!;;;;;;;;;x
EVTDESCmega_wars.69;[FromFrom.GetTitledFirstName] has imprisoned my [GetFromRelation] [From.GetFirstName] for my opposition against [FromFrom.GetHerHim] in the war;[FromFrom.GetTitledFirstName] a emprisonné mon(a) [GetFromRelation] [From.GetFirstName] pour m'être opposé(e) à [FromFrom.GetHerHim] ;;;[FromFrom.GetTitledFirstName] ha encarcelado a mi [GetFromRelation] [From.GetFirstName] por haberme opuesto a él.;;;;;;;;;x
EVTOPTAmega_wars.69;How unfortunate;Quel malheur;;;Que desgracia!;;;;;;;;;x
EVTDESCmega_wars.70;[FromFrom.GetTitledFirstName] has had my [GetFromRelation] [From.GetFirstName] executed for my opposition against [FromFrom.GetHerHim] in the war;[FromFrom.GetTitledFirstName] a fait executer mon(a) [GetFromRelation] [From.GetFirstName] pour m'être opposé(e) à [FromFrom.GetHerHim] ;;;[FromFrom.GetTitledFirstName] ha ejecutado a mi [GetFromRelation] [From.GetFirstName] por haberme opuesto a él.;;;;;;;;;x
EVTOPTAmega_wars.70;Was this necessary?;Était-ce nécessaire? ;;;Era necesario?;;;;;;;;;x
EVTDESCmega_wars.72;Your [GetFromRelation] [From.GetFirstName] has suffered greatly for your opposition against [FromFrom.GetTitledFirstName]. We have received word that [From.GetSheHe] has been locked away in the dungeons of [FromFrom.Capital.GetName], and there subjected to agonising torture and questioning.;Votre [GetFromRelation] [From.GetFirstName] a grandement souffert de votre conflit avec [FromFrom.GetTitledFirstName]. Nous avons appris qu'[From.GetSheHe] a été jeté dans les cachots de [FromFrom.Capital.GetName] avant d'être soumis à un violent interrogatoire et à de nombreuses tortures.;;;Tu [GetFromRelation] [From.GetFirstName] ha sufrido mucho debido a tu conflicto con [FromFrom.GetTitledFirstName]. Hemos sabido que ha sido encerrado en las mazmorras de [FromFrom.Capital.GetName] y ha sido sometido a un violento interrogatorio y torutras.;;;;;;;;;x
EVTOPTAmega_wars.72;[FromFrom.GetSheHeCap] will regret this!;[FromFrom.GetSheHeCap] va le regretter !;;;lo lamentará !;;;;;;;;;x
EVTDESCmega_wars.73;[From.GetFirstName] [From.GetOnlyDynastyName] was interrogated in the dungeon as commanded, with every method of torture available applied. The screams were heard throughout the castle, and after many days [From.GetSheHe] died from the questioning.;Comme vous l'aviez ordonné, [From.GetFirstName] [From.GetOnlyDynastyName] a été interrogé dans son cachot et a subi toutes sortes de torture. Ses cris ont été entendus dans tout le château et après de nombreux jours de questions, [From.GetSheHe] est décédé(e).;;;Como ordenaste, [From.GetFirstName] [From.GetOnlyDynastyName] ha sido interrogado en las mazmorras y ha sufrido todo tipo de torturas. Sus gritos se escucharon por todo el castillo y tras numerosos días de preguntas, falleció.;;;;;;;;;x
EVTOPTAmega_wars.73;[From.GetSheHeCap] and [From.GetHerHis] kin shouldn't have opposed me!;[From.GetSheHeCap] n'aurait pas du s'opposer à moi, tout comme ses parents !;;;[From.GetSheHeCap] no tendría que haberse opuesto a mi, igual que su familia!;;;;;;;;;x
TOOLTIP_liege_emperor;Your Liege, [Root.Liege.GetFirstName] [Root.Liege.GetOnlyDynastyName], is §YThe [Root.Liege.GetTitle]§!\n;Votre suzerain, [Root.Liege.GetFirstName] [Root.Liege.GetOnlyDynastyName], est §lle(a) [Root.Liege.GetTitle]§ !\n;;;Tu Señor, [Root.Liege.GetFirstName] [Root.Liege.GetOnlyDynastyName], es §Yel [Root.Liege.GetTitle]§!\n;;;;;;;;;x
TOOLTIP_liege_rebel_leader;Your Liege, [Root.Liege.GetFirstName] [Root.Liege.GetOnlyDynastyName], is a §YREBEL LEADER§!\n;Votre suzerain, [Root.Liege.GetFirstName] [Root.Liege.GetOnlyDynastyName], est un §CCHEF REBELLE§ !\n;;;Tu Señor, [Root.Liege.GetFirstName] [Root.Liege.GetOnlyDynastyName], es un §JEFE REBELDE§!\n;;;;;;;;;x
dejure_duchy_claim_desc;The §Y$TITLE$§! is, de jure, a vassal of §Y$CLAIMANT$'s§!, which is cause enough for war.;Le §Y$TITLE$§ ! est, de Jure, un vassal de §Y$CLAIMANT$§ !, ce qui constitue un motif de guerre suffisant.;;;El §Y$TITLE$§! es, de jure, vasallo de §Y$CLAIMANT$§!, lo que es causa suficiente para declarar la guerra.;;;;;;;;;x
other_dejure_duchy_claim_desc;The §Y$TITLE$§! is, de jure, a vassal of §Y$CLAIMANT$'s§!, which is cause enough for war.;Le §Y$TITLE$§ ! est, de Jure, un vassal de §Y$CLAIMANT$§ !, ce qui constitue un motif de guerre suffisant.;;;El §Y$TITLE$§! es, de jure, vasallo de §Y$CLAIMANT$§!, lo que es causa suficiente para declarar la guerra.;;;;;;;;;x
EVTDESCmega_wars.74;We have lost the war, our armies have been obliterated, our castles sacked. Now I stand before [FromFrom.GetTitledFirstName] to hear [FromFrom.GetHerHis] judgement...;Nous avons perdu la guerre, nos armées ont été annihilées, nos châteaux saccagés. Je me tiens désormais devant [FromFrom.GetTitledFirstName] pour entendre son jugement… ;;;Perdimos la guerra, nuestros ejércitos fueron aniquilados, nuestros castillos saquados. Ahora me encuentro ante [FromFrom.GetTitledFirstName] para escuchar su sentencia… ;;;;;;;;;x
EVTOPTAmega_wars.74;Let us hope [FromFrom.GetSheHe] is merciful;Espérons qu'[FromFrom.GetSheHe] miséricordieux(euse);;;Esperemos que sea misericordioso.;;;;;;;;;x
EVTDESCmega_wars.75;The war has been won, the rebel's armies have been crushed by our brave loyalists. [From.GetTitle] [From.GetFirstName] [From.GetOnlyDynastyName], one of the traitors, as been brought before you to hear your judgement...;La guerre a été gagnée, les armées rebelles ont été écrasées par nos braves loyalistes. [From.GetTitle] [From.GetFirstName] [From.GetOnlyDynastyName], l'un des traîtres, a été amené devant vous pour entendre votre jugement... ;;;Ganamos la guerra, los ejércitos rebeldes fueron aplastados por los valientes ejércitos leales. [From.GetTitle] [From.GetFirstName] [From.GetOnlyDynastyName], uno de los traidores, ha sido traído ante tí para escuchar su sentencia... ;;;;;;;;;x
EVTOPTAmega_wars.75;Let [From.GetHerHim] bend the knee;Laissez-le(a) [From.GetHerHim] plier le genou;;;Dejadle doblar la rodilla;;;;;;;;;x
TOOLTTIPmega_wars.76;[This.GetTitle] [This.GetFirstName] shall be reprimanded and a hostage be taken\n;[This.GetTitle] [This.GetFirstName] sera puni(e) et devra livrer un otage\n;;;[This.GetTitle] [This.GetFirstName] será castigado y deberá dejar un rehén\n;;;;;;;;;x
TOOLTTIPmega_wars.76KG ;[This.GetBestName] shall be reprimanded\n;[This.GetBestName] sera puni(e)\n;;;[This.GetBestName] será castigado\n;;;;;;;;;x
EVTOPTBmega_wars.75;Send [From.GetHerHim] to the dungeon;Je vais confisquer un château;;;Enviadlo a las mazmorras;;;;;;;;;x
TOOLTIPmega_wars.77LIEGE;[This.GetTitle] [This.GetFirstName] shall be kept imprisoned\n;[This.GetTitle] [This.GetFirstName] doit donner un château et un otage à la couronne\n;;;[This.GetTitle] [This.GetFirstName] se mantendrá encarcelado\n;;;;;;;;;x
TOOLTIPmega_wars.77LIEGEREBEL;[This.GetTitle] [This.GetFirstName] shall be kept imprisoned\nAs [This.GetSheHe] is currently not your prisoner [This.GetSheHe] may rebel\n;[This.GetTitle] [This.GetFirstName] doit donner un château et un otage à [This.Liege.GetTitle] [This.Liege.GetFirstName] [This.Liege.GetOnlyDynastyName]\n;;;[This.GetTitle] [This.GetFirstName] se mantendrá encarcelado\nActualmente no es tu prisionero y quizás se rebele\n;;;;;;;;;x
EVTOPTCmega_wars.75;[From.GetSheHeCap] will forfeit [From.PrimaryTitle.GetName] ;[From.GetSheHeCap] perdra [From.PrimaryTitle.GetName] ;;;Perderá [From.PrimaryTitle.GetName] ;;;;;;;;;x
TOOLTIPmega_wars.78LIEGE;[This.GetTitle] [This.GetFirstName] shall surrender [This.PrimaryTitle.GetName] to the crown and will be taken prisoner\nThis will likely §Ydisappoint§! [This.GetHerHis] former loyal §Ybannermen§!\n;[This.GetTitle] [This.GetFirstName] doit donner [This.PrimaryTitle.GetName] et un otage à la couronne\nCela va sûrement §Ydécevoir§ ! ses anciens §Ybannerets§ !\n;;;[This.GetTitle] [This.GetFirstName] deberá entregar el [This.PrimaryTitle.GetName] a la Corona y será hecho prisionero\nEsto §Ydisgustará§! a sus antiguos leales §Yvasallos§!\n;;;;;;;;;x
TOOLTIPmega_wars.78NONLIEGE;[This.GetTitle] [This.GetFirstName] shall surrender [This.PrimaryTitle.GetName] to [This.Liege.GetTitle] [This.Liege.GetFirstName] [This.Liege.GetOnlyDynastyName] and will be taken prisoner\nThis will likely §Ydisappoint§! [This.GetHerHis] former loyal §Ybannermen§!\n;[This.GetTitle] [This.GetFirstName] doit donner [This.PrimaryTitle.GetName] et un otage à [This.Liege.GetTitle] [This.Liege.GetFirstName] [This.Liege.GetOnlyDynastyName]\nCela va sûrement §Ydécevoir§ ! ses anciens §Ybannerets§ !\n;;;[This.GetTitle] [This.GetFirstName] deberá entregar el [This.PrimaryTitle.GetName] a [This.Liege.GetTitle] [This.Liege.GetFirstName] [This.Liege.GetOnlyDynastyName] y será hecho prisionero\nEsto §Ydisgustará§! a sus antiguos leales §Yvasallos§!\n;;;;;;;;;x
TOOLTIPmega_wars.78LIEGEREBEL;[This.GetTitle] [This.GetFirstName] shall be ordered to surrender [This.PrimaryTitle.GetName] to the crown and will be taken prisoner\nAs [This.GetSheHe] is currently not your prisoner [This.GetSheHe] may rebel\nIf accepeted, this will likely §Ydisappoint§! [This.GetHerHis] former loyal §Ybannermen§!\n;[This.GetTitle] [This.GetFirstName] se verra ordonner de livrer [This.PrimaryTitle.GetName] à la couronne qui sera fait prisonnier(ère)\nComme [From.GetSheHe] n'est pas actuellement notre prisonnier(ère) [From.GetSheHe] peut se rebeller\nSi l'accord venait à être accepté, cela §Ydécevrait§ ! ses anciens et loyaux §Ybannerets§ !\n;;;Se ordenará a [This.GetTitle] [This.GetFirstName] entregar el [This.PrimaryTitle.GetName] a la Corona y será hecho prisionero\nActualmente no es tu prisionero y quizás se rebele\nSi acepta, Esto §Ydisgustará§! a sus antiguos leales §Yvasallos§!\n;;;;;;;;;x
TOOLTIPmega_wars.78NONLIEGEREBEL;[This.GetTitle] [This.GetFirstName] shall be ordered to surrender [This.PrimaryTitle.GetName] to [This.Liege.GetTitle] [This.Liege.GetFirstName] [This.Liege.GetOnlyDynastyName] and will be taken prisoner\nAs [This.GetSheHe] is currently not your prisoner [This.GetSheHe] may rebel\nIf accepeted, this will likely §Ydisappoint§! [This.GetHerHis] former loyal §Ybannermen§!\n;[This.GetTitle] [This.GetFirstName] se verra ordonner de livrer [This.PrimaryTitle.GetName] à [This.Liege.GetTitle] [This.Liege.GetFirstName] [This.Liege.GetOnlyDynastyName] qui sera fait prisonnier(ère)\nComme [From.GetSheHe] n'est pas actuellement notre prisonnier(ère) [From.GetSheHe] peut se rebeller\nSi l'accord venait à être accepté, cela §Ydécevrait§ ! ses anciens et loyaux §Ybannerets§ !\n;;;Se ordenará a [This.GetTitle] [This.GetFirstName] entregar el [This.PrimaryTitle.GetName] a [This.Liege.GetTitle] [This.Liege.GetFirstName] [This.Liege.GetOnlyDynastyName] y será hecho prisionero\nActualmente no es tu prisionero y quizás se rebele\nSi acepta, Esto §Ydisgustará§! a sus antiguos leales §Yvasallos§!\n;;;;;;;;;x
EVTOPTDmega_wars.75;I demand [From.GetHerHis] head as well as all [From.GetOnlyDynastyName] lands!;Je demande sa tête ainsi que toutes les terres [From.GetOnlyDynastyName] !;;;Pido su cabeza así como todas las tierras de los [From.GetOnlyDynastyName]!;;;;;;;;;x
TOOLTIPmega_wars.79LIEGE;[This.GetTitle] [This.GetFirstName] shall surrender all lands and titles to the crown and be executed, as well as a hostage taken from House [This.GetOnlyDynastyName]\nThis will likely §Yanger§! [This.GetHerHis] former loyal §Ybannermen§!\n;[This.GetTitle] [This.GetFirstName] livrera ses terres et ses titres à la couronne et sera executé(e), un otage sera également demandé à la Maison [This.GetOnlyDynastyName]\nCela va sûrement §Yénerver§ ! ses anciens §Ybannerets§ !\n;;;[This.GetTitle] [This.GetFirstName] deberá entregar todas las tierras y títulos a la Corona y será ejecutado, también entregará un rehén de la casa [This.GetOnlyDynastyName]\nEsto §Yenfadará§! a sus antiguos leales §Yvasallos§!\n;;;;;;;;;x
TOOLTIPmega_wars.79NONLIEGE;[This.GetTitle] [This.GetFirstName] shall surrender all lands and titles to [This.Liege.GetTitle] [This.Liege.GetFirstName] [This.Liege.GetOnlyDynastyName] and be executed, as well as a hostage taken from House [This.GetOnlyDynastyName]\nThis will likely §Yanger§! [This.GetHerHis] former loyal §Ybannermen§!\n;[This.GetTitle] [This.GetFirstName] livrera tous ses titres et ses terres à [This.Liege.GetTitle] [This.Liege.GetFirstName] [This.Liege.GetOnlyDynastyName] et sera executé(e), un otage sera également demandé à la Maison [This.GetOnlyDynastyName]\nCela va sûrement §Yénerver§ ! [From.GetHerHis] ses anciens §Ybannerets§ !\n;;;[This.GetTitle] [This.GetFirstName] deberá entregar todas las tierras y títulos a [This.Liege.GetTitle] [This.Liege.GetFirstName] [This.Liege.GetOnlyDynastyName] y será ejecutado, también entregará un rehén de la casa [This.GetOnlyDynastyName]\nEsto §Yenfadará§! a sus antiguos leales §Yvasallos§!\n;;;;;;;;;x
