#CODE;ENGLISH;FRENCH;GERMAN;;SPANISH;;;;;;;;;x
EVTDESCwikid.262;[From.GetTitledFirstName], your [GetFromRelation] who has been adventuring in foreign lands these past months, has returned. [From.GetSheHeCap] has been busy involving [From.GetHerHim]self in court life of [foreign_realm.Culture.GetGroupName] nobles, notably spending a number of months in [foreign_realm.Capital.GetName]. There [From.GetSheHe] learnt the workings of this strange domain, and even partook in a number of petty intrigues to learn more.;[From.GetTitledFirstName], votre [GetFromRelation] qui voyageait à l'étranger ces derniers mois est de retour. [From.GetSheHeCap] a été impliqué(e) dans la vie de cour des nobles [foreign_realm.Culture.GetGroupName], et a notamment passé plusieurs mois à [foreign_realm.Capital.GetName]. C'est là qu'[From.GetSheHe] a découvert le fonctionnement de cet étrange endroit, prenant même part à quelques menus complots pour en apprendre plus.;;;;;;;;;;;;x
EVTOPTAwikid.262;Welcome home ;Bienvenue à la maison.;;;;;;;;;;;;x
EVTDESCwikid.263;By all accounts, your [GetFromRelation] [From.GetTitledFirstName] was having a fruitful journey across strange lands and far away seas. [From.GetSheHeCap] often sent word from many cities and towns saying of the grand time [From.GetSheHe] and was having, and was last seen leaving [foreign_realm.Capital.GetName] for home. However, according to a surviving companion who made it home, their ship was attacked by pirates, leading [From.GetFirstName] to be captured!;En tout point, le voyage à l'étranger de votre [GetFromRelation] [From.GetTitledFirstName] a été bénéfique. [From.GetSheHeCap] a souvent envoyé des lettres très enthousiastes depuis les villes et ports qu'[From.GetSheHe] visitait. Les dernières nouvelles indiquait qu'[From.GetSheHe] se trouvait à [foreign_realm.Capital.GetName] et comptait rentrer. Mais d'après un de ses compagnons survivants qui est parvenu à rentrer, son bateau a été attaqué par des pirates et [From.GetFirstName] a été capturé(e) !;;;;;;;;;;;;x
EVTOPTAwikid.263;The seas are dangerous to travel;Les mers sont dangereuses.;;;;;;;;;;;;x
EVTDESCwikid.264;One of your subordinate ships was prowling the seas near [Root.Location.GetName] when they sucessfully boarded a lone ship and captured its crew. The noble [FromFrom.GetTitledFirstName] [FromFrom.GetOnlyDynastyName] of [From.PrimaryTitle.GetName] is amongst the prisoners, apparently [FromFrom.GetSheHe] was sailing home after a tour of foreign lands.;L'un de vos bateaux rôdait dans les mers près de [Root.Location.GetName] lorsqu'il a abordé un bateau isolé et capturé son équipage. Le(a) noble [FromFrom.GetTitledFirstName] [FromFrom.GetOnlyDynastyName] de [From.PrimaryTitle.GetName] fait partie des prisonniers, apparemment [FromFrom.GetSheHe] rentrait à la maison après un voyage à l'étranger.;;;;;;;;;;;;x
EVTOPTAwikid.264;I hope [From.GetTitledFirstName] pays a good ransom!;J'espère que [From.GetTitledFirstName] va payer une bonne rançon !;;;;;;;;;;;;x
EVTDESCwikid.265;Your [GetFromRelation] [From.GetTitledFirstName] has arrived home to [Root.Capital.GetName] from [From.GetHerHis] tour, and [From.GetSheHe] seems shaken up. After visiting many exotic places, [From.GetSheHe] arrived in [foreign_realm.Capital.GetName], and their got in a dispute with a local merchant. Apparently this led to [From.GetFirstName] being kidnapped and suffering painful injuries at the merchant's command. [From.GetSheHeCap] refuses to name this merchant.;Votre [GetFromRelation] [From.GetTitledFirstName] est rentré(e) à [Root.Capital.GetName] après son voyage, et [From.GetSheHe] semble bouleversé(e). Après avoir visité de nombreux endroits exotiques [From.GetSheHe] est arrivé(e) à [foreign_realm.Capital.GetName], et s'y est disputé(e) avec un marchand local. Apparemment [From.GetFirstName] a été kidnappé(e) et a souffert de terribles blessures infligées sur ordre du marchand. [From.GetSheHeCap] refuse de nommer cet homme.;;;;;;;;;;;;x
EVTOPTAwikid.265;I'm not surprised [From.GetSheHe] made some enemies;Je ne suis pas surpris qu'[From.GetSheHe] se soit fait quelques ennemis.;;;;;;;;;;;;x
EVTDESCwikid.266;Your [GetFromRelation] [From.GetTitledFirstName] is finally back from [From.GetHerHis] voyage, and quite the epic voyage it was. After setting sail from [foreign_realm.Capital.GetName], [From.GetSheHe] sailed the Shivering Sea to Ibben, then on to navigate the treacherous Thousand Islands. Finally, [From.GetSheHe] voyaged as far as Nefer, the old capital of the Kingdom of N'Ghai. All the while [From.GetFirstName] gained an abundance of eastern treasures.;Votre [GetFromRelation] [From.GetTitledFirstName] est finalement revenu de son voyage, et ce fut un voyage épique. Après avoir quitté [foreign_realm.Capital.GetName], [From.GetSheHe] a traversé la mer Grelotte jusqu'à Ibben, puis il a poussé jusqu'aux Mille-îles. Finalement [From.GetSheHe] est allé jusqu'à Nefer, l'ancienne capitale du royaume de N'Ghai. En chemin [From.GetFirstName] a amassé de nombreux trésors orientaux.;;;;;;;;;;;;x
EVTOPTAwikid.266;You are a true legend;Tu es une véritable légende.;;;;;;;;;;;;x
EVTDESCwikid.267;We have word that [FromFrom.GetTitledFirstName] [FromFrom.GetOnlyDynastyName] has come back from a long voyage, and quite the epic voyage it was. After setting sail from [foreign_realm.Capital.GetName], [FromFrom.GetSheHe] sailed the Shivering Sea to Ibben, then on to navigate the treacherous Thousand Islands. Finally, [FromFrom.GetSheHe] voyaged as far as Nefer, the old capital of the Kingdom of N'Ghai. All the while [FromFrom.GetFirstName] gained an abundance of eastern treasures.;Nous avons entendu dire que [FromFrom.GetTitledFirstName] [FromFrom.GetOnlyDynastyName] est revenu de son voyage, et ce fut un voyage épique. Après avoir quitté [foreign_realm.Capital.GetName], [FromFrom.GetSheHe] a traversé la mer Grelotte jusqu'à Ibben, puis a poussé jusqu'aux Mille-îles. Finalement [FromFrom.GetSheHe] est allé jusqu'à Nefer, l'ancienne capitale du royaume de N'Ghai. En chemin [FromFrom.GetFirstName] a amassé de nombreux trésors orientaux.;;;;;;;;;;;;x
EVTOPTAwikid.267;[FromFrom.GetSheHeCap] is a true legend;[FromFrom.GetSheHeCap] est une véritable légende.;;;;;;;;;;;;x
EVTDESCwikid.266;[From.GetTitledFirstName], your adventuring [GetFromRelation], has arrived back from [From.GetHerHis] long journey. After leaving port in [foreign_realm.Capital.GetName], [From.GetSheHe] managed to traverse many dangerous lands and sailed the Jade Sea before eventually reaching far Asshai. [From.GetSheHeCap] talks of a great city: dark, gloomy and made of black stone as if cast in shadow. Its people also dark and solemn, all masked or veiled. Few Westerosi reach Asshai, so [From.GetFirstName] has earned great renown and wealth from doing so.;Votre [GetFromRelation] [From.GetTitledFirstName] est finalement revenu de son voyage, et ce fut un voyage épique. Après avoir quitté [foreign_realm.Capital.GetName], [From.GetSheHe] a traversé la mer Grelotte jusqu'à Ibben, puis il a poussé jusqu'aux Mille-îles. Finalement [From.GetSheHe] est allé jusqu'à Nefer, l'ancienne capitale du royaume de N'Ghai. En chemin [From.GetFirstName] a amassé de nombreux trésors orientaux.;;;;;;;;;;;;x
EVTOPTAwikid.266;What a fascinating tale;Tu es une véritable légende.;;;;;;;;;;;;x
EVTDESCwikid.268;News from [From.Capital.GetName], [FromFrom.GetTitledFirstName] [FromFrom.GetOnlyDynastyName] has apparently arrived home from a long journey. After leaving port in [foreign_realm.Capital.GetName], [FromFrom.GetSheHe] managed to traverse many dangerous lands and sailed the Jade Sea before eventually reaching far Asshai. [FromFrom.GetSheHeCap] talks of a great city: dark, gloomy and made of black stone as if cast in shadow. Its people also dark and solemn, all masked or veiled. Few Westerosi reach Asshai, so [FromFrom.GetFirstName] has earned great renown and wealth from doing so.;Nouvelles de [From.Capital.GetName], [FromFrom.GetTitledFirstName] [FromFrom.GetOnlyDynastyName] est revenu(e) de son long voyage. Après avoir quitté le port de [foreign_realm.Capital.GetName], [FromFrom.GetSheHe] est parvenu(e) à traverser de nombreux pays dangereux avant de traversé la mer de Jade et d'atteindre Asshai. [FromFrom.GetSheHeCap] parle d'une grande cité, sombre et lugubre, construite en pierres si noires que l'on jurerait qu'elles sont faîtes d'ombres. Ses habitants sont également sombres, tous masqués ou voilés. Peu d'Ouestriens sont parvenus jusqu'à Asshai, aussi [FromFrom.GetFirstName] a obtenu un grand renom et de grandes richesses en accomplissant cet exploit.;;;;;;;;;;;;x
EVTOPTAwikid.268;[FromFrom.GetSheHeCap] is quite the adventurer;Voilà un sacré aventurier.;;;;;;;;;;;;x
EVTDESCwikid.269;Your [GetFromRelation] [From.GetTitledFirstName] is finally back from [From.GetHerHis] voyage, a voyage that took [From.GetHerHim] to the edge of the world. After setting sail from [foreign_realm.Capital.GetName], [From.GetSheHe] traversed the vast expanse of seas to the lands of the Free Cities, stopping off to gather and trade exotic treasures. Finally [From.GetSheHe] arrived in far Westeros and the city of Oldtown, the stunningly beautiful home of The Hightower and The Citadel. Alas the Sunset Sea prevented further travel west.;Votre [GetFromRelation] [From.GetTitledFirstName] est finalement revenu(e) de son voyage qui l'a mené(e) jusqu'au bout du monde. Après avoir quitté [foreign_realm.Capital.GetName], [From.GetSheHe] a traversé les vastes terres et mers des Cités Libres, s'arrêtant de temps en temps pour faire l'acquisition de trésors exotiques. Finalement [From.GetSheHe] est arrivé(e) dans la lointaine Westeros, dans la cité de Villevieille, l'impressionnante et magnifique ville avec sa Grand-Tour et la Citadelle. Malheureusement la mer du Crépuscule l'a empêché(e) de pousser plus loin vers l'ouest.;;;;;;;;;;;;x
EVTOPTAwikid.269;A legendary journey;Un voyage légendaire;;;;;;;;;;;;x
EVTDESCwikid.270;We have had word that [FromFrom.GetTitledFirstName] [FromFrom.GetOnlyDynastyName] has come back from a long voyage, a voyage that took [FromFrom.GetHerHim] to the edge of the world. After setting sail from [foreign_realm.Capital.GetName], [FromFrom.GetSheHe] traversed the vast expanse of seas to the lands of the Free Cities, stopping off to gather and trade exotic treasures. Finally [FromFrom.GetSheHe] arrived in far Westeros and the city of Oldtown, the stunningly beautiful home of The Hightower and The Citadel. Alas the Sunset Sea prevented further travel west.;Nous avons entendu dire que [FromFrom.GetTitledFirstName] [FromFrom.GetOnlyDynastyName] est revenu(e) de son long voyage, un périple qui l'a mené(e) au bout du monde. Après avoir quitté [foreign_realm.Capital.GetName], [FromFrom.GetSheHe] a traversé les vastes terres et mers des Cités Libres, s'arrêtant de temps en temps pour faire l'acquisition de trésors exotiques. Finalement [FromFrom.GetSheHe] est arrive(e) dans la lointaine Westeros, dans la cité de Villevieille, l'impressionnante et magnifique ville avec sa Grand-Tour et la Citadelle. Malheureusement la mer du Crépuscule l'a empêché(e) de pousser plus loin vers l'ouest.;;;;;;;;;;;;x
EVTOPTAwikid.270;A legendary journey;Un voyage légendaire;;;;;;;;;;;;x
EVTDESCwikid.271;[From.GetTitledFirstName] explored far to the south via [foreign_realm.Capital.GetName];[From.GetTitledFirstName] a exploré loin au sud via [foreign_realm.Capital.GetName];;;;;;;;;;;;x
EVTOPTAwikid.271;;;;;;;;;;;;;;x
EVTDESCwikid.272;[FromFrom.GetTitledFirstName] explored far to the south;[FromFrom.GetTitledFirstName] a exploré loin au sud;;;;;;;;;;;;x
EVTOPTAwikid.272;;;;;;;;;;;;;;x
EVTDESCwikid.275;A young [From.Culture.GetGroupName] adventurer named [From.GetTitledFirstName] [From.GetOnlyDynastyName] has been staying with us in [Root.Capital.GetName] for a number of weeks now. [From.GetSheHeCap] is touring many cities, feasting with lords and princes. [From.GetSheHeCap] is also known to be looking for a marriage, and proposes that an alliance with [From.Liege.PrimaryTitle.GetName] be sealed with a match between him and my daughter [foreign_marriage_daughter.GetTitledFirstName].;Un jeune aventurier [From.Culture.GetGroupName] nommé [From.GetTitledFirstName] [From.GetOnlyDynastyName] se trouve avec nous à [Root.Capital.GetName] depuis plusieurs semaines. [From.GetSheHeCap] visite de nombreuses cités et participe aux banquets des seigneurs et princes. [From.GetSheHeCap] est aussi connu pour rechercher une union, et propose qu'une alliance avec [From.Liege.PrimaryTitle.GetName] soit scellée par un mariage entre lui et ma fille [foreign_marriage_daughter.GetTitledFirstName].;;;;;;;;;;;;x
EVTOPTAwikid.275;I graciously accept your proposal;J'accepte gracieusement cette proposition.;;;;;;;;;;;;x
EVTOPTBwikid.275;A fine proposal, I will ask [From.Liege.GetTitledFirstName];Une bonne proposition, je vais en informer [From.Liege.GetTitledFirstName];;;;;;;;;;;;x
EVTOPTCwikid.275;No, I will not have some [From.Culture.GetGroupName] marrying my daughter;Non, je ne laisserai pas un [From.Culture.GetGroupName] épouser ma fille;;;;;;;;;;;;x
EVTDESCwikid.276;A raven has arrived from my adventuring [GetFromFromRelation] [FromFrom.GetTitledFirstName]! [FromFrom.GetSheHeCap] is currently in [From.Capital.GetName] staying with [From.GetTitledFirstName] [From.GetOnlyDynastyName], and has been busy negotiating a marriage for [FromFrom.GetHerHim]self.  [FromFrom.GetSheHeCap] has secured a match with [FromFrom.Spouse.GetTitledFirstName] [FromFrom.Spouse.GetOnlyDynastyName], along with an alliance with [From.PrimaryTitle.GetName].;Un corbeau nous est parvenu avec un message de mon aventurier(e) de [GetFromFromRelation] [FromFrom.GetTitledFirstName] ! [FromFrom.GetSheHeCap] est actuellement à [From.Capital.GetName] pour rencontrer [From.GetTitledFirstName] [From.GetOnlyDynastyName], et a passé son temps à négocier son propre mariage. [FromFrom.GetSheHeCap] est parvenu(e) à épouser [FromFrom.Spouse.GetTitledFirstName] [FromFrom.Spouse.GetOnlyDynastyName], et à obtenir une alliance avec [From.PrimaryTitle.GetName].;;;;;;;;;;;;x
EVTOPTAwikid.276;Good for [FromFrom.GetHerHim];Très bien !;;;;;;;;;;;;x
EVTDESCwikid.277;A raven has arrived from my adventuring [GetFromFromRelation] [FromFrom.GetTitledFirstName]! [FromFrom.GetSheHeCap] is currently in [From.Capital.GetName] staying with [From.GetTitledFirstName] [From.GetOnlyDynastyName], and has been busy negotiating a marriage for [FromFrom.GetHerHim]self.  [FromFrom.GetSheHeCap] has agreed to a match with [foreign_marriage_daughter.GetTitledFirstName] [foreign_marriage_daughter.GetOnlyDynastyName], and so with your assent an alliance with [From.PrimaryTitle.GetName] can be secured.;Un corbeau nous est parvenu avec un message de mon aventurier(e) de [GetFromFromRelation] [FromFrom.GetTitledFirstName] ! [FromFrom.GetSheHeCap] est actuellement à [From.Capital.GetName] pour rencontrer [From.GetTitledFirstName] [From.GetOnlyDynastyName], et a passé son temps à négocier son propre mariage. [FromFrom.GetSheHeCap] a accepté une union avec [FromFrom.Spouse.GetTitledFirstName] [FromFrom.Spouse.GetOnlyDynastyName], aussi, avec votre accord, une alliance avec [From.PrimaryTitle.GetName] pourrait voir le jour.;;;;;;;;;;;;x
EVTOPTAwikid.277;A fine proposal, you have my blessing;Une bonne proposition, vous avez ma bénédiction.;;;;;;;;;;;;x
EVTOPTBwikid.277;No, I will not have my [GetFromFromRelation] marry some [From.Culture.GetGroupName]!;Non, mon(a) [GetFromFromRelation] n'épousera pas une [From.Culture.GetGroupName] !;;;;;;;;;;;;x
EVTDESCwikid.278;A message has come back from [From.Capital.GetName]. [From.GetTitledFirstName] [From.GetOnlyDynastyName] has given [From.GetHerHis] assent to the marriage between [FromFromFrom.GetTitledFirstName] and [foreign_marriage_daughter.GetTitledFirstName]. The wedding is promptly held, and the alliance with [From.PrimaryTitle.GetName] sealed.;Une réponse nous est revenue de [From.Capital.GetName]. [From.GetTitledFirstName] [From.GetOnlyDynastyName] a donné son accord pour le mariage entre [FromFromFrom.GetTitledFirstName] et [foreign_marriage_daughter.GetTitledFirstName]. Le mariage est promptement organisé et l'alliance avec [From.PrimaryTitle.GetName] est scellée.;;;;;;;;;;;;x
EVTOPTAwikid.278;Excellent news;Excellentes nouvelles.;;;;;;;;;;;;x
EVTDESCwikid.279;A message has come back from [From.Capital.GetName]. [From.GetTitledFirstName] [From.GetOnlyDynastyName] has rejected the proposed marriage between [FromFromFrom.GetTitledFirstName] and [foreign_marriage_daughter.GetTitledFirstName]. The wedding is called off, and [FromFromFrom.GetTitledFirstName] makes a hasty exit from [Root.Capital.GetName].;Une réponse nous est revenue de [From.Capital.GetName]. [From.GetTitledFirstName] [From.GetOnlyDynastyName] a rejeté le mariage proposé entre [FromFromFrom.GetTitledFirstName] et [foreign_marriage_daughter.GetTitledFirstName]. Le mariage est annulé et [FromFromFrom.GetTitledFirstName] part précipitamment de [Root.Capital.GetName].;;;;;;;;;;;;x
EVTOPTAwikid.279;Perhaps we are best rid of this [From.Culture.GetGroupName] afterall;Peut-être est-ce une bonne chose de se débarrasser de ce [From.Culture.GetGroupName] après tout.;;;;;;;;;;;;x
EVTDESCwikid.281;A few weeks ago a [From.Culture.GetGroupName] noble named [From.GetTitledFirstName] [From.GetOnlyDynastyName] arrived in [Root.Capital.GetName] seeking hospitality. Apparently [From.GetSheHe] is on a tour of foreign lands, so I of course welcomed [From.GetHerHim]. [From.GetSheHeCap] has attended feasts and functions, and has got on well with many at court, becoming particularly friendly with [foreign_lover.GetTitledFirstName].;Il y a quelques semaines un(e) noble [From.Culture.GetGroupName] du nom de [From.GetTitledFirstName] [From.GetOnlyDynastyName] est arrivé(e) à [Root.Capital.GetName] et a demandé l'hospitalité. Apparemment [From.GetSheHe] fait un voyage à travers le monde, aussi l'ai-je accueilli(e). [From.GetSheHeCap] a participé à de nombreuses fêtes et soirée et s'est fait(e) apprécié(e) par de nombreux personnages de la cour. [From.GetSheHeCap] semble particulièrement attentionné(e) envers [foreign_lover.GetTitledFirstName].;;;;;;;;;;;;x
EVTOPTAwikid.281;What a pleasant [From.GetManWoman];Voilà un(e) [From.GetManWoman] particulièrement plaisant(e);;;;;;;;;;;;x
EVTDESCwikid.282;[FromFrom.GetTitledFirstName] has sent word, these past weeks [From.GetSheHe] has been residing with [From.GetTitledFirstName] in [From.Capital.GetName]. There [From.GetSheHe] says [From.GetSheHe] has attended numerous feasts and events, making many friends and ingratiating [From.GetHerHim]self to [From.GetHerHis] [From.Culture.GetName] hosts.;[FromFrom.GetTitledFirstName] a envoyé des nouvelles. Depuis quelques semaines [From.GetSheHe] réside chez [From.GetTitledFirstName] à [From.Capital.GetName]. [From.GetSheHeCap] dit avoir participé à de nombreux festins et évènements, s'est fait de nombreux amis et est entré(e) dans les bonnes grâces de ses hôtes.;;;;;;;;;;;;x
EVTOPTAwikid.282;I'm glad to hear [From.GetSheHe] is well;Je suis content(e) d'apprendre qu'[From.GetSheHe] va bien;;;;;;;;;;;;x
EVTDESCwikid.284;The upcoming feast has attracted the attention of a young [From.Culture.GetGroupName] named [From.GetTitledFirstName] [From.GetOnlyDynastyName]. This [From.GetManWoman] is currently on a tour of the cities and lands of the region, and would like to attend your feast whilst [From.GetSheHe] is in [Root.Location.GetName].;Le prochain banquet a attiré l'attention d'un(e) jeune [From.Culture.GetGroupName] nommé(e) [From.GetTitledFirstName] [From.GetOnlyDynastyName]. Cet(te) [From.GetManWoman] est actuellement en voyage pour visiter les cités et cours de la région, et voudrait participer au banquet pendant son séjour à [Root.Location.GetName].;;;;;;;;;;;;x
EVTOPTAwikid.284;You are of course welcome by esteemed guest!;Vous êtes bien entendu le(a) bienvenue ! ;;;;;;;;;;;;x
EVTDESCwikid.285;Your [GetFromFromRelation] [FromFrom.GetTitledFirstName] has recently sent word from [From.Capital.GetName] where [FromFrom.GetSheHe] is has just arrived on [FromFrom.GetHerHis] tour. [FromFrom.GetSheHeCap] says [FromFrom.GetSheHe] is currently enjoying the hospitality of [From.GetTitledFirstName] [From.GetOnlyDynastyName], and will be the guest of honour at an upcoming feast.;Votre [GetFromFromRelation] [FromFrom.GetTitledFirstName] a récemment envoyé des nouvelles de [From.Capital.GetName] où [FromFrom.GetSheHe] vient juste d'arriver. [FromFrom.GetSheHeCap] dit qu'[FromFrom.GetSheHe] profite actuellement de l'hospitalité de [From.GetTitledFirstName] [From.GetOnlyDynastyName], et sera l'un(e) des invités d'honneur d'un banquet.;;;;;;;;;;;;x
EVTOPTAwikid.285;Do your house proud;Fait la fierté de notre maison.;;;;;;;;;;;;x
EVTDESCwikid.287;The upcoming wedding in [Root.Location.GetName] will be an event all seek attend, even foreign guests. One such [From.Culture.GetGroupName] [From.GetManWoman] named [From.GetTitledFirstName] [From.GetOnlyDynastyName] wishes to partake in festivities. [FromFrom.GetSheHeCap] says [FromFrom.GetSheHe] is on a tour of foreign lands, and wishes to sample a [Root.Culture.GetName] wedding.;Le prochain mariage à [Root.Location.GetName] sera un évènement que beaucoup de personnes ne voudront pas manquer, même les invités étrangers. Un(e) [From.GetManWoman] [From.Culture.GetGroupName] nommé(e) [From.GetTitledFirstName] [From.GetOnlyDynastyName] souhaite participer aux festivités. [FromFrom.GetSheHeCap] dit qu'[FromFrom.GetSheHe] voyage en ce moment pour découvrir l'étranger, et souhaite assister à un mariage [Root.Culture.GetName].;;;;;;;;;;;;x
EVTOPTAwikid.287;Yes, I shall give you pride of place;Oui, je vais vous donner une place de choix.;;;;;;;;;;;;x
EVTDESCwikid.288;Your [GetFromFromRelation] [FromFrom.GetTitledFirstName] has recently arrived in [From.Capital.GetName] whilst on [FromFrom.GetHerHis] foreign tour. There, [FromFrom.GetSheHe] has been invited to many feasts and events by local dignitaries, and was even invited as a guest of honour to the wedding of [FromFromFromFrom.GetTitledFirstName] and [FromFromFromFrom.Spouse.GetTitledFirstName] hosted by [From.GetTitledFirstName] [From.GetOnlyDynastyName].;Votre [GetFromFromRelation] [FromFrom.GetTitledFirstName] est récemment arrivé(e) à [From.Capital.GetName]. [FromFrom.GetSheHeCap] a été invité(e) à de nombreux banquets et d'autres évènements par des dignitaires locaux et est même devenu un invité(e) d'honneur au mariage de [FromFromFromFrom.GetTitledFirstName] et [FromFromFromFrom.Spouse.GetTitledFirstName] organisé par [From.GetTitledFirstName] [From.GetOnlyDynastyName].;;;;;;;;;;;;x
EVTOPTAwikid.288;A [From.Culture.GetName] wedding must of been fascinating;Un mariage [From.Culture.GetName] doit être fascinant;;;;;;;;;;;;x
EVTDESCwikid.289;[From.GetTitledFirstName], your restless adventuring [GetFromRelation], has arrived back in [Root.Capital.GetName] after [From.GetHerHis] foreign tour, and apparently it was quite a debauched tour. [From.GetSheHeCap] spent many months travelling from city to city, partaking in countless wild parties and feasts, drinking copious amounts of wine and mead. It seems  [From.GetSheHe] first acquired this taste for hedonism in the brothels and taverns of [foreign_realm.Capital.GetName].;[From.GetTitledFirstName], votre aventureux(se) et agité [GetFromRelation], est revenu(e) à [Root.Capital.GetName] après son long voyage, et apparemment ce fut un voyage de débauché. [From.GetSheHeCap] a passé de nombreux mois à voyager de cités en cités, participant à un nombre incalculable de banquets et de fêtes où [From.GetSheHe] a copieusement bu et mangé. Il semble que ses goûts hédonistes se soient déclarés dans les tavernes et les bordels de [foreign_realm.Capital.GetName].;;;;;;;;;;;;x
EVTOPTAwikid.289;I'm sure there will be some clear memories;De sacrés souvenirs…;;;;;;;;;;;;x
EVTDESCwikid.290;I have come into my inheritance of [Root.PrimaryTitle.GetName], and so must travel home to [Root.Capital.GetName] from my foreign tour and assume my duty.;J'ai hérité de [Root.PrimaryTitle.GetName], et je dois mettre fin à mon voyage et retourner à [Root.Capital.GetName] pour assumer mon devoir.;;;;;;;;;;;;x
EVTOPTAwikid.290;It was good whilst it lasted;C'était une super expérience.;;;;;;;;;;;;x
went_on_foreign_tour;Has Been on Foreign Tour;A fait un grand voyage;;;;;;;;;;;;x
went_on_foreign_tour_desc;This character went on a tour of foreign lands in their youth;Ce personnage a fait un voyage à l'étranger dans sa jeunesse.;;;;;;;;;;;;x
EVTDESCwikid.291;[FromFrom.GetTitledFirstName] [FromFrom.GetOnlyDynastyName] has started a quest;[FromFrom.GetTitledFirstName] [FromFrom.GetOnlyDynastyName] a débuté une quête;;;;;;;;;;;;x
offer_quest;Propose Foreign Tour;Proposer un voyage à l'étranger;;;;;;;;;;;;x
offer_quest_desc;Offer to fund a tour of foreign lands for [Root.GetTitledFirstName], so that [From.GetSheHe] may learn and become a better [From.GetManWoman].;Offrir  à [Root.GetTitledFirstName] de financer son voyage à l’étranger, afin qu’[From.GetSheHe] puisse découvrir la vie et devenir une meilleur personne. ;;;;;;;;;;;;x
TOOLTIPrejected_adventure;Has NOT already rejected or been denied a quest\n;N’a PAS déjà refusé ou s’est vu refuser une quête\n;;;;;;;;;;;;x
TOOLTIPwikid.292;[Root.GetTitledFirstName] will respond to your proposal;[Root.GetTitledFirstName] va répondre à votre offre;;;;;;;;;;;;x
